key,jp,en,commenth_so_03_02_119,んっ、さ、最後までっ、たくさん動いてっ……たくさん気持ち良くしてあげるですっ！　だからっ、いっぱい出してくださいですぅっ！,"Well, to the end, a lot of movement ... I will make you feel good a lot! That's why you should put out a lot!",
h_so_03_02_120,はいですっ……お尻の中っ、いっぱいぴゅっぴゅしてくださいですっ！,"Yes, it is ... in the butt, please do a lot of puffing!",
h_so_03_02_121,あっ、届いてるですっ……中っ、深いところまでっ……,"Oh, it's reachable ...... middle, deep place ......",
h_so_03_02_122,あっ、す、すごく暴れてるっ……私の中っ、広がっちゃうですよぉっ！,"Oh, uh, I'm really stupid ...... I'm inside, I'm spreading!",
h_so_03_02_123,あぁんっ、嬉しいですっ！　一つになったままっ、イッてもらえるのっ、幸せなのですよぉっ！,"Oh, I'm happy! Leaving it alone, I will be happy, I am happy!",
h_so_03_02_124,避妊しててもっ、あなたの気持ちっ、たくさん感じるですよっ！　嬉しいのですっ！,"You are contraceptive, more comfortable, you feel a lot! I'm happy so it is!",
h_so_03_02_125,あぁっ、お尻の中っ……すごくっ、熱いのですっ！,"Oh, inside of the ass ...... It's so hot, it's so hot!",
h_so_03_02_126,んっ、中でっ、出してもらえるとっ……激しくてっ、熱くてっ……気持ちいいのですっ……,"It can be said that inside, it is getting out ... .... It's fierce, it's hot ...... It feels good ......",
h_so_03_02_127,あっ……いっ、イくですぅっ！,"Ah ......, it's going to rain!",
h_so_03_02_128,イッちゃうですぅっ！,It's cool!,
h_so_03_02_129,あ、あっ、お、大きいっ……ふあああぁっ！,"Oh, oh, oh, big ... ... Faaaa!",
h_so_03_02_130,んんんっ！　イッちゃうですぅぅっ！,Thunder! Is not it っ ち ゃ う っ!,
h_so_03_02_131,イく瞬間、あなたのこと、いっぱいいーっぱい締め付けたですよ。感じてくれたですか？,"At the very moment, I've tightened all over you a lot. Did you feel it?",
h_so_03_02_132,こんな風に一緒にイけるのって……やっぱり相性がいい証拠なのです！,You can go in together like this ... ... It is a good companion proof!,
h_so_03_02_133,一緒にイッて……熱を感じて……今日は最高にハッピーな日なのです,Together with you ... ... I feel a fever ...... Today is the most happy day,
h_so_03_02_134,今、あなたのがお腹の中に入ってるですよ……熱くて……気持ちいいです……,Now you are in my stomach ... ... It's hot ... It feels good ...,
h_so_03_02_135,危険日だって承知の上で……こんなに出してもらえたこと……本当はすっごく幸せなのですよ,Knowing even a dangerous day ...... What I got so far ...... I am really very happy,
h_so_03_02_136,えへへ、やっぱり……ゴムなんてないほうがずっとずーっと気持ちが繋がるですね,"Ehh, after all ... There is nothing rubber has been feeling connected for a long time",
h_so_03_02_137,うぅ、簡単にイかされちゃったのです……あなたと相性が良すぎなのですよ,"Wow, it was easy to get it ...... It is too compatible with you",
h_so_03_02_138,こんなに気持ち良くなれるなんて……やっぱりあなたを信頼してるから……ですよね？,"It makes me feel so comfortable ... ... as I trust you, after all ... is not it?",
h_so_03_02_139,最後……私、きゅうって締まったの分かったですか？入り口……きゅうぅって……,"The end ... ... I, did you know that the cushion was closed? Entrance ...... Cure ...",
h_so_03_02_140,えへへ、いろいろな部分であなたを気持ち良くさせてあげられて……私、自分の身体のこと、好きになっちゃうですよ,"Well, I let you feel comfortable in various parts ...... I will like my body, I love you",
h_so_03_02_141,お尻、擦られる度にっ、気持ち良くなっちゃうです……,"Every time I rub it, it gets pleasant ... ...",
h_so_03_02_142,あなたが教えてくれたから……私、お尻好きになっちゃったですよ,Because you taught me .... I got to like your ass,
h_so_03_02_143,コンドームの感触なんて、途中からほとんどなくなってたです。あなたの身体が熱くて……えへへ,The feeling of condom was almost gone from the middle. Your body is hot ...,
h_so_03_02_144,避妊してても、やっぱりエッチって気持ちいいですね。大きくイッちゃったです……,Even though I contraceptively I feel comfortable after all. It was great!,
h_so_03_02_145,私……今きっと世界で一番幸せなお顔してるです……えへへぇ,I ... ... I'm sure I'm the happiest face in the world ... ___ ___ 0,
h_so_03_02_146,恥ずかしいですけど……まだ……中がびくびくしてるですよ……,It's embarrassing but ... ... yet ... inside is blowing ... ...,
h_so_03_02_147,ちょっとエッチですけど……やっぱり危険日って気持ちいいのです……本能なのですよ,It's a bit odd but ... it's a pleasant danger day ... It's instinctive,
h_so_03_02_148,もういっそ……今ここで受精しちゃえばいいですのに……なんて……えへへ,Already ... ... now I wish to fertilize here ... why ... ... Eh,
h_so_03_02_149,私、ちょっとイきすぎじゃないですか？エッチな娘みたいで恥ずかしいですよ……,"I am a bit overkill, are not you? It's embarrassing like a horny daughter ......",
h_so_03_02_150,あなたにしてもらうとすぐイッちゃうです……もう、上手すぎなのです！,"As soon as you do, it will be fine ... It is already too good!",
h_so_03_02_151,あなたが動いてくれたから……お尻でも気持ち良くなれたです……ありがとうなのです,Because you moved ... I was able to feel pleasant even in the butt ... ... Thank you,
h_so_03_02_152,私……あなたとだったら、どこの部分でも気持ち良くなれるですよ……えへへ……,"I ... ... If you were with you, you could be comfortable anywhere ... ....",
h_so_03_02_153,お尻なのに……簡単にイッちゃうです……はぅ、逆にお尻だから……なのですか？,"Even though it's a butt ...... It's easy to keep up with ... ... Ha, because it's an ass, right?",
h_so_03_02_154,あなたと二人だと思うと……安心して、すぐ乱れちゃうですよ……はぅ……,When thinking that it is with you and you ... ... It is safe and it will be disturbed soon ... ... Ha ...,
h_so_03_02_155,もしも今、ゴムに穴が開いちゃったら……全部、私の中に流れてくるですか？　あんっ、考えたら興奮しちゃったです……,"If a hole is opened in rubber now ... ... Does it all flow into me? Thanks, I was excited when I thought ... ...",
h_so_03_02_156,コンドームがあるからこそ、感じられるエッチもあるですよね,"It is because there is a condom, there are also etches that are felt",
h_so_03_02_157,あなたのこと、お腹の中まで感じられるです……世界で一番近くにいるですよ,I can feel you inside my stomach ... You are the closest in the world,
h_so_03_02_158,えへへ……幸せすぎて……もう離れたくないですよ……,Well ... I'm too happy ... I do not want to leave anymore ......,
h_so_03_02_159,えへへ、危険日の私に中出ししちゃうあなたのお顔、しっかり見ちゃったです。可愛かったですよ,"Well, I saw your face firmly sneaking in to me in a dangerous day. It was cute.",
h_so_03_02_160,ドキドキしてたせいで、私、いっぱい乱れちゃったです……,"I was so excited, I was disturbed ......",
h_so_03_02_161,あなたの切なそうな吐息……すごく……興奮しちゃったです……,Your breathless sigh ... ... It was so exciting ... I was excited ...,
h_so_03_02_162,最後、あなたがぎゅうって抱いてくれた時、身体中がびくびくしちゃったですよ,"Lastly, when you embraced me, the inside of my body was afraid",
h_so_03_02_163,あなたの熱いのを感じながらイけて……えへへ、気持ち良かったのです,While feeling your hotness ... It was a pleasant feeling,
h_so_03_02_164,こんな素敵なこと……教えてくれてありがとうなのです,Such a nice thing ...... Thank you for telling me,
h_so_03_02_165,危ない日なのに生で一緒にイッちゃうなんて……私達、乱れすぎですかね？　えへへ,"It's a dangerous day but I'm living together alive .... We are too disturbing, are not you? Ahh",
h_so_03_02_166,一番女の子らしい日の私……しっかり感じてくれたですか？　ふふーっ,I am the most girls day ... ... did you feel it well? Fluffy,
h_so_03_02_167,今のイき方は……ちょっと激しすぎたかもです……恥ずかしい……,The way you are now ... may have been a bit too intense ... ... It's embarrassing ... ...,
h_so_03_02_168,あなたにはもう何もかも見られちゃった気がするです……えへへ,I feel like I've seen everything anymore ... ... Eh,
h_so_03_02_169,あ……お尻の中のもの……一体どうやって出せば良いですか……？　み、見ちゃダメなのです！,Ah ... ... what in the butt ...... How do I get out? I can not see it!,
h_so_03_02_170,はぅっ、ち、力加減を間違うと一気に溢れちゃいそうなのですっ！,"Well, after all, it seems that it will be overflowing at once if you make a mistake in power adjustment!",
h_so_03_02_171,お尻ってどうして気持ち良くなるように出来てるですかね？,Why is your butt made to feel comfortable?,
h_so_03_02_172,あっ、すごく飛んでるですっ……あっ、あっ、あんなに遠くまで！,"Oh, I'm flying very much ... Ah, there, ah, how far so far!",
h_so_03_02_173,はわっ、いっぱい出てるですよっ！　あっ、まだ出るですっ！,"Hurry, there are plenty out! Oh, I still get out!",
h_so_03_02_174,えへへ、いっぱい出たですね,"Well, a lot of them came out",
h_so_03_02_175,気持ち良かったですか？,Did you feel comfortable?,
h_so_03_02_176,どろどろの精液、たくさん飛び散ったですよ,"Muddy sperm, it scattered a lot",
h_so_03_02_177,んんっ、垂れちゃう時もびくってなっちゃうです……,"Well, it will get scared when I hang around ... ...",
h_so_03_02_178,あぅっ、せっかく出してもらったのに……出ちゃったです……,"Ohhh, I had you pick it out ... ... I got out ...",
h_so_03_02_179,あんっ、お尻……熱いのが戻っちゃったですよ……,"Ansan, butt ... ... the hot one has returned ... ...",
h_so_03_02_180,はぅ……お尻、恥ずかしいですけど……あなたに見られると、また感じちゃうです……,"Ha ... .... But it's embarrassing but ... ... when I see you, I feel it again ......",
h_so_03_02_181,もう終わっちゃうですか……？,Is it over already?,
h_so_03_02_182,もう少しくっつきたいですよ……,I want to stick a little more ......,
h_so_03_02_183,はいです、一気に来てほしーです,"Yes, I want you to come at a stretch",
h_so_03_02_184,えへへ、お願いするですよ,Please do me a favor,
h_so_03_02_185,ゴム着けてくれないと……不安なのですよ,I have to wear rubber ... ... I'm worried,
h_so_03_02_186,コンドーム、着けてくれないですか……？,Can not you wear a condom ... ....?,
h_so_03_02_187,さすがに今日はゴムを着けてくださいなのですー！,"As expected, please wear rubber today!",
h_so_03_02_188,危険日なので……今日だけは避妊してくださいです,Because it is a dangerous day ... ... Please contrace only today,
h_so_03_02_189,え、えへへ……お尻、気に入ってくれたですか？,"Huh, huh ... ... did you like it?",
h_so_03_02_190,はい……お尻、使ってくださいです……,"Yes ... .... Butt, please use ......",
h_so_03_02_191,はぅ……お尻は……ちょっと厳しいですよ,Ha ... .... Ass is ...... It's a bit tough,
h_so_03_02_192,ごめんなさいです……お尻は痛いですから……,I am sorry ...... Because the butt hurts ......,
h_so_03_02_193,ふぁっ……感じちゃうです……,Huh ... ... I feel it ......,
h_so_03_02_194,あんっ、もう気持ちいいですよっ……,"Huh, it feels good anymore ... ___ ___ 0",
h_so_03_02_195,ふぁっ、突然来ちゃったですっ……,"Huh, suddenly I came ......",
h_so_03_02_196,い、一気に奥までっ……ふあぁっ！,"Well, all in one place ... Fufa!",
h_so_03_02_197,わわ、大きくて硬い……気持ちいいですよ……,"Wow, big and hard ... It feels good ...",
h_so_03_02_198,あぁんっ、お尻っ、キツイですっ……,"Oh, well, it's hard, ......",
h_so_03_02_199,ふぁっ、は、入っちゃった……ですっ……,"Huh, I got in, ... ....",
h_so_03_02_200,あっ、えっ、ま、待ってぇっ！,"Oh, wait a while, wait!",
h_so_03_02_201,あぅっ、そこお尻ですっ……よぉっ！,"Ohhh, there's that ass ...... Yo!",
h_so_03_02_202,全部繋がってる感じがして……嬉しいです,I feel like I'm connected all ... I'm happy,
h_so_03_02_203,こういう時間が……きっと幸せなのですよ,Such a time ... ... I am surely happy,
h_so_03_02_204,んんっ、お尻、熱いですよ……,"Hm, ass, it's hot ......",
h_so_03_02_205,な、なんだか落ち着かないです……,I do not feel calm ...,
h_so_03_02_206,どうしちゃったですか？,What happened?,
h_so_03_02_207,体位、変えた方がいいですかね？,"You should change your posture, do not you?",
h_so_03_02_208,はふっ、お尻の感覚、ちょっと変わってるですよ……,"Haha, sensation of butt, it is slightly different ...",
h_so_03_02_209,ひあっ、抜く時、つい声が出ちゃうです……,"Hit, when I pull it out, a voice came out ......",
h_so_03_02_210,ゆっくりでもすごく感じちゃうです,I feel it very slowly,
h_so_03_02_211,静かに動いた方が感覚が鮮明になるですよ,The person who moves quietly makes the sense clearer,
h_so_03_02_212,はわっ、こ、こんなに早く動いちゃうですかっ……,"Hashi, this, will you move so quickly ...?",
h_so_03_02_213,だ、出し入れの感覚がすごくリアルなのですっ！,"However, the sense of taking in and out is so realistic!",
h_so_03_02_214,あ……この感じ……お尻独特の気持ち良さなのです……,Ah ... this feeling ...... It's a peculiar pleasantness in the butt ... ...,
h_so_03_02_215,ふふっ、お尻、窮屈な分、感じちゃうですよ,"Huhu, ass, cramped, I feel it",
h_so_03_02_216,ふぁっ、そんなに早く動いたらっ……お尻っ、がくがくしちゃうですよっ！,"Fur, if it moves so fast ... ___ ___ ___ 0",
h_so_03_02_217,あぁんっ、お尻っ、勝手に動いちゃうですっ１,"Oh, I'll move on my own without permission 1",
h_so_03_02_218,強くされるのっ……気持ちいいですっ！,It will be strengthened ... It feels good!,
h_so_03_02_219,あっ、このままっ、身体ごと押しつぶして欲しいですっ！,"Oh, leave it like this, I want you to crush the body together!",
h_so_03_02_220,強くてっ、早くてっ……んんっ、激しいですぅっ！,"It is strong, fast, ... well, it is intense!",
h_so_03_02_221,あぁっ、これっ、すごく感じるですよぉっ！,"Oh, this is what I feel!",
h_so_03_02_222,あぁっ、お尻っ、いっぱい反応しちゃうですっ……,"Oh, my ass, I will react a lot ... ...",
h_so_03_02_223,んんっ！　お尻の中っ、ねじ込まれてるですよぉっ……,"Viewing! Inside the butt, it is screwed ......",
h_so_03_02_224,ああっ、激しいのっ……お尻でも気持ちいいですぅっ！,"Oh, it's fierce ... It feels good even in your ass!",
h_so_03_02_225,こ、こんなに激しくされてっ……だけどっ……感じちゃうですっ……,This is done so intensely ...... just ... ... I feel it ......,
h_so_03_02_226,んはぁっ、私っ、また我慢出来なくっ……なるですっ……,"Ha ha, I can not stand it again ... ... Well ......",
h_so_03_02_227,気持ちいいのっ……限界までっ、来てるですよぉっ！,"It feels good ...... The limit has come, it is!",
h_so_03_02_228,あっ、こ、このままだとっ、また私っ、イッちゃうですっ……,"Oh, here it is, as it is, I am still sucking ......",
h_so_03_02_229,動くの早いですぅっ……これじゃまたっ、すぐにっ……んんんっ！,"It will be moving soon .... In that case, I will be back soon ......!",
h_so_03_02_230,んんっ……わ、私でっ、イけそうですかっ……？,"Huh ... ... I, I'm going to get it ... ___ ___ 0",
h_so_03_02_231,いっぱい感じてっ……我慢なんてっ、しないでほしーですっ……,"I feel a lot ... ... Do not endure, do not want to ......",
h_so_03_02_232,あぁんっ、激しいですっ……も、もしかしてっ、そろそろ射精っ……するですかっ？,"Oh, it's fierce ... Well, maybe you're going to ejaculate soon ... Are you sure?",
h_so_03_02_233,最後までっ……私が絶対に気持ち良くしてあげるですっ……いっぱい感じてほしーですよっ……,Until the end ...... I will absolutely feel comfortable ... I feel a lot full of feeling ......,
h_so_03_02_234,はぁぅっ、お尻っ、なのにっ……んんっ、びくびくがっ、大きくなってるですっ！,"Ha ha ha, it's a huge ...... Huh, it grows big, it's getting big!",
h_so_03_02_235,あぁっ、下半身全部震えてるですっ！　き、気持ち良すぎてっ、ふわぁっ！,"Oh, the lower part of my body is trembling! You are too pleasant, Fuwa!",
h_so_03_02_236,やぁぅっ、お尻っ、激しいのダメですっ……い、イッちゃうですよぉっ！,"Oh yeah, it's a fierce battle ... It's a bad guy ... It's okay!",
h_so_03_02_237,こ、こんな風にされたらっ、私っ、お尻でまたっ……限界っ……,"Well, when I get like this, I'll be back in the butt ... ... the limit ......",
h_so_03_02_238,あなたのお顔……気持ち良さそうです……えへへ、私のお尻、いっぱい感じてくださいですーっ！,"Your face ... seems to be comfortable ...... Huh, my butt, please feel a lot!",
h_so_03_02_239,あんっ、お尻の中っ、たくさん抉れてるですよっ……イけそうですか？,"Oh, in the butt, a lot of it is hollowing out ... ___ ___ ___ 0",
h_so_03_02_240,はぅっ、も、もうイッちゃいそうですかっ？　お尻っ、好きなだけ使ってほしいですっ……,"Huh, I guess it is going to be funny yet? I want you to use as much as you want ......",
h_so_03_02_241,あぁぅっ、いっぱい突いてくださいですっ……お尻っ、思う存分使ってくださいですぅっ！,"Ahhhhh, please push a lot ... ... Please be assured, please use it as much as you want!",
h_so_03_02_242,やっ、んんっ、いっ、イくっ……ですっ……ふああぁっ！,"Do it, do it, say it, huh ... ... ... Faaaa!",
h_so_03_02_243,あぁっ、もうっ……私っ、イくですぅっ！,"Oh, already ... I, I'm going out!",
h_so_03_02_244,ふぁっ、このままっ……一緒にっ……イッてくださいっ……いっぱい締め付けるからっ……イッてっ……んんんっ！,"Huh, leave me like this ... ... Please join ... ___ ___ ___ 0 ... ___ ___ 0 ... ___ ___ ___ 0",
h_so_03_02_245,最後はっ、一緒がいーですっ……一緒にっ、イきたっ……ふやあぁんっ！,"Finally, the same is good ...... together, I came ...... Fuya!",
h_so_03_02_246,あんっ、嬉しいですっ……たくさん気持ち良くなってっ……たくさん出してくださいですっ！,"Huh, I'm happy ...... I feel a lot of pleasant ... ... Please put out a lot!",
h_so_03_02_247,最後までっ、しっかり動くですからっ、たくさんイッてくださいですぅっ！,"I will move firmly until the end, so please do a lot of it!",
h_so_03_02_248,またたくさん出して欲しいですっ！,I also want to have lots more!,
h_so_03_02_249,またっ、私で気持ち良くなってくださいですっ、いっぱい出してくださいっ！,"Once again, please feel comfortable with me, please give me a lot!",
h_so_03_02_250,はぅっ、またっ、出してくれるですかっ！？,"Huh, are you going to pick me up again? What?",
h_so_03_02_251,あっ、んんっ！　私の身体っ……気持ちいいですかっ！？,"Oh, no! My body ... ... Do you feel good! What?",
h_so_03_02_252,あ……ゴム……たぷたぷしてる……感じちゃうです……,Ah ...... Rubber ... ... It's feeling ... ... I feel it ......,
h_so_03_02_253,んんっ、中でっ、暴れてるですっ……ふあぁっ！,"Mang, inside, he is stupid ... Fufa!",
h_so_03_02_254,ふぁぁっ、もうっ、限界ですっ……お尻だけどっ……もうっ、限界っ……わ、私っ、イッちゃっ……んんっ、イくですうぅ！,"Faa, already, at the limit ... It's an ass ... But, already, the limit ... っ て, I, っ ち ゃ っ ち ゃ ... じ ゃ ん, it is rewarding!",
h_so_03_02_255,あぁんっ、このままお尻っ……いっ、イッちゃうですぅっ！,"Ohhh, like this as it is ... it's sucking!",
h_so_03_02_256,た、たくさんっ、ぎゅうってするからっ……一緒にっ、イッてくださいっ……ああぁんっ！,"Well, it's a lot to tell me ... Well, please do it together ... ___ ___ 0",
h_so_03_02_257,お尻の中っ……二人でびくびくっ……ふあぁっ、考えただけで興奮するですよぉっ！,"In the butt ...... Two people scared ... ... Faa, I just got excited just thinking!",
h_so_03_02_258,はふっ、あなたの好きな時にっ……イッてくださいですっ！　わ、私っ、頑張って気持ち良くするですよっ！,"Wait, when you like it ... Please be careful! Wow, I'll do my best and make it feel good!",
h_so_03_02_259,またっ、イけそうですか？　はふっ、嬉しいですっ！　私のお尻っ、自由に使ってくださいですぅっ！,"Want to go back again? Haha, I'm happy! Please use my ass, please freely!",
h_so_03_02_260,ふぁっ……またたくさん出てるですよぉ……,Fu ... ... Also I have a lot of out ...,
h_so_03_02_261,ふあぁっ、中っ、一気に熱くなったです……,"Faa, it is getting hot at a stretch ......",
h_so_03_02_262,さっき出したばかりなのに……またたくさん跳ねてるです……,Even though I just got out earlier ... .... I'm also leaping a lot again ...,
h_so_03_02_263,きっと……コンドームの中は熱々なのです……,Surely ... inside the condom is hotly ... ...,
h_so_03_02_264,お尻の中っ、奥まで届いてますよぉっ……,"Inside my ass, I'm reaching all the way ......",
h_so_03_02_265,んっ……さっき出したばかりなのにっ……こんなに跳ねてるですっ……,Hmm ... ... I just did it just a while ago .... I'm leaping like this ...,
h_so_03_02_266,あっ、あっ、あっ、ふあああぁっ！,"There, ah, there, Faaaaa!",
h_so_03_02_267,あっ、もうっ、ダメっ……んあああぁっ！,"Ah, one more thing ... ... Ah!",
h_so_03_02_268,もうっ、限界ですぅっ！　ふああぁっ！,"Well, it's the limit! Faaaa!",
h_so_03_02_269,ああぁっ、イッちゃうですうぅっ！,"Ohhh, I guess!",
h_so_03_02_270,あなたと一緒なの……幸せなのです……,I am with you ... I am happy ... ...,
h_so_03_02_271,えへへ、すっごく気持ち良かったです……,"Well, I felt very comfortable ... ...",
h_so_03_02_272,こんなに気持ちいいエッチ……毎日でもしたくなるです……,Such a pleasant sex ... ... I want to do it everyday ... ...,
h_so_03_02_273,一緒にイけるの……すごく温かいです……,I will stay with you .... It is very warm ......,
h_so_03_02_274,危険日だから……こんなに感じちゃったのです……それに一緒にイけましたし、えへへ、嬉しいです,Because it's a dangerous day ... I felt it like this ... ... I wish for it together and I am happy.,
h_so_03_02_275,危険日でもこんなに気持ちいいなら……なんて思っちゃうです,If it feels like a dangerous day so much ... ... I guess,
h_so_03_02_276,ギリギリまで我慢したですけど……イッちゃったです……,I endured it until the end ... ... I was caught ... ...,
h_so_03_02_277,うぅ……あまりの気持ち良さで……身体が勝手にイッてしまったのです……,Uh ... with a lot of pleasures ... ... the body has been arbitrarily damaged ......,
h_so_03_02_278,えへへ、一緒にイけて嬉しいですよ。お尻はちょっと恥ずかしいですけど……,"Well, I'm happy to be with you. The butt is a bit embarrassing though ... ...",
