key,jp,en,commenth_hh_03_02_024,すごいです……独特の感触なのです……,It's amazing ... ... It's a unique feel ... ...,
h_hh_03_02_025,舐めてるとだんだん夢中になっちゃうです……,I am getting crazy gradually as I lick it ......,
h_hh_03_02_026,はふ……あなたのここ、びしょびしょになっちゃったですよ,Have you ... I got soaked in your place here,
h_hh_03_02_027,ここもやっぱり気持ちいいですか？,Do you still feel comfortable here too?,
h_hh_03_02_028,独特の食感で……えへへ、美味しいです,"With a unique texture .... Eh, I'm tasty",
h_hh_03_02_029,えへへ、ぷにぷになのですよ,"Well, it is Pon Poni",
h_hh_03_02_030,ここはふやふやしてるですね,"It's funny here, is not it?",
h_hh_03_02_031,えへへ、ころころしてるです,"Well, I'm up and running",
h_hh_03_02_032,中にしっかり入ってるですよ,I am firmly in,
h_hh_03_02_033,先っぽ、気持ちいいですか？,Do you feel comfortable ahead?,
h_hh_03_02_034,えへへ、身体震えてるですよ,"Well, my body is trembling",
h_hh_03_02_035,先っぽ、舌で突くとぴくって動くです,"Before me, when I push it with my tongue, it moves swiftly",
h_hh_03_02_036,舌の上でころころして……えへへ、私も気持ちいいです,"Rolling up on the tongue ...... Huh, I feel comfortable, too",
h_hh_03_02_037,お口の中いっぱいなのです……はふ……,It is full of your mouth ... ... Ha ...,
h_hh_03_02_038,吸い込んでみても大丈夫ですか？　ずりゅりゅ……,Is it okay if I inhale it? Crochet ....,
h_hh_03_02_039,涎、たくさん出ちゃうです……,"Drunk, a lot will come out ......",
h_hh_03_02_040,お口の中って気持ちいいですか？,Do you feel good in your mouth?,
h_hh_03_02_041,私のおっぱい……どうですか？,My boob ... How are you?,
h_hh_03_02_042,男子ってこういうの好きなんですかね？,Do you like boys like that?,
h_hh_03_02_043,あはは、おっぱいも感じてきちゃうです……,"Haha, I also feel boobs ......",
h_hh_03_02_044,少しは上手になったですか？,Was it a little better?,
h_hh_03_02_045,寄せてっ、挟んでっ……んんっ……,"Pull it, pinching it ...... ....",
h_hh_03_02_046,ひあっ、乳首が刺激されてるですっ……,"Hi there, my nipple is being stimulated ......",
h_hh_03_02_047,左右別々に動かしてみるです……ぐりぐり……,I try to move it separately right and left ... .... boring ... ...,
h_hh_03_02_048,ふぁっ……は、跳ねたらおっぱい感じちゃうですよーっ！,Fa ... ... I will feel tits when I bounce!,
h_hh_03_02_049,少しは出来るようになってきたですか？,Have you come to be able to do a little?,
h_hh_03_02_050,おっぱいが遠くて……んっ、しょっ……,"The boobs are far ... ... Huh, ... ...",
h_hh_03_02_051,早くするとびくびくしちゃうですね,I am afraid if it is made earlier,
h_hh_03_02_052,もっと早くしていくですよ,I will make it earlier.,
h_hh_03_02_053,おっぱい小さいから……お口で気持ち良くなってくださいですーっ,Because your tits are small ... Please be comfortable with your mouth,
h_hh_03_02_054,あ……こうやって身体を反らせば……おっぱい当てながらぺろぺろできるです,Ah ... ... If you bend your body like this ... ... You can lick it with your breasts,
h_hh_03_02_055,おっぱいの中に舌も入れちゃうです……れるるっ……,I also put my tongue in the boobs ...... Ruruu ......,
h_hh_03_02_056,おっぱいと舌で……あなたのここ、ぜーんぶ包み込んじゃうですよ,"With breasts and tongue ...... You are wrapping around here, oh yeah",
h_hh_03_02_057,お口も一緒に動かすですっ……,Move your mouth together ......,
h_hh_03_02_058,挟んだまま、ゆっくり動かすですっ,Put it slowly while pinching,
h_hh_03_02_059,もうお口は開けたまま動くですっ……んっ、じゅるっ……,"Your mouth will keep moving with your mouth open already ......, じ ゅ う っ ...",
h_hh_03_02_060,はふっ、舌の上で滑ってるですーっ……,He is slipping on his tongue ......,
h_hh_03_02_061,こんなおっぱいでも……あなたには気持ち良くなってほしーのです,Even with such boobs ... you want me to feel pleasant,
h_hh_03_02_062,おっぱい、しっかり押しつけるですよっ……お口も動かすですー！,"Breasts, I firmly press it ... ___ ___ ___ 0",
h_hh_03_02_063,おっぱいで挟んで……そのまま……はむっ……,I caught her with breasts ... ... as it is ...... Hum ...,
h_hh_03_02_064,んっ、お口から抜けないようにしなきゃですねっ……あむむっ……,I guess I should try not to get out of my mouth ... ... Awmu ...,
h_hh_03_02_065,びくびくしてるですっ……いっぱい感じてくださいなのです,I'm afraid I'm afraid ... ... Please feel a lot,
h_hh_03_02_066,ここ、こんなに膨らむですね。ドキドキなのですっ……,"Here, it inflates so much. It's so exciting ......",
h_hh_03_02_067,あ……えへへ、震えてくれるの嬉しいです……,"Oh ...... Hey, I'm glad I tremble ... ...",
h_hh_03_02_068,たくさんぺろぺろするですよっ……,I have lots of licking ... ___ ___ 0,
h_hh_03_02_069,いーっぱい舐めてあげるです,I'm going to lick it,
h_hh_03_02_070,どんどん気持ち良くなってくださいですー,Please be more and more pleasant -,
h_hh_03_02_071,いっぱい濡らしてあげるですからねっ……,I will get it wet a lot ....,
h_hh_03_02_072,もっと気持ち良くなっていいですよ,You may be more comfortable,
h_hh_03_02_073,あなたが喜んでくれると……私も嬉しいのです,When you are pleased ... I am happy too,
h_hh_03_02_074,どこに出しても大丈夫ですよ,No matter where you put it out,
h_hh_03_02_075,はふ……出して欲しいのです,Hahah ... .... I want you to put it out,
h_hh_03_02_076,はいぃ、いつでもっ……,"Okay, when do you have it ......",
h_hh_03_02_077,たくさん出してくださいですー,Please give me lots -,
h_hh_03_02_078,あなたの好きなところで出して欲しいです,I want you to put out in your favorite place,
h_hh_03_02_079,どのタイミングでもいいですよっ,Either timing is fine.,
h_hh_03_02_080,はふっ、じゅるるっ、了解ですっ……,"Huh, Jururu, OK.",
h_hh_03_02_081,外にっ……いいですよっ……,Outside ...... It's okay ... ___ ___ 0,
h_hh_03_02_082,んっ、いつでも大丈夫なのですっ……,"So, it's okay anytime ......",
h_hh_03_02_083,お口の中っ……いいですよっ……,In your mouth ...... It's okay ......,
h_hh_03_02_084,はふっ……だ、出してくださいですっ……,"Wait ......, please let me out ......",
h_hh_03_02_085,お口の中っ、いっぱいにしてくださいですっ,"Please fill in your mouth, please",
h_hh_03_02_086,はわっ……出てるですっ……,Huh ... ... I'm outta ... ...,
h_hh_03_02_087,すごいっ……たくさんですっ……,It's amazing ... ... a lot ...,
h_hh_03_02_088,はぁぁ……熱くて……とろとろですぅ……,Haa ... ... It's hot ...... It's rough ... ...,
h_hh_03_02_089,私で気持ち良くなってくれたですか？,Did you feel comfortable with me?,
h_hh_03_02_090,こんなに感じてくれて……幸せなのです,It feels like this ... ... I am happy,
h_hh_03_02_091,えへへ、あなたの物にしてもらえたって感じがするです。嬉しい,"Well, I feel like having you do it. happy",
h_hh_03_02_092,とろっとしてて……喉に熱さを感じちゃうですよ,Sticky ... ... I feel hot in my throat,
h_hh_03_02_093,いーっぱいごっくんしたですよ,I'm a bad one.,
h_hh_03_02_094,えへへ、あなたの香り、幸せです,"Well, your scent, I am happy.",
h_hh_03_02_095,濃いのがたくさん……溜まってたですか？,A lot of dense ... ... Was it collected?,
h_hh_03_02_096,えへへ、すっきりできたですか？,"Well, could you be clearer?",
h_hh_03_02_097,こんなに濃くなるまで溜めてたですか？　えへへ,Did you accumulate it until it became so thick? Ahh,
h_hh_03_02_098,えへへ、次はもっと気持ち良くしてあげるのです！,"Ehh, let's make you feel more comfortable next time!",
h_hh_03_02_099,まだ出来るなんて……嬉しいですよ,I can not do it yet ... I'm happy.,
h_hh_03_02_100,また大きくしていくですよ,I will make it big again,
h_hh_03_02_101,ゆっくり感じてくださいです,Please slowly feel it,
h_hh_03_02_102,どんどん気持ち良くなるですよ,It will be more and more pleasant,
h_hh_03_02_103,このくらいの早さは平気ですよね,The speed of this is okay,
h_hh_03_02_104,しっかり舐めて……また濡らしちゃうです,Firmly licking ...... I will wet again,
h_hh_03_02_105,ずっとぺろぺろしたくなっちゃうですよ,I'm going to want to lick it all the time,
h_hh_03_02_106,ちょっと早く舐めちゃうですよ,I will lick a little bit,
h_hh_03_02_107,いっぱい感じてくださいですー,Please feel a lot,
h_hh_03_02_108,お口の中……たくさん感じてほしーです,In your mouth ...... I want to feel a lot,
h_hh_03_02_109,もう一度……咥えて……吸って……えへへ,Once more ... ... hugging ... suck it ...... Eh,
h_hh_03_02_110,お口の中、いっぱいになってるです……あなたの味なのですよ,"In your mouth, it is full ... it is your taste",
h_hh_03_02_111,あ……身体が勝手に激しくしちゃうです,Ah ... ... My body will intensify arbitrarily,
h_hh_03_02_112,おっぱいって気持ちいいのですか？　はふ……自分じゃ分からないのです……,Do you feel good on your breasts? Have you ... I do not understand myself ... ...,
h_hh_03_02_113,いっぱい押しつけると、おっぱい感じちゃうですよ。私も……気持ちいいのです……,"If you push it a lot, you will feel tits. Me too ... ... It feels good ...",
h_hh_03_02_114,おっぱいで動かしながら……はふっ、舌、届いてるですか？,"While moving with boobs ...... is shaking, tongue, is it reaching?",
h_hh_03_02_115,おっぱいだけじゃなくて、舌もいっぱい動かすですよ,"Not just boobs, but my tongue is moving as well.",
h_hh_03_02_116,んっ、しっかり咥えてるからっ……腰、動いちゃっても大丈夫ですよ,"So, I firmly hold on ... ... waist, it's okay if it moves",
h_hh_03_02_117,身体中でホールドなのですっ、気持ち良くなるまで逃がさないのですよ,Hold in the body so it will not let you escape until it gets pleasant,
h_hh_03_02_118,またイけそうな感じですか？　えへへ、いつでもいいですよ,"Do you feel like going back again? Eh, anytime.",
h_hh_03_02_119,こんなにふるふるしてくれて……私、頑張っちゃうです,It makes me feel like this ...... I'm doing my best.,
h_hh_03_02_120,好きな時に出していいですからね。遠慮しちゃダメなのですよ,You can put it out whenever you like. You should not hold back.,
h_hh_03_02_121,我慢なんてしちゃダメなのです。何回でも出してほしーですよ,You should not hold back. I want you to put it out any number of times,
h_hh_03_02_122,んっ、いつでも射精していいですよっ……気持ち良くなってくださいです,You can always ejaculate ... ___ ___ 0,
h_hh_03_02_123,あなたの好きな時にっ……いっぱいっ……どっくんしてくださいですっ……,There are a lot of things you like ...... a lot ... ... Please lock it ......,
h_hh_03_02_124,はいなのですっ……出してっ……欲しいですっ……,"Yes, so ... Suddenly .... I want you ......",
h_hh_03_02_125,いっぱい出るところっ、見せてほしーですよっ……,"A lot going out, I want you to show me ... ___ ___ 0",
h_hh_03_02_126,たくさん出してほしーですっ……,Hang out a lot and it's great ...,
h_hh_03_02_127,私で気持ち良くなってくれるの……嬉しいですよっ,It makes me feel comfortable ... I'm happy.,
h_hh_03_02_128,好きなだけ出してほしーですよっ……最後まで感じてくださいですーっ！,You only want to put out as much as you want ... ... Please feel it till the end!,
h_hh_03_02_129,いいですよっ……いっぱいくださいですっ,It's okay ... Please fill it up.,
h_hh_03_02_130,はふっ、ふぅっ、お口の中っ……とろとろにしてくださいですっ……,"Hey, hey, in your mouth ... Please be shabby ......",
h_hh_03_02_131,このままっ、お口いっぱいにくださいですーっ……,Please leave this mouth like this ...,
h_hh_03_02_132,あっ……たくさん出てるですっ……,Ah ... ... There are a lot going out ......,
h_hh_03_02_133,わぁ、こんなに出てくれたです,"Wow, it came out like this",
h_hh_03_02_134,あ……とろとろで……くらくらしちゃうです……,Oh ... in a shabby ...... I am overwhelmed ... ...,
h_hh_03_02_135,すっきり出来たですか？　えへへ,Did you feel refreshed? Ahh,
h_hh_03_02_136,いっぱい気持ち良くなってくれたですか？,Did you feel a lot comfortable?,
h_hh_03_02_137,拭いちゃうの……もったいない気がしちゃうですよ。えへへ,I'm going to wipe ... I feel a waste. Ahh,
h_hh_03_02_138,飲み込んだ瞬間、あそこがきゅぅってしちゃったです……えへへ,"The moment I swallowed, that made me cry ... ... Eh",
h_hh_03_02_139,あなたの……すごく熱くて……美味しいのです,Your ... ... it's so hot ... it is delicious,
h_hh_03_02_140,さっきも出したのに……また濃いですよ,Even though I took it earlier ... ... It is also dark,
h_hh_03_02_141,えへへ、香りだけでくらくらするです,"Well, I smell just by smell",
h_hh_03_02_142,はいですっ……か、かけて……いいですよっ！,"Yes, it's okay ... it's okay ...!",
h_hh_03_02_143,んんっ、か、かけるですかっ……いいですよっ、好きなところにっ、出してくださいですっ！,"Well, I will take you ...... It's okay, please put it in my favorite place, please!",
h_hh_03_02_144,いいですよっ……かけたいところにっ、かけて欲しいっ……ですっ……,It's okay ... ... I want you to put it in a place I want to put on ... ... ....,
h_hh_03_02_145,んっ、また出してくれるですかっ……いいですよっ、かけてくださいですっ！,"Well, will you let me out again ...? It's okay, please put on!",
h_hh_03_02_146,また出してもらえるのっ、嬉しいですっ……熱いのっ、いっぱいかけてくださいですっ……,"I'm glad that you can get it again .... Hurry, please do a lot of ......",
h_hh_03_02_147,はふっ……また出そうっ、ですかっ……ふふっ、いいですよっ、私にっ、好きなだけっ、ぴゅっぴゅしてくださいですっ……,"Ohh ...... I'm going out again again ...... Huh, it's okay, I want you, please as much as you like, ...",
h_hh_03_03_000,おちんちん、たくさん出させてあげたいです！,"Peck, I want to let out a lot!",
h_hh_03_03_001,私がすっきりさせてあげるですからね,Because I'll make it clearer,
h_hh_03_03_002,ぜーんぶ、私が出してあげちゃうです,"Um, I'll give out.",
h_hh_03_03_003,まずはゆっくりからです。時間をかけちゃうですよ,First of all it's slowly. It's going to take time.,
h_hh_03_03_004,ふふーっ、焦らして焦らして焦らし抜くです,"Fluffy, squatting, scorching",
h_hh_03_03_005,ふぁっ、おちんちん跳ねてるです……元気元気！,"Huh, it is leaping .... I'm fine!",
h_hh_03_03_006,こーんなに早くしてるですよ。ふふっ、見えるですか？,"Hmm, what are you doing early? Huh, you see it?",
h_hh_03_03_007,おちんちん、いっぱい弄っちゃうですよ,"Pencil, I'm going to finger a lot",
h_hh_03_03_008,おちんちん喜んでくれてるですか？　ふふーっ,Are you willing for the penis? Fluffy,
h_hh_03_03_009,ずーっと舐めていたくなるですよ,I will want to lick it all the way,
h_hh_03_03_010,じっとり濡らしてあげるのです,I will wet yourself moist,
h_hh_03_03_011,おちんちん、舌の上で跳ねてるですっ……,"Pencil, I'm bouncing on my tongue ......",
h_hh_03_03_012,ふふーっ、あなたの感じてるお顔、嬉しいです,"Fuu, my face you are feeling, I'm happy",
h_hh_03_03_013,おちんちん、涎でとろとろですよー,"Ochinchin, it's salty with slime.",
h_hh_03_03_014,舌も使っちゃうです……れるれるっ……,I will also use my tongue ...... I will be ... ___ ___ 0,
h_hh_03_03_015,おちんちん、まだ大きくなってるですよー！,The penis is still getting bigger!,
h_hh_03_03_016,お口の中、おちんちんだらけなのです,"In the mouth, it is full of dumplings",
h_hh_03_03_017,おちんちん、ふっくらしてるですね,"Pencil, I'm plump",
h_hh_03_03_018,どーしてこんな形なのですかね……えっちなのですー,Why is it such a form ...... That's what it is,
h_hh_03_03_019,先っぽから透明なお汁が出てきたです……,Transparent juice came out from the beginning ......,
h_hh_03_03_020,おちんちんが動く度、私もドキドキしちゃうですよ,"Every time the dinner moves, I am excited",
h_hh_03_03_021,おちんちん、こうやって……しこしこしこ、しこしこしこ、ふふーっ,"Pencil, doing this ... .... Shokoshiko, Shokoshiko, Fuho",
h_hh_03_03_022,おちんちんの皮、ずるずる動いちゃうです……可愛い,"The skin of the penis, it moves slowly ...... cute",
h_hh_03_03_023,いっぱい擦っちゃうですよ。しこしこしこしこ,I'm scratching a lot. Wonderfully,
h_hh_03_03_024,おちんちん、擦る度にふるふるしてるです。生き物みたいなのです,"Every time I rub it, I'm sick. It is like a creature",
h_hh_03_03_025,はむ……ん……じゅるるっ……えへへ、吸っちゃったです,"Him ... ... well ... Jururaru ...... Eh, I smoked it",
h_hh_03_03_026,全部お口に入れるとすっごく楽しいのですー,It's a lot of fun when you put it all in your mouth,
h_hh_03_03_027,この中で精子作ってるですよね。何だか不思議なのです,I am making sperm in this. Something is strange,
h_hh_03_03_028,大切なお玉ちゃん……可愛がってあげるですー,An important Mr. chan ... I will pretend it is pretty -,
h_hh_03_03_029,マッサージしてる感じでいいですか？　こうやって……えへへ、リラックスリラックスなのです,"May I feel like I'm massaging? Doing this ... .... Eh, I'm relaxed and relaxed",
h_hh_03_03_030,ゆっくり転がして……時々押し上げて……えへへ、楽しいです,"Rolling slowly ...... Sometimes pushing up ... .... Eh, it's fun",
h_hh_03_03_031,ふぁっ、全体を持ち上げたら、おちんちんびくびくしたですー,"Wait a while, I lifted the whole, I was agitated",
h_hh_03_03_032,あなたのお顔、すっごく可愛くなってるですよ。感じてくれてるですね,Your face is very cute. I feel it,
h_hh_03_03_033,おちんちん、本当に可愛いです,"Pencil, it's really cute",
h_hh_03_03_034,先っぽ、お汁も舐めちゃうですよ,"Ahead of you, I will lick your soup",
h_hh_03_03_035,はふ……あなたの香りでぼーっとしちゃうですよ……,Ha fu ...... I smoke with your scent ......,
h_hh_03_03_036,先っぽ、どんどん香りが濃くなっていくですー,"Ahead of time, the fragrance will gradually become stronger -",
h_hh_03_03_037,じゅぽじゅぽいっちゃう……やらしいですね,Jujutsu Puroto ... It seems like it is,
h_hh_03_03_038,あんっ、太すぎて噛みついちゃいそうですー,"Oh, it seems to be too fat and biting",
h_hh_03_03_039,おちんちん……また膨らんでくれてるです、嬉しい……,"Pencil ... .... I'm inflating again, I'm pleased ...",
h_hh_03_03_040,いっぱい激しくするですよっ……じゅるるるっ！,It is going to be intense a lot ... じ ゅ る る る る っ!,
h_hh_03_03_041,エッチって……おっぱいまで使っちゃうのですね。えへへ、やらしいです,"Ecchi ... ... you use up tits. Well, it is kind",
h_hh_03_03_042,もう私の身体、全部あなたのために使いたいですよ,"I already want to use my body, for all of you",
h_hh_03_03_043,おちんちん挟めて、おっぱい喜んでるです。ふふーっ,I'm pleased that you hold it tightly and you are breasts. Fluffy,
h_hh_03_03_044,おちんちんくん、おっぱい気持ちいいですかー？,"Ochinchin, do you feel nice?",
h_hh_03_03_045,こんなおっぱいでパイズリなんて……本当に気持ちいいですか？私はっ……気持ちいいですけど……えへへ,Fucking with such boobs ... ... Do you really feel good? I feel good ... but it feels good ... but ...,
h_hh_03_03_046,おっぱいというよりも、身体中で擦ってあげるです。あなたのための身体なのですよ,Rubbing in the body rather than boobs. It's the body for you,
h_hh_03_03_047,おっぱいでおちんちん隠しちゃうですー,I will hide my tears with boobs -,
h_hh_03_03_048,おちんちんくんー、どこに行っちゃったですかー？　あっ、こんなところに隠れてたです　えへへっ,"Ochinchan, where have you gone? Oh, I was hiding in such a place.",
h_hh_03_03_049,こういうのも気持ちいいですか？,Do you feel good like this?,
h_hh_03_03_050,じっくり挟んで、ゆっくり舐めるですよ,"Carefully caught, you can slowly lick it",
h_hh_03_03_051,あなた……気持ちよさそうなお顔です……私も興奮しちゃうですよ,You ... ... It looks comfortable ... I am excited too,
h_hh_03_03_052,おちんちん、いろんな所から刺激しちゃうです。ふふーっ,"Pencil, I will stimulate from various places. Fluffy",
h_hh_03_03_053,こんなおっぱいでも……あなたのこと、喜ばせてあげられるですか？,Even such boobs ... ... can you please please?,
h_hh_03_03_054,えへへ、私の身体で出来ることなら何でもしてあげたいですよ,"Well, I'd like to do whatever I can with my body",
h_hh_03_03_055,おちんちんから漏れてるお汁と私の涎で……おっぱいの間べとべとなのです,With the juice leaking from the penis and my saliva ...... It is a straw during the boobs,
h_hh_03_03_056,おっぱいの谷間、とろとろのべとべとで……まるでおまんこみたいなのです,"In the cleavage of the boobs, with the sticky sticky ... ... It is as thought of being ridiculous",
h_hh_03_03_057,おっぱいもお口も……両方であなたのを温めるですよ,Breasts and mouths ...... You can warm yours in both,
h_hh_03_03_058,あなたのために全部温かくしてるですよ,I'm making it all warm for you,
h_hh_03_03_059,あんっ、あなた、腰動いてるですよっ……お口の中っ、いっぱい犯されちゃうですっ……,"Huh, you, my hips are moving ...... Inside your mouth, I will be fucked a lot ......",
h_hh_03_03_060,おっぱいを通り抜けて、お口の中を突いて……えへへ、考えただけでやらしいですー,"Go through the boobs, punch through your mouth ...... Eh, I just seem to be thinking -",
h_hh_03_03_061,あっ、おっぱい小さい分、乳首で刺激しちゃうですよっ……,"Oh, a little boobs, I will irritate with a nipple ... ___ ___ 0",
h_hh_03_03_062,ふぁ、おちんちん硬すぎてっ……私の方が気持ち良くなっちゃうですーっ！,"Fuh, it is too hard for me ...... I'm getting more pleasant!",
h_hh_03_03_063,おっぱい、大きくて良かったです。たくさん挟んじゃうですよ,Breasts are big and good. There are a lot of throws,
h_hh_03_03_064,おっぱいの中でびくびくしてるですっ……感じてくれてるですね。ふふーっ,I am afraid of being in my breasts ... ... I feel it. Fluffy,
h_hh_03_03_065,おちんちん、こんなに膨らんでるですよ。エッチなのです……,"Pencil, this is bulging like this. It's horny ...",
h_hh_03_03_066,あなたの声で私までドキドキしちゃうですよ,I will be excited with your voice,
h_hh_03_03_067,たくさんたくさん気持ち良くなてくださいですー,Please be sure to have lots of pleasant feelings,
h_hh_03_03_068,あなたが好きな時に出していいですよ,You can put it out whenever you like,
h_hh_03_03_069,はわ……あなたのお顔見てると……私まで濡れちゃうです……,Ha ... ... when you look at your face ..... I get wet to the ... ...,
h_hh_03_03_070,えへへ……感じてもらえるの嬉しい……私も感じちゃうですよ,Well ... I'm glad I can feel ... ... I feel it too,
h_hh_03_03_071,もうそろそろ出ちゃいそうですか？　えへへ、精液、待ち遠しいですよ,"Does not it seem to come about soon? Eh, I can not wait for the semen",
