key,jp,en,commenth_hh_18_01_045,小さくても、あなたを気持ちよくできるんです,Even small it makes you feel good,
h_hh_18_01_046,小さい胸でも、感じてくれてるんですね,"Even with a small breast, you feel it",
h_hh_18_01_047,男の人って、やっぱりおっぱいが好きなんですね……大きくて、よかったぁ……,Men are still fond of breasts after all .... It was big and it was good ...,
h_hh_18_01_048,胸激しくされて、形くずれちゃうっ……,"My breasts are made intensely, they will collapse ... ...",
h_hh_18_01_049,んっ……これ、結構、疲れそうです……,Hmm ... this is quite tiring ... ...,
h_hh_18_01_051,じゅっ……激しくするから……ちゅぅっ……おっぱいと舌で、いっぱい感じてください,Jun ... ... I intensify ... ... Chu ... ... Please feel a lot with boobs and tongue,
h_hh_18_01_053,胸だけじゃなくて……舌でも、気持ちよくしますね,Not just the chest ...... Even the tongue makes you feel good,
h_hh_18_01_054,れる……れろ……ちゅぅ……小さな胸でも、お口なら負けません……,"To be ... ... Hara ...... Chu ... ... Even a small breast, if your mouth is lost ... ...",
h_hh_18_01_055,れろ……れろ……胸、好きですもんね……嬉しくなって……れる……くれてますか？,"Refinance ...... Re ... ... I like chest, I guess ...... I'm getting happy ... ... ... ... are you giving up?",
h_hh_18_01_056,れろぉ……あなたの大きいの……れるぅ……こんなふうにはさみながら舐められるの……わたしくらいなんですからね,Let it be ... your big ... ... ... ... ... I can be licked with scissors like this .... It's about me,
h_hh_18_01_057,じゅぽぉ……じゅぽっ……ふぇらちおも……むねも……堪能して……れる……くださいね,JuPo ...... JuPot ...... Furarato ...... Mu ... ... Enjoy ... ... ... ... please,
h_hh_18_01_059,あなたのぉ……じゅるるぅ……胸とお口で……全部感じてますぅ……,Your ... ___ ___ ___ 0 ... ___ ___ ___ 0 ... ___ ___ ___ 0,
h_hh_18_01_061,れるるぅっ……どう、れすか……少し小さいけど……口もつかえば……れるぅ……きもちいいれしょうっ？,Will be ... ... How is it going to be ... ... a bit small ... but if you use your mouth ... ... ... will you be impatient?,
h_hh_18_01_062,じゅるれろぉ……激しく舐めてあげれば……小さくてもっ……じゅるぅぅるっ,If you lick it violently ...... It is small and ... ... Juuruuuuuuuuu,
h_hh_18_01_063,じゅるぅ……じゅずっ……わたしの胸……楽しんでください……,Jyuu ... ... Juji ... ... My chest ... Please enjoy ... ...,
h_hh_18_01_064,じゅっ、じゅるるぅ……私の胸におちんちん埋めて……気持ちいいですか？,"Jyun, Juuruu ...... Filling my chest thru ... ... Do you feel good?",
h_hh_18_01_074,あなたの精液……わたしにくださいっ,Your semen ... Please give me a note.,
h_hh_18_01_077,れろぉ……れるれる……はい、くださいっ,"Let it be ... .... Yes, please ___ ___ 0",
h_hh_18_01_080,じゅぽっ、じゅぷぅ……はい、出してください,"Juplo, Juu Pu ... ... Yes, please take out",
h_hh_18_01_083,ちゅっ、じゅぽぉ……はい、私にくださいっ,"Tsu, JuPo ... ... Yes, please give me",
h_hh_18_01_089,あなたの熱いので……気持ちよくなってくれたのがわかって……嬉しいです,I understand that you are comfortable ... because it's hot ... I'm happy,
h_hh_18_01_091,身体のあちこちに……とび散っていますね……,There are scattered all over the body ... ... ....,
h_hh_18_01_092,あなたのなら……なんでも欲しいんです,If you are ... I want anything,
h_hh_18_01_093,んっ……喉に絡んじゃいましたっ,Hmm ... ... I was involved in my throat,
h_hh_18_01_095,けほっ……たくさん出たから……むせちゃいました,Kakehi ... ... I got a lot of them ...... I was chilled,
h_hh_18_01_096,すごく濃くて、驚いちゃいました,It was so dark that I was surprised,
h_hh_18_02_000,おちんちんに、ご奉仕しちゃいます,I will serve the dairy,
h_hh_18_02_001,おちんちん、たくさんえっちにしてあげます,"Pencil, I will give you so much",
h_hh_18_02_002,おちんちん……イカせてあげますっ,Ochinchin ...... I will let you squid,
h_hh_18_02_003,気持ちよく……なれてますか？,Feeling comfortable ... are you getting used?,
h_hh_18_02_004,このくらいの速さでも……いいですか？,Is it even about this speed ...?,
h_hh_18_02_005,早くしなくても、気持ちいい……ですよね？,"Even if you do not do it quickly, it feels good ... is not it?",
h_hh_18_02_006,あなたが一番感じるのは、このくらいの早さですよね？,"What you feel the most is how fast this is, right?",
h_hh_18_02_007,激しくして、いっぱい感じさせてあげます,"I intensify it, I will make you feel a lot",
h_hh_18_02_008,もしかして……これでもまだ、遅かったり……しますか？,Perhaps ... ... Is this still too late ...?,
h_hh_18_02_009,ちゅっ、ちゅっ、ちゅっ、おちんちんにいっぱいキス、してあげます,"Wait a minute, I kiss a lot of pencils",
h_hh_18_02_010,れる、ちゅるっ……れろ……おちんちん、おいしい……,"Churu ............ Pencil, tasty ......",
h_hh_18_02_011,ちゅっ、ちゅぅっ、ちゅっ、ちゅううっ、おちんちんにキスの雨、振らせちゃいます,"Chu, Chuu, Chu, Kyou, I will let you shake the rain of kisses in the tears",
h_hh_18_02_012,ちゅっ、おちんちん……たくましくて……ちゅるっ、かっこいい……,"Tsu, Pencil ... ... lively ... ... Chulu, Cool ... ...",
h_hh_18_02_013,じゅるるぅ、んちゅぅ……おちんちん、だいすきぃ……,"Junuruu, Michael ...... Pencil, Daisy ...",
h_hh_18_02_014,じゅっ、るろろっ、じゅうっ……おいひい、れす,"Jun, Rolling, Juu ...... Good evening, Lisa",
h_hh_18_02_015,じゅるっ、あなたのおひんひん……やっぱりいいのぉ……じゅうっ,"Juru, your daddy ...... After all it is good ... じ ゅ う っ っ ぱ っ",
h_hh_18_02_016,じゅぞぞぞ……じゅるるっ、じゅるっ！……これくらいしても、いいれすよね？,"Juz z oo ...... Jyuururu, Juru! ...... Even if this is enough, is it nice?",
h_hh_18_02_017,さきっぽ……きもちいいんですね,Sukko ... It's comfortable,
h_hh_18_02_018,さきっぽ、なでなでしてあげます,I will give you a slice.,
h_hh_18_02_019,もっと……強くしたら、もっとさきっぽ、感じちゃいますか？,"More ... ... If you make it stronger, do you feel more Sukko?",
h_hh_18_02_020,さきっぽでいっぱいいっぱい、感じてくださいね,"A lot of things are full, please feel it",
h_hh_18_02_021,どうですか？　私の手、下手じゃないですか？,how is it? I am not good at my hands.,
h_hh_18_02_022,手の中で、おちんちんが喜んでくれてるの、わかります,I understand that the dinner is pleased in my hands,
h_hh_18_02_023,おちんちん、私の手を出たり入ったりしてます,"Pencil, I am leaving my hands",
h_hh_18_02_024,私の手で気持ちよくなってくれてるんですね、嬉しいっ,"I feel comfortable with my hands, I'm happy.",
h_hh_18_02_025,れろ……ここ、そんなに気持ちいいんですか？　れるるぅ……顔、とろけてます,"Refin ... .... Do you feel so comfortable here? To be ... ... face, melting",
h_hh_18_02_026,れろろぉ……んっ、毛が、当たって……,"Reoro ...... Hu, hit, hit ......",
h_hh_18_02_027,ちゅるれるうぅ……たまに震えるのは、精液、作ってるんですよね……かわいい,"Chubu ... ... Sometimes I tremble, I make semen, is not it ... cute",
h_hh_18_02_028,じゅるるるるぅ……じゅるっ、あなたの大事なところ、好き放題しちゃってます……,"Juru Ruruu ...... じ ゅ う, your important point, I'm doing whatever you want ... ...",
h_hh_18_02_029,ここ撫でると、おちんちんもびくぅってしちゃうんですね,"I'm stroking here, you're going to make a doll",
h_hh_18_02_030,ここで精液作ってるんですよね……そう思うと、愛しいかも,"I'm making semen here .... I think so, maybe it might be love",
h_hh_18_02_031,あっ、こうやって撫でると、気持ちよくなってくれるんですね,"Oh, stroking like this makes me feel comfortable",
h_hh_18_02_032,すこしずつですけど、この子を気持ちよくする方法、解ってきました,"Little by little, I have understood how to make this girl feel good",
h_hh_18_02_033,れるれろぉ……んっ、さきっぽから、唾液じゃないの、出てきてます,It will be ... ___ ___ ___ 0,
h_hh_18_02_034,れるぉ、れるるぅ……さきっぽだけ、咥えてあげますね……気持ちいいですよね？,Wow ... will be ... ... Only Saki will get himself ... is it comfortable?,
h_hh_18_02_035,れろぉ……れるるっ……カウパー、溢れてきてますっ,"Lotter ...... Ruruu ... ... Cowper, it is overflowing",
h_hh_18_02_036,れるるっ、れろぉ……さきっぽ、とろけさせてあげます,I will make you mellow.,
h_hh_18_02_037,んっ……じゅるるぅっ……咥えるのも、慣れてきました,じ ゅ ...... じ ゅ る る ぅ っ ぅ ...... It is getting used to getting acquainted,
h_hh_18_02_038,じゅるるうぅ……ちゅる、っちゅっ……ここ、弱いんですよね？,"Juruuruuu ...... Chuura, dust ... .... It is weak here, is not it?",
h_hh_18_02_039,おちんちん……れるるぅ……おまんこよりも……じゅるぅ……気持ちよくしてあげますぅ……,Pencil ...... Ruu ...... God damn ...... Juuru ... ... I will make you feel good ...,
h_hh_18_02_040,じゅぽぉ、じゅぞぞぞ、おちんちん、吸い込むみたいにぃ……じゅずずずぅ……これ、弱いんですよね,"Junpo, Jozobusho, Pencil, like to inhale ... Juzuzu ...... This is weak, right?",
h_hh_18_02_041,私のおっぱい、楽しんでくれてますか？,Are you enjoying my boobs?,
h_hh_18_02_042,やわらかいおっぱいでされるの、嬉しいんですね……えっち,"Doing it with soft tits, I'm happy, is not it?",
h_hh_18_02_043,わたしのおっぱいで、幸せにしてあげます,I will make you happy with my tits,
h_hh_18_02_044,どうすれば、もっとおっぱいで気持ちよくなりますか？,How do you feel more comfortable with tits?,
h_hh_18_02_045,おっぱい、小さいけど……それでも、気持ちよくしてあげたいから……,"Breasts are small, but ...... Still, I want to make it feel good ...",
h_hh_18_02_046,小さなおっぱいでいいなら……愛してください,If small boobs are okay ... Please love me,
h_hh_18_02_047,あなたのおちんちん、おっぱいで全部隠れちゃいました,"All of you were hidden with your lady, breasts",
h_hh_18_02_048,おちんちん、私のおっぱいに出たり入ったり……気持ちいいですよね,"Pencil, going out and entering my boobs ... It feels good",
h_hh_18_02_049,ちゅっ……れる……おちんちん、かわいがってあげますね,"Tsuyoshi ... ... ... ... well, I'm going to love you",
h_hh_18_02_050,ちゅっ、れろ、れるる……んっ、おっぱいとベロの、同時責めです,"It is a simultaneous accusation of tits and leaves ......, tits and belo",
h_hh_18_02_051,ちゅうっ、じゅるる……舌で舐めると、おっぱいの中でおちんちんがビクってしてます,"When I lick it with my tongue, the lady is getting ridiculous in her breasts",
h_hh_18_02_052,じゅる……おちんちん、胸の中で……ちゅう……ビクビク震えてます,"Juru ...... Pencil, in my chest ... ... ... ... I'm trembling",
h_hh_18_02_053,おっぱいは小さいけど……舌使いなら自信、あります……,"Breasts are small, but .... If you use tongue, I have confidence, ...",
h_hh_18_02_054,ちゅるぅ……ちゅっ……小さな胸でも、気持ちよくできてるでしょう？,"Chyuu ... ... Chu ... ... Even a small breast is comfortable, is not it?",
h_hh_18_02_055,じゅぅっ……れる……あなたにご奉仕できるから……おっぱい大きくて……よかったぁ……,Juu ... ... ... ... ... ... Because I can serve you ...... My boobs were big ... ... It was good ...,
h_hh_18_02_056,れるるぅ……あなたのおちんちん……谷間から出たり入ったり……れるぅ……かわいい……,To be ... ... your quake ... go out and get in the valley ... ... ... ... cute ......,
h_hh_18_02_057,おっぱい……好きですもんねぇ……いっぱい……れるぅ……感じて……,Breasts ...... I like it ... no ...... full ... ... ... ... feeling ... ....,
h_hh_18_02_058,れるる……おっぱいも……れるぅ……お口も……わたしのぜんぶはぁ……あなたのものですぅ……,Ariru ...... Boobs ...... ... ... ... Also mouth ...... My whole country is ... All of yours ... ...,
h_hh_18_02_059,じゅぷぷ、じゅるうるるぅ……はさみながら……いっぱい吸って、あげます……,"Juupupu, Juru Uruuu ...... While scissors .... I smoke a lot and give it ......",
h_hh_18_02_060,じゅぞぞぉ……おっぱいでも……れる……お口でも……いっぱいすきしてぇっ……,じ ぞ ぞ ぉ ...... even on boobs ...... ... ... ... even your mouth ...... I like a lot ......,
h_hh_18_02_061,ん……じゅるるぅ……小さくても、柔らかいんですよぉ……じゅるぅ……,じ ...... じ ゅ る る ...... It is soft even if it is small ...... じ ゅ う ぅ ......,
h_hh_18_02_062,れっるぅれる……他のおっぱい大きい子じゃ……こんなに激しくは、してくれませんよ……,It gets drunk ...... Other big boobs are big girls ...... I will not do it intensely ......,
h_hh_18_02_063,じゅっれるぅ……胸でのご奉仕……できて……れるぅ……大きなおっぱいで……よかったぁ……,Jyureruu ... ... Serving in the chest ... ... done ...... ... ... ... with big boobs ... good luck ......,
h_hh_18_02_064,あなたが望んでくれるから……じゅぽぉ……自分の大きなおっぱい……好きになっちゃいましたぁ……,Because you want me ...... JuPo ... ... my big boobs ... ... I came to like ... ...,
h_hh_18_02_065,おちんちん、熱くなってます……イキそう、なんですね,"Pencil, It's getting hot ...... It looks cool, is not it",
h_hh_18_02_066,もう、イキそうなんですか？　……どうぞ,Is that supposed to be okay? ……here you go,
h_hh_18_02_067,あなたが一番気持ちいいタイミングで……イッてくださいね,At the most pleasant timing ... Please be patient,
h_hh_18_02_068,じゅるっ、ちゅうっ、じゅるっ……好きな時に、好きなだけ出してください,"Juyuuuuuuuujyu, Jurou ... when you like, please let me out as much as you want",
h_hh_18_02_069,ちゅるっ、れるるっ……あなたのおちんちん……つらそう……,"Churu, I will be ...... Your dogs ...... Tsuruji ......",
h_hh_18_02_070,れるるっ、るろぉ……我慢なんて、しないでくださいね,"Rurou Rurou ... Do not hold back, please do it",
h_hh_18_02_071,じゅるるうぅ……出したい時に、出してくださいぃ,"Jururuuu ...... Please when you want to put out, please take out",
h_hh_18_02_072,じゅるうぅぅぅ、おちんちん……おくひのなかで……震えてますぅ……,"Juuruuuuuu, Pencil ...... In a few moments ... ... I'm trembling ... ...",
h_hh_18_02_073,もう……せいえき……れろぉ……出そうなんですねぇ……じゅぷぅ……,Already ...... Seiki ...... leaves ...... I guess it is going to be ... じ ゅ う ぷ ぅ ......,
h_hh_18_02_074,あなたのすきなところに、出してください,Please put it out in your favorite place,
h_hh_18_02_075,精液、私がもらっちゃいます,"Semen, I get it",
h_hh_18_02_076,あなたのお汁……出してください,Your juice ... Please get out.,
h_hh_18_02_077,れる……れろぉ……好きなだけ、出してください,"To be ... ... as long as you like, please take out",
h_hh_18_02_078,れるるぉ……舐め取りますから……出してくだいっ,Well ... I will lick you ... .... Please give it out.,
h_hh_18_02_079,ちゅっ、ちゅううっ、ちゅっ……出るまでおちんちんに、キスしてますね,"Tsu, kidding, tutting ... ... I will kiss you till I get out",
h_hh_18_02_080,じゅぽっじゅっ……はい、出して……くださいっ,"Jyupotsuju ... ... Yes, please take out ... please",
h_hh_18_02_081,じゅぽぉ、じゅるぅ……おちんちんから精液……くださいっ,"じ ゅ ぉ ぉ, Ju Puu ...... From the penis to semen ... Please give me",
h_hh_18_02_082,れろぉ……じゅぷぅ……じゅるるっっ、おちんちんから噴き出すところ、見せてください,"Let it be ... ... Juupu ...... Juururu, please show me where to spew out of the penis",
h_hh_18_02_083,じゅぷぅ……じゅっぷ、じゅるぅ……はい、くらはいっ,"Juupu ...... JuPu, Ju Puu ... ... Yes, Kura is saying",
h_hh_18_02_084,じゅぽぉ、じゅるるぅ……精液……飲ませてくださいっ,"JuPo, Jurou ... .... Semen ... Please let me drink",
h_hh_18_02_085,口の中で……じゅっぷぅ……最高に気持ちよく……れるぅ……なってくらはいっ……,In the mouth ...... Ju Puu ...... It feels comfortable to the highest ...... ... ... ... becoming like ... ....,
h_hh_18_02_086,たくさん、でちゃってますっ,I have a lot of,
h_hh_18_02_087,精液……少しもったいないっておもっちゃいます,Semen ... I think I feel a little waste,
h_hh_18_02_088,あぁ……ベトベトになっちゃいました,Ah ... ... It's getting sticky,
h_hh_18_02_089,あなたに……汚されちゃいました,You ... I got soiled,
h_hh_18_02_090,精液、とっても熱いです……,"Semen, it is very hot ...",
h_hh_18_02_091,こんなにかけてもらえて……うれしいです。,I am glad that you made me so much ....,
h_hh_18_02_092,美味しくないはずなのに、好きなんです……変、ですか？,"It is supposed to be tasty, but I like it ... ... is it strange?",
h_hh_18_02_093,量が多すぎて……飲みきれないかもです,Too much quantity ... It may not be enough to drink,
h_hh_18_02_094,精液、ごちそうさまでした、美味しかったです,"Semen, thank you for the meal, it was delicious",
h_hh_18_02_095,精液……すごく熱かったです,Semen ... It was very hot,
h_hh_18_02_096,飲んでも良かったんですが……こうやって手に出すのも……えっちですよね？,It was okay to drink it ...... It is also a matter of getting this way ...... Well?,
h_hh_18_02_097,精液……吐いてしまったの、少しもったいなかったかも……,"Semen ... ... I spat it, maybe it was a bit wasted ......",
h_hh_18_02_098,はい、何度でもしましょう,"Yes, let's do it again and again",
h_hh_18_02_099,また、気持ちよくしてあげますね？,I will also make you feel good?,
h_hh_18_02_100,ゆっくりでも、敏感になってると、いいでしょう？,"Slowly, if you are sensitive, is not it?",
h_hh_18_02_101,これくらいで、どうですか？,"How about this, please?",
h_hh_18_02_102,激しくして……また、気持ちよくしてあげます,Strongly ... I will also make you feel good,
h_hh_18_02_103,イッたばかりでも、やっぱり速いほうが、興奮しますよね,"Even though I have just been doing it, the fast one is excited, is not it?",
h_hh_18_02_104,ちゅっ、ちゅっ、ちゅぅっ……また、おちんちんにキスしちゃいます,"Tsuyu, Chu, Chu ... ... Also, I will kiss the penny",
h_hh_18_02_105,れるるっ、れろぉ……また、あなたを気持ちよくしたいんです……いいですよね,"Well, I wanna ... I also want to make you feel good ...",
h_hh_18_02_106,ちゅっ、じゅっ、ちゅうぅっ……おちんちんに、愛してるのキス、いっぱいしてあげます,"Chu, Jun, Chuuu ...... for a long time, I love you, I give you a lot of kisses",
h_hh_18_02_107,出したくなったら……れろぉっ……好きにだして良いんですからね？,"When you want to put out ... ... ... It is OK, can you favor it?",
h_hh_18_02_108,じゅるるぅ、じゅじゅじゅぅ……おちんちん、もしかして、さっきよりも固いかも……,"Junuruu, Jyujuu ...... Penny, maybe it may be harder than before ....",
h_hh_18_02_109,じゅるっ、じゅずずぅ……おちんちん……もう私の口の中で暴れてる……,"Jurou, Jyuzuu ...... Pencil ... ... It is already rampant in my mouth ......",
h_hh_18_02_110,おちんちん……ちゅるっ……また気持ちよくなりに……お口に来たんですね,Pencil ...... Chu ... ... Also feeling better ... .... You came in your mouth,
h_hh_18_02_111,じゅぽぉぉっ、じゅるるっ……暖かいおくちのなかで……おちんちん、また蕩かしてあげます……,"じ ゅ ぽ ぉ ぉ, じ ゅ る る ...... In the warm town ... ... I will give you a penis, ....",
h_hh_18_02_112,おっぱいで、またおちんちんいい子いい子ってしてあげます,I will give you a nice girl that is good again on your breasts,
h_hh_18_02_113,下品におっぱい動かして……またおちんちんから精液、絞っちゃいますね,Move your boobs vulgarly ... .... I will squeeze sperm from the other again,
h_hh_18_02_114,んちゅ、れるぅっ……あなたの大好きなおっぱいで……またイカせちゃいます,Much .... I'm your favorite tits ... ... I will make you squid again,
h_hh_18_02_115,んちゅ、ちゅっ……おっぱいでおちんちん温めながら、さきっぽにキス……おちんちん、すっかり私の好きにできちゃってますよ,"Hey, tutu ... ... While warming up with boobs, kissing in a sweetheart ... ... well, I can completely love you like me",
h_hh_18_02_116,じゅるるぅ、じゅうっ、またおっぱいの中で……おちんちん熱くなってますねっ,"Well, in the breasts, again in the tits ... ... It is getting hot",
h_hh_18_02_117,じゅっ……おっぱいの中で……ちゅるっ……おちんちんドクンドクンって暴れてますっ,Jun ... ... In the tits ... ... Chu ...... Dae Kukdoon is rampage っ ち ょ,
h_hh_18_02_118,おちんちん……またイキそうになってるんですねっ……きてくださいっ,Penny ...... I am supposed to be at it again ... ... Please come.,
h_hh_18_02_119,おちんちん……何度でも、ぜ,Penny ...... Any number of times,
h_hh_18_02_120,ちゅうぅっ……我慢なんかしないでくださいね。あなたが望むなら、何回だって舐めてあげますから,"Chuuu ... Do not hold back. If you want, I will lick you many times",
h_hh_18_02_121,ちゅっ、ちゅるるっ……またイッちゃうんですか？　はい、射精が終わるまで、舐め続けますね,"Tsu, Chuuraru ... Is it going to get it again? Yes, I will keep licking until the ejaculation ends",
h_hh_18_02_122,ちゅるるっ、じゅぷぅっ……おひんひん……おくちでまたイキたい、イキたいって暴れてますぅっ……,"Chuuraru, Juhuuu ... .... Huh ... .... I will squeeze a while again, Iki want to go wrong ... ...",
h_hh_18_02_123,じゅるるぅっ、ちゅうっ……おちんちん、いっちゃうんれすね……お口のなかれも……他のところれも、すきなところにらしてくださいぃ……,"Juuruuuuuuuuuu ...... Pecking, I will not go ...... Do not even have your mouth ...... elsewhere, please put it in a favorite place ......",
h_hh_18_02_124,いいですよ……好きなだけ、また出してください……,"It's okay ... Please, please let me out again as much as you want ....",
h_hh_18_02_125,はい……また濃い精液……出してくださいっ,Yes ... ... Also dense semen ... Please give me out,
h_hh_18_02_126,ちゅるるぅ……ちゅっ……いっぱい、全部、出し切ってくださぃ……それが一番、気持ちいいから……,"Chyu Ruu ...... Chu ... ... a lot, please finish all ... ... that is the most pleasant ... ...",
h_hh_18_02_127,ちゅるるぅ、ちゅっ、ちゅっ……おちんちんにキスしながら、精液出されちゃいますぅ……,"Chuuruuu: Hey, hey ... ... I will get sperm while kissing the punch ... ...",
h_hh_18_02_128,じゅぶぶぅ……じゅるるうっ……またイクなら……さいごにたくさん吸い付いて……じゅずずずぅっ……あげますぅ,じ ぶ ぶ ぶ ぅ ...... じ ゅ る る う っ ... If it is also a cheek ... ... with a lot of sucking at the end ... ... じ ゅ ず ず ず ぅ ... umasumuu,
