key,jp,en,commenth_so_18_00_006,ゴムは……つけてくださいね,Rubber ... Please turn on.,
h_so_18_00_007,あ、ゴム、忘れちゃったんですか？　大丈夫です！　私、もってますよ！,"Oh, rubber, have you forgotten? It's okay! I have it!",
h_so_18_00_008,今日はちょっと……危険日なので、ゴムがないと……,"Today is a little ...... Because it is a dangerous day, if there is no rubber ......",
h_so_18_00_009,今日はその……付けないといけない日なんですよ……,Today 's that ... ... It must be attached ... ...,
h_so_18_00_010,えっ！？　お、おしりはさすがに……ちょっとこわいですけど……わ、わかりました。,"eh! What? Oh, it's a bit scary ... but a bit scary .... OK, I understand.",
h_so_18_00_011,あの……できれば優しく……お願いしますね？,Um ... ... ... if possible ... kindly ... will you?,
h_so_18_00_012,お尻なんて……き、汚くないですか……？　や……やめたほうが……,Is not it dirty ... ....? Ya ... ... Stop it ... ...,
h_so_18_00_013,そこにいれるのは流石にちょっと、心の準備が……すみません,"It is a little strange to be there, preparation of the mind ... I'm sorry",
h_so_18_00_014,（処女）んっ……あうっ……は、入って……来てますぅっ……,(Virginity) ...... Oh ...... enters ... ... I'm coming ... ___ ___ 0,
h_so_18_00_015,（処女）んぃっ……あ……い、痛っ……痛いですぅ……！,(Virginity) ...... Ah ... ... it hurts ... It hurts ... ...!,
h_so_18_00_016,（処女）えっ……う、うそっ……！　ほ、本当に……入ってっ……んあぁっ……！,"(Virgin) Eh ... .... Lie! ...! Ho, really, ... ... I got in ... um ... um!",
h_so_18_00_017,（処女）痛っ……あっぐっうう……い、痛いぃぃっ……！,"(Virginity) Pains ... ... Akoguuu ......, It hurts ... ...!",
h_so_18_00_018,（処女）よ、よかった……あなたの……全部、受け入れられたみたいです……,"(Virgin), it was good, ... your ... ... everything seems to have been accepted ......",
h_so_18_00_019,私の中……あなたのおちんちんで満たされて……ますぅっ……！,In me ... ... being filled with your dumplings ... ....!,
h_so_18_00_020,ほ、ほんとに……全部……入っちゃったんですね……,Honestly ...... everything ... ... I entered ... ...,
h_so_18_00_021,（処女）その……急にいれると……い、痛いですから……,(Virgin) That ... .... If you suddenly get in ... .... It hurts ......,
h_so_18_00_022,いきなりはいってきたので……ちょ、ちょっと怖かったです……,"Suddenly I came ... .... a little, I was a little scared ......",
h_so_18_00_023,（アナル処女）ひっ……う、うそっ……はいっちゃってますっ……,"(Anal virginity) hi ......, lie ... ... I'm getting into ... ___ ___ 0",
h_so_18_00_024,あぅん……お、おしり……ちょっとだけひりひり……しますね……,"Ahhh ...... Oh, butt ... ... I will do a little bit of ... ....",
h_so_18_00_025,あの……も、もう少し……優しくお願いしてもいいでしょうか……,Well ... ... maybe a little more ...... May I ask you a favor ...?,
h_so_18_00_026,あなたのが大きいから……穴のところ……裂けちゃうかと思いました……,Because you are big ... ... I thought if it would split at the hole ......,
h_so_18_00_027,あなたと……繋がれてるんですね……うれしいです……,I am connected with you ... .... I am happy ... ...,
h_so_18_00_028,恥ずかしい……けど、こ、この状態も……すごく幸せです……,"It's embarrassing ... but here, this state ... ... I am very happy ... ...",
h_so_18_00_029,あなたのおちんぽ……すっごく大きいのが……伝わってきます……,Your girlfriend ... ... It's really big ... ... It's transmitted ...,
h_so_18_00_030,み、見ないでください……恥ずかしい……,Please do not look ...... Embarrassing ......,
h_so_18_00_031,お尻でなんて、ダメなのに……,I do not think it 's a butt ......,
h_so_18_00_032,もう少し、こうしててください……まだ、ちょっときついので,"Please do a little more, please ... ... yet it's a bit tight",
h_so_18_00_033,えっ　抜けちゃいました……,I missed it ... ...,
h_so_18_00_034,これで終わり……ですか？,Is this the end ...?,
h_so_18_00_035,もう、いいんですか？,Is that alright?,
h_so_18_00_036,お尻、やっと終わり……ですか？,"Butt, finally it is ... ....?",
h_so_18_00_037,んあっ……抜かれるとき、変な感じです,When I get out ... ... It's strange feeling,
h_so_18_00_038,お尻……ちょっとひりひりします……広がっちゃってます,Butt ...... a little bit stingy ...... I am spreading,
h_so_18_00_039,優しく……んっ……してくださいっ……,Please be kind ... ... Please ......,
h_so_18_00_040,ゆっくり……あんっ……いいですっ,Slowly ...... Answering ...,
h_so_18_00_041,あっ……さきっぽ膨らんでますっ……んっ……気持ちいい……ですか？,Ah ... ... Sayiko is inflating ...... ... comfortable ......?,
h_so_18_00_042,んっ……痛っ……でも、耐えられます……,Hmm ... it hurts ... but I can bear it ... ...,
h_so_18_00_043,んっぐっ……速いすぎますっ……くっ……,Rocking ...... It's too fast ......,
h_so_18_00_044,ぐっ……もう少しだけ、優しく……くぅっ……,"Kugu .... a little more, kindly ......",
h_so_18_00_045,んぅっ……優しくっ、お願いしますっ……,"Heh ... .... Tender, thank you ......",
h_so_18_00_046,あっ……んっ……変になっちゃいますっ……,Ah ...... ... I'm getting weird ... ___ ___ 0,
h_so_18_00_047,んっ……ゆっくりならっ……あっ……なんとか……,Hmm ... ... slowly ...... Ah ... ... somehow ......,
h_so_18_00_048,初めて……ぐっ……なのでっ……早くするのはっ……許してぇっ……,For the first time ...... ug ...... so ... ___ ___ ___ 0 ___ ___ 0,
h_so_18_00_049,んぐぅっ……もっと、優しくしてくださいぃっ……,"Hey ... ... more, please be kind to me ......",
h_so_18_00_050,あぐっ早すぎますっ……きついのっ……,It's too early ... ___ ___ ___ 0,
h_so_18_00_051,触りながらっ……変になっちゃいますっ……,Touching ... ... It's going to be weird ... ___ ___ 0,
h_so_18_00_052,触られながらだと……あんっ……色んなところがっ……気持ちよくてっ,While being touched ...... Ah ...... various places are going on ... It's comfortable,
h_so_18_00_053,んあぁぁっ、触られながらだとっいっぱい気持ちよくなっちゃいますっ……,"Ohhhhhhhh, as I am being touched, I feel much comfortable ... ___ ___ 0",
h_so_18_00_054,激しくされながら触られてっ……んっ……もうわかんなくなっちゃいますっ……,I was being touched while being violently ...... ... I do not know anymore ... ___ ___ 0,
h_so_18_00_055,ひゃっ！？　そこはちょっと……んっ,Chew! What? It is a bit ... there ...,
h_so_18_00_056,もっと、んっ……エッチに集中しましょうっ……,Let's concentrate more on the etch ... .... ___ ___ ___ 0,
h_so_18_00_057,んっ……あっ、そんなとこ、ダメですっ,"Huh ... .... Ah, such a thing is not good.",
h_so_18_00_058,あんまりそこはっ……んんっっ……許してくださいっ……,Oh well there ... hahaha ... Please forgive me ......,
h_so_18_00_059,うああっんっ……あなたのっ何度もこすれてっ……,Wowing ... ... you have rubbed it over and over ... ...,
h_so_18_00_060,んぅっ、少しずつぅ、よくなってきましたっ……,"Huh, little by little, I'm getting better ...",
h_so_18_00_061,んあぁっ、あなたのかたちっ……わかっちゃいますっ……,"Huh, it's your way ... I understand ... ___ ___ 0",
h_so_18_00_062,んああっ……まだ、少しっ痛いですっ……,Ha ... a little bit hurting ......,
h_so_18_00_063,あんっ、少しずつだけど、よくなってきました……,"Answer little by little, but it got better ... ...",
h_so_18_00_064,エッチっ……繋がって、愛し合ってっ……幸せっ……,Etch ... ... connected and love each other ... ... happy ......,
h_so_18_00_065,んぁっ……なれないけどっ……頑張りますっ……,Huh ...... I can not get it ... ___ ___ 0 ... ___ ___ 0,
h_so_18_00_066,ごめんなさい、まだっ、ちゃんとできなくてっ……,"I'm sorry, yet I can not do it properly ...",
h_so_18_00_067,んぅあぁっ！　入ってるのっ、まだ変な感じです……,Huh! It's still strange feeling ....,
h_so_18_00_068,んぐぅっ！　お尻っ、そんなにしたら、壊れちゃいますぅぅう,"Hehe! Ha ha, if you do so, you will be broken",
h_so_18_00_069,ぐぅっ、激しすぎて、お尻っ、ダメになっちゃうっ,"Well, it's too aggressive, ass is getting useless",
h_so_18_00_070,も、もう許してくださいぃっ,"Well, please forgive me already",
h_so_18_00_071,んあっ……触られながらだとっ、痛くない……かもっ,"Huh ...... It's touched, it does not hurt ...",
h_so_18_00_072,えっちしながら……んっ、触られるとっ、また、違う感覚ですっ……,"While doing it ......, when touched, it is different feeling ......",
h_so_18_00_073,触ってくれてると……んっ、痛みも和らぎます,"Touching me ......, pain relieves as well",
h_so_18_00_074,激しくされながらっ、んっ、触られてっ、おかしくなりそうですっ……,"While being made intensely, it is touched, it seems to be crazy ......",
h_so_18_00_075,あっ、すみません、そこは……,"Oh, I'm sorry, there ...",
h_so_18_00_076,んぅっ、そこより、エッチに、集中しましょう……？,"Huh, from there, let's concentrate on the etch ... ....?",
h_so_18_00_077,んっ、ぐっ、……そこは、だめですっ……,"Huh, ohhh ...... That's not enough ......",
h_so_18_00_078,んぐぅっ……そこよりもっ、えっちのほう、しましょう？,Heck ... Why do not you take that from there?,
h_so_18_00_079,んんっ、ちゅっ……キスしながらっ、すき、ですっ,"Hen, tut, ... I'm going to kiss, I like it, I love you",
h_so_18_00_080,ちゅるっ……ちゅっ、愛し合ってるっ、感じがします……,"Chulu ... ... Chu, I love each other, I feel ... ...",
h_so_18_00_081,キスで……ちゅるっきついのっ、紛れてますっ……んっ,"With a kiss ...... Chuuuuu tight, I am confused ......",
h_so_18_00_082,キスっ、ちゅるっ、もっと、じゅるっしましょうっ……,"Kiss, tell us, more, let's go ...",
h_so_18_00_083,んっんっ、これっ、幸せですっ……,"Hey, this is happy, huh ......",
h_so_18_00_084,ちゅううっ、ちゅるるっ！　キス、大好きですっ……,"Together, Chuuraru! I love kissing, ...",
h_so_18_00_085,んっ、んんっんっ……キスしながらだと、そんなに痛くないです,"Huh, it's not like it hurts ... while kissing",
h_so_18_00_086,んぅっ、ちゅるっ……キスしながらなら、ずっと繋がっていたいたいです,"Hey, Chuu ... ... I want to stay connected forever as I kiss you",
h_so_18_00_087,んぅっ……初めてなのに……気持ちいいですっ……あなたのおかげですね,Huhh ... .... Although it was my first time ... ... It feels good ... ... thanks to you,
h_so_18_00_088,えっちって……すっごく気持ちいいんですね,Well ... it feels soooo nice,
h_so_18_00_089,あぁんっ……　……初めてなのに、声でちゃいました……,"Oh .... .... Although it was my first time, I heard it with a voice ......",
h_so_18_00_090,んっ……もう、私、我慢出来ません……,Hmm ... I can not hold it anymore ......,
h_so_18_00_091,あんっ……あなたの、大きくなってますっ……,"Huh ... ... yours, I'm getting bigger ......",
h_so_18_00_092,あっ、私で、気持ちよくなってくれてるんですねっ……もっと気持ちよくなっていいですよっ,"Oh, it makes me feel comfortable with myself ...... You can be more comfortable",
h_so_18_00_093,あっ、んっ……どんどん動きが激しくっ……気持ちいいんですか？,Oh no ... .... The movement is getting more and more ... ... Do you feel good?,
h_so_18_00_094,あっ……動き早すぎてっ、必死に動いてくれてるんですねっ……,"Ah ... .... It's too fast to move, desperately moving ...",
h_so_18_00_095,んはぁっ、うそっ、お尻でっ、こんなにっ……声でちゃうっ,"Ha ha, lying, in the butt, this much ... ... with a voice",
h_so_18_00_096,お尻で、こんなにっ、嘘、気持ちいいっ……よくなっちゃいますっ,"In the butt, so much, lie, I feel good ... I'm getting better",
h_so_18_00_097,んぉぉっ、早くされるとっ、きついのに、気持ちよくてっ……,"Well, as soon as you do, it is too tight, it feels good ...",
h_so_18_00_098,お尻で感じるのっ、恥ずかしいけどっ、あなたが望むならっ……あんっ,"I feel it in my butt, shameful, if you want it ... um",
h_so_18_00_099,んっ、ぐっ……すごく大きくなってますっ……気持ちいいんですよねっ,It is very big ...... It feels good,
h_so_18_00_100,きつくてっ……くっ、ちょっと痛いけど……あなたのためなら……,"It's too tight ...... I feel a bit sore, but ... for you ... ...",
h_so_18_00_101,んああぁっ、あっ、ダメッ、激しすぎますっ……,"Oh, ah, ah, it's too aggressive ... ___ ___ 0",
h_so_18_00_102,あなたの、あつすぎてっ、やけどしちゃいますっ,I will burn your throat.,
h_so_18_00_103,（初絶頂）えっ……なんか、のぼってきちゃいますっ,"(First summit) Eh ...... something, I'm going up",
h_so_18_00_104,あ、私、もう、きちゃいますっ,"Oh, I'm already misunderstood",
h_so_18_00_105,（初絶頂）わたしっ、そんなにされたらっもうっ……,"(First summit) I, I wish I could do so much ...",
h_so_18_00_106,あなたもっ、なんですかっ……いっしょにっ、いっしょにイキましょうっ……,"Why are you, better than you ... ... let's go together with you ... ___ ___ 0",
h_so_18_00_107,（初絶頂）出ちゃうんですかっ、はいっ、どうぞ、きてくださいっ……,"(First summit), are you going out, please, please come, please ......",
h_so_18_00_108,私はあなたのものだからっ、私の中にだしてくださいっ,"Because I am yours, please leave it inside me",
h_so_18_00_109,外ですか？　私の事を考えてくれてるんですね、嬉しいっ……,"Outside? I am thinking about myself, I'm happy ...",
h_so_18_00_110,子作りはっ、お互いが大人になったらっ、しましょうねっ,"Let's make a child, let's get together when each other becomes an adult",
h_so_18_00_111,んあぁあっっ！　急に激しくしてっ、どうしたんですかっ？,"Oh no! Hurry up and suddenly, what happened?",
h_so_18_00_112,もしかして、もうでちゃうんですかっ、中で、あなたのが大きくっ,"Perhaps, maybe it is already, inside of you, bigger",
h_so_18_00_113,ゴム越しですけどっ……いっぱい、中にくださいっ、,"It's over rubber ... .... a lot, please let me inside,",
h_so_18_00_114,つけてるからっ、中にだしてもっ、大丈夫ですよっ,"Because I'm on, it's okay with you to go inside",
h_so_18_00_115,あっ、あっ、あっ、お尻なのに、来ちゃう、うそっ……ああんっ,"Oh, there, ah, even though it's an ass, I will come, lie ... Aah",
h_so_18_00_116,だめっ、こんなのっ、お尻でなんて、うそっ…・・・あぁぁんっ,"No, no such thing, lying in the butt ... ... Ah",
h_so_18_00_117,んああぁあぁっ！　激しく突かれすぎてっ、私ももうっ……！,"Aaaaaaa! I was bitten too hard, I got too much ...!",
h_so_18_00_118,んっ、お尻でイッちゃうなんてっ……せめて、一緒にっ,"Why do not you have it in your ass ... At least, I will join them together",
h_so_18_00_119,あっ、んっ、結局お尻でっ、最後まで……,"Oh no, after all it's ass, until the very end ......",
h_so_18_00_120,中でもっ、お尻なら平気ですっ、出してくださいっ……,"Inside, if you are an ass, please do not mind, please take out ......",
h_so_18_00_121,ああああぁぁぁっ！　あなたの、いっぱい出てますっ……,Ahhhhhhh! You have a lot of them ... ___ ___ 0,
h_so_18_00_122,んっ、これが射精……なんですね……初めてがあなたでよかった,This is ejaculation ...... What is your first time with you,
h_so_18_00_123,あぁっっ！　ゴムの中にいっぱい出てますっ……ちょっと、もったいないかな,"Huh! I got a lot of them in the rubber ...... a little, a waste",
h_so_18_00_124,んんっ、ゴムっ、膨らんでるの、わかりますっ……,"I understand that it's swollen, swollen ......",
h_so_18_00_125,あぁ……、初めてなのに、お尻に出されちゃうなんて……,"Ay ... ...., it's my first time, I will not let you get in the butt ... ...",
h_so_18_00_126,お尻……熱い……でも、びっくりしましたけど、あなたになら……,"Butt ... ... hot ... but I was surprised, but if you ... ...",
h_so_18_00_127,ふあぁぁあんっ！！,Faaaah! !,
h_so_18_00_128,んくうぅううぅうっ！！,Wow! !,
h_so_18_00_129,んっっくうぅぅうぅぅうう！,The elephant 's eyes!,
h_so_18_00_130,あっあ、あっ、ああああぁぁぁぁん！,"Ah, there, Ah ah ah!",
h_so_18_00_131,一緒にイケて……幸せですぅ……,Together with you ...... I am happy ......,
h_so_18_00_132,ゴムがなかったら、多分……妊娠しちゃってました,"Without rubber, maybe ... ... I was pregnant",
h_so_18_00_133,あなたと一緒に、幸せでした……,I was happy together with you ......,
h_so_18_00_134,凄く気持ちよくて……もっと大好きになっちゃいました,I feel so comfortable ... ... I've become more fond of it,
h_so_18_00_135,いっぱい、もらっちゃいました……,"A lot, I got it ... ....",
h_so_18_00_136,できちゃってても、後悔は……しません,"Even if I can do it, I will not regret ...",
h_so_18_00_137,えっちって、すごく、気持ちいい……,"Well, it feels so good ...",
h_so_18_00_138,愛して、愛されて……こんな幸せ、初めてです,"I love you, I love you ... .... I am happy for the first time.",
h_so_18_00_139,お尻なんかでって思います……でも、あなたも気持ちよかったなら……いいかな,I think that it is an ass ... ... But if you were comfortable ...,
h_so_18_00_140,あなたと一緒だから、気持ちよくなれました,"Because I am with you, I feel comfortable",
h_so_18_00_141,初めてなのに……こんなにっ……私、変態なんでしょうか……,It is my first time ...... so much ...... I am a pervert ... ...,
h_so_18_00_142,お尻でなんて……気持ちいいはず、ないのにっ……,"It's okay ... ... It should be comfortable, there is no such thing ....",
h_so_18_00_143,こ、こんなに気持ちいいけど、疲れるもの……なんですね,"It feels so good, but exhausted ... What is it?",
h_so_18_00_144,ゴムがなかったら、きっと私……,"Without rubber, I'm sure I ...",
h_so_18_00_145,ぅぅ……もう、動けません……,ぅ ... ... I can not move anymore ...,
h_so_18_00_146,激しすぎて……しばらく……このままで……,It is too hard ... ... for a while ... as it is ......,
h_so_18_00_147,こんなに激しかったら……できちゃってるかもっ……,If I was so intensely ... ... I could have done it ......,
h_so_18_00_148,子作りって……こんなに気持ちいいんですね……,Making a child ... ... It feels so much ......,
h_so_18_00_149,頭がふわふわって……こんなに、すごいんですね……,"My head is fluffy ...... That's amazing, is not it ...?",
h_so_18_00_150,これが……絶頂……すごい、です……,"This is ... ... cum ... ... amazing, ... ...",
h_so_18_00_151,初めてなのに……お尻で、こんなに乱れてしまいました……,"Even though it was my first time ... ... in the butt, it was so disturbed ... ...",
h_so_18_00_152,こんなにお尻がいいなんて……私、変態ですっ……,I like that ass so good ... ... I'm a pervert ... ...,
h_so_18_00_153,……ごめんなさい、今は、私をみないで……,"I'm sorry, but do not see me now ... ...",
h_so_18_00_154,私だけ、お尻なんかで気持ちよくなっちゃって……うぅっ……,Only I am comfortable with your butt ... ... huh ......,
h_so_18_00_155,これ、ゴムなかったら……きっと……,If this is not rubber ... ... Surely ......,
h_so_18_00_156,ゴムにいっぱい流れてきて……熱さ、伝わりました,A lot of rubber flowed ... ... The heat was transmitted,
h_so_18_00_157,あっ……あなたの、流れてきました……,"Ah ... ... your, it's flowing ... ...",
h_so_18_00_158,あなたの精液……私、受け止められたんですね,Your semen ...... I was caught,
h_so_18_00_159,いっぱい、でてますっ……本当は、ダメな日なのに……,A lot of it is ... I guess it is a bad day ...,
h_so_18_00_160,危険な日ですけど……あなたの、受け止められて、嬉しいです……,"It's a dangerous day ... but your reception, I'm happy ... ...",
h_so_18_00_161,二人いっしょに気持ちよくなって……とっても素敵でした,They both became pleasant together ...... It was very nice,
h_so_18_00_162,ゴムしてても、こんなに気持ちいいなんて……あなたが素敵だから、でしょうか,"Even with rubber, I feel so comfortable ... ... because you are lovely",
h_so_18_00_163,生でするの……気持ちよすぎますっ……,To be raw ...... It feels too good ... ___ ___ 0,
h_so_18_00_164,すごく良かったです……あなたもですよ、ね？,"It was really good ... you too, right?",
h_so_18_00_165,赤ちゃん、できちゃってたら、いっしょに育てて……くれますか？,"Baby, if you can do it, do you raise with me ... will you?",
h_so_18_00_166,危険日なのに、すごく感じちゃいました……,"Even though it was a dangerous day, I felt it was awful ......",
h_so_18_00_167,たくさん気持ちよくしてくれて……ありがとうございます,Thank you for giving me so much comfort ......,
h_so_18_00_168,私だけイッちゃって……つまらなく、なかったですか？,"I only had a chance ...... It was boring, was not it?",
h_so_18_00_169,お尻……初めてだったのに、出されちゃいました……,"Butt ... ... It was my first time, but it was taken out ......",
h_so_18_00_170,お尻、初めてだったので……上手くできてましたか？,Because it was my first time ... ... Was it successful?,
h_so_18_00_171,正直こわかったけど……あなたのを受け止められて、よかったです,"I was scared to be honest, but ... it was nice to take your turn",
h_so_18_00_172,おちんちん震えてっ……これ、大丈夫なんですか？,Pencil trembling ...... Is this okay?,
h_so_18_00_173,おちんちん……ビクビクして……エッチです,Pencil ... ... Bikki ... ... It is ethere,
h_so_18_00_174,精液っ……こんなネバネバなんですねっ……,Semen ...... It is such a sticky neck ...,
h_so_18_00_175,すごい勢い……これが、本当は私の中で……,Awesome momentum ...... This is really in me ......,
h_so_18_00_176,これが、男の人の赤ちゃんの素……,This is the baby's boy of a man ...,
h_so_18_00_177,あそこの形……変わっちゃってます……,That shape ...... I have changed ...,
h_so_18_00_178,あ、やだっ……垂れちゃってます,"Oh, it is ... ... I am hanging out",
h_so_18_00_179,んっ、垂れて……こんなの、見ないでください……,Do not look at me like this ... ....,
h_so_18_00_180,お尻から出て……いやっ……,Get out of your ass ... ... huh ......,
h_so_18_00_181,もういっかい、しますか？　（以下、喘ぎ、息づかい極力省略、セリフのみ）,"Would you like to go? (Hereafter, pant, breathing as much as possible, serif only)",
h_so_18_00_182,まだ、しますか？（以下、喘ぎ、息づかい極力省略、セリフのみ）,"Still do you? (Hereafter, pant, breathing as much as possible, serif only)",
h_so_18_00_183,いれて、ください,please insert,
h_so_18_00_184,はい、好きなだけ,"Yes, just as I like",
h_so_18_00_185,してあげたいけど、ダメですよ……,"I'd like to, but I can not do it ......",
h_so_18_00_186,ゴムは、ちゃんと……ね？,"Rubber, is not it ...?",
h_so_18_00_187,危ない日、なんです,What is a dangerous day,
h_so_18_00_188,そういうのはちゃんと、してください,"Please do that properly, please",
