key,jp,en,commenth_so_27_01_178,あっ、やだ、出ないで……！,"Oh, no, do not go out ...!",
h_so_27_01_179,い、今のブピッて音は違うんだからね！,"Well, the sound is different as it is now!",
h_so_27_01_180,見ないでぇ……恥ずかしいからぁ,Do not look ... ... It's embarrassing,
h_so_27_01_250,もうすぐ……くるっ,Soon ... ... Wrapping,
h_so_27_01_251,出すのね！？　いいわっ,Get out! What? No way,
h_so_27_01_252,ゴムがギチギチしてる……！,Rubber is crooked ... ....!,
h_so_27_01_253,みんなもう限界だわ……！,Everyone is already at its limit ...!,
h_so_27_02_000,こんなにおっきいのが、私のアソコに入るんだ,Such a big tale goes into my dick,
h_so_27_02_001,あの……まだ入れないの？,Um ...... Can not you come in yet?,
h_so_27_02_002,またアンタに恥ずかしいとこ見せちゃうね,I will show embarrassedly to you again,
h_so_27_02_003,いつでもいいよ、きて……,"You can come anytime, come on ......",
h_so_27_02_004,いっぱい私のこと愛してね,Love me so much about me,
h_so_27_02_005,はいはい、どーぞ……早く,"Yeah yeah, wham ... ... as soon as possible",
h_so_27_02_006,あー、ゴム忘れてる。こういうのはちゃんとしなきゃ,"Oh, I forget the rubber. I guess I have to do it properly",
h_so_27_02_007,念のためゴムつけておいた方が良くない？,Is it better for you to keep rubber in mind?,
h_so_27_02_008,アンタ、もしかして私を孕ませる気？　ゴムつけて,Are you willing to empower me? With rubber,
h_so_27_02_009,私、まだ妊婦になりたくないわ……だからゴムお願い,I do not want to become a pregnant yet ... so please rubber,
h_so_27_02_010,アンタ、ほんとにお尻が好きね,You really love your ass,
h_so_27_02_011,あーあ、私たち相当の変態になっちゃったわね,"Oh, it turned out that we were quite a pervert",
h_so_27_02_012,アンタの太いのに刺されたら、裂けちゃう！,"If you get stung by the fat of you, you will rip!",
h_so_27_02_013,お尻にハマりすぎたくないの……わかって,I do not want to be too addicted to your ass .... I understand,
h_so_27_02_014,あ、あ、おっきいの、きた……,"Oh, Oh, are you coming ...?",
h_so_27_02_015,んっ、いきなりすぎぃ……,It is suddenly excessive ......,
h_so_27_02_016,逆流してる感じぃ,Feeling refluxing,
h_so_27_02_017,無理やり押し込まれてるぅ,It is being forcibly pushed in,
h_so_27_02_018,私の中で、アンタを感じるわ……,"I feel you, within me ......",
h_so_27_02_019,アソコがキュッとなるぅ……,The dick is going to be crazy ...,
h_so_27_02_020,この瞬間が何よりも好きよ……,I like this moment more than anything ......,
h_so_27_02_021,ちょっとは我慢しなさいよね、馬鹿……,"Please be patient for a moment, idiot ......",
h_so_27_02_022,入れたからには、もう離してやんないんだから,"Because I put it in, I will not let go",
h_so_27_02_023,気持ちよくなんか……気持ちよくなんかっ,Something pleasant ... ... something pleasant,
h_so_27_02_024,感じてないから！　お尻なんかで……っ,I do not feel it! In the ass ...,
h_so_27_02_025,変なところで繋がっちゃって……もう、馬鹿ぁ,I am connected in a strange place ...... I'm stupid.,
h_so_27_02_026,お尻が好きだなんて言わないからね……絶対,I will not tell you I like ass ...,
h_so_27_02_027,はぅ、気持ちいい……,"Hah, I feel good.",
h_so_27_02_028,アンタをもっと感じてたいな……,I want to feel more than you ....,
h_so_27_02_029,ねぇ、アンタも私とひとつになれて、幸せ？,"Hey, you are also happy together with me.",
h_so_27_02_030,アンタがお尻を好きなこと、理解はしてあげるわ,"I understand that you like your ass, I will understand you",
h_so_27_02_031,アンタのせいでお尻まで……な、何でもない！,Until my ass ... Because of nothing!,
h_so_27_02_032,お尻で幸せになんて……なるわけ……,Being happy with your ass ... ... That will ... ...,
h_so_27_02_033,やだ、抜いちゃダメ,"No, do not pull it out",
h_so_27_02_034,入れなおすのよね？,"You put it in again, do not you?",
h_so_27_02_035,体勢が悪かった？,Your position was bad?,
h_so_27_02_036,おっきいうんこした時みたい……,It seems like when I made a big pussy ......,
h_so_27_02_037,あ、抜く瞬間がイイ……,"Oh, the moment to pull out is good ...",
h_so_27_02_038,アンタがそれでいいなら、いいんだけど……,It's okay if that's okay with that ....,
h_so_27_02_039,これ、好き……アンタをよく感じられるから,I like this ... ... I can feel you well,
h_so_27_02_040,うん、じっくりアンタに突かれたい,"Yeah, I want to be careful by you",
h_so_27_02_041,ふわぁ、ゾクゾクするぅ,"Fuwa, throbbingly",
h_so_27_02_042,うん、いい感じ……そのままスピードアップして,"Yeah, a good feeling ... Speed ​​up as it is",
h_so_27_02_043,あっ、それ、イイ……気持ちいいとこ突いてる,"Oh, that, it is good ...... It feels comfortable",
h_so_27_02_044,ねぇ、もっと速くしてもいいよ……？,"Hey, you can make it faster ... ....?",
h_so_27_02_045,何回もおっきいの出してるみたい……,She seems to be giving out a lot of pets ... ...,
h_so_27_02_046,これ……アナルプレイって言うんでしょ……？,This ... ... you say you play anal ... ....?,
h_so_27_02_047,どんどん……アンタにお尻まで開発されてく……,Rapidly ...... You have been developed until your ass ... ....,
h_so_27_02_048,なかなか悪くないんじゃない？　お尻もね,Is not it pretty bad? Also ass,
h_so_27_02_049,ちょっと目覚めてきちゃったかも……アナル,It may have awakened a bit ... ... Anal,
h_so_27_02_050,普通のエッチにはない良さがあるのね,There is a merit that is not in a normal etch,
h_so_27_02_051,やだ、そこ触ると変な声でるからぁ……もう,"Yeah, when you touch it there's a strange voice ...",
h_so_27_02_052,そこ、好き……覚えてくれたんだ,I love that ... ... you remembered it,
h_so_27_02_053,負けたくないのに……アンタに負けちゃいそう,I do not want to lose ... ... I guess I will lose to you,
h_so_27_02_054,わかった、認めるわ……すっごく気持ちいい！,"Okay, I'll admit ... It feels soooooooooooo!",
h_so_27_02_055,あれ……？　そこ、苦手だったんだけど……,"that……? Well, I was not good at that ... ...",
h_so_27_02_056,触りたいの？　もう、しょうがないなぁ……,Do you want to touch it? I can not help it anymore ......,
h_so_27_02_057,もう、イジワル……別にいいけど,"Again, I have a good idea ...",
h_so_27_02_058,そこまで嫌いじゃないわよ……いいから続けて,I do not dislike it to that extent ... continue from good,
h_so_27_02_059,あぁ、ズンズンくる……重いの好き！,"Oh, it's sturdy .... I like heavy!",
h_so_27_02_060,ガツガツしてるアンタ……ふふ、イイわね,"I'm getting upset ... ... Huh, you know what I mean",
h_so_27_02_061,そう、その調子でもっと私を求めて,"Yes, seeking me more for that",
h_so_27_02_062,その調子でガンガンきて！　大丈夫っ,With that tune chewed up! All right,
h_so_27_02_063,激しいの、好き、もっと突きまくっていいからぁ,"It's fierce, I love you, I can rush out more",
h_so_27_02_064,あぁっ、アンタのおちんちんに夢中なのバレちゃう……！,"Ahhh, I'm crazy about you guys!",
h_so_27_02_065,お尻で感じてる私の顔、見ないで……恥ずかしい,"I feel with my butt, do not look at me, ... It's embarrassing",
h_so_27_02_066,アンタの声の方がエッチだってば……！,The voice of you is more etched ......!,
h_so_27_02_067,悔しいからもっと締め付けてあげる……！,I regret to tighten so much ...!,
h_so_27_02_068,お尻が……おかしくなっちゃう！,Ass is ... ... it will be strange!,
h_so_27_02_069,入ってくるのも抜かれるのも、イイ……！,It is also good to get out of entering ...!,
h_so_27_02_070,お尻でズボズボされるのがこんなに気持ちいいなんて……！,It feels so good to be snobbing in your ass ...!,
h_so_27_02_071,エッチな女で悪かったわね！　だって気持ちいいんだもん,It was bad for a slutty woman! Because it feels good,
h_so_27_02_072,私がこんな姿見せるの、アンタだけなんだからね,"I will show you this, because you are the only one",
h_so_27_02_073,認めるわ、これすごく好き！　すぐイキそうになるっ,"I admit it, I love this very much! I will soon be at ease",
h_so_27_02_074,やめないで、お願いイクまで続けて……！,"Do not stop, please continue until Iku ... ...!",
h_so_27_02_075,そこでも感じさせる気ね？　好きにすれば……,"I feel like I feel it there, too? Do as you like……",
h_so_27_02_076,おちんちん激しいから……気になんないわ,Because it is fierce ... ... I do not mind.,
h_so_27_02_077,もう好きにして！　エッチの気持ち良さで全部忘れてあげる,Love me already! I'll forget everything with the pleasantness of the etch,
h_so_27_02_078,私に苦手なものなんて……なーいっ！,I do not like what I am ... No!,
h_so_27_02_079,んちゅっ……ぷは……ふふ、上も下も繋がってる……ちゅっ、ちゅぱっ,"Hey ... ... Pu ... ... Huhu, both upper and lower are connected ... ... Chu, Chu",
h_so_27_02_080,んっ、んちゅぅ～っ　……はぁ、気持ちいい……,"Well, it feels good ......",
h_so_27_02_081,んちゅっ、キス好き、ちゅぅぅっ、もっと感じちゃうっ,"Much, I like kisses, Chuuuu, I feel more",
h_so_27_02_082,突くのも、ちゅっ、キスも、ちゅっ、やめないで,"Do not stumble, tell me a little, kiss, do not stop",
h_so_27_02_083,んっ、ちゅっ、アンタのおちんちんも喜んでる？,Why are you also pleased with your tea ceremony?,
h_so_27_02_084,んちゅっ、はぁ、幸せね……ちゅぅぅっ、アンタもそうでしょ？,"Hey, happy ...... Chuuu, you too, right?",
h_so_27_02_085,キスは私が……！　んちゅっ、アンタはそのまま腰振って！　ちゅぱっ、んじゅるっ,"Kiss me ......! Much, shake your arms as it is! Chu-han",
h_so_27_02_086,ちゅっ！　んちゅっ！　上でも下でもキスしまくり　んちゅっ、れろれろっ,"Turn! Much! I will kiss you both above and below, lost",
h_so_27_02_087,もうそろそろイッちゃいそうよ……ねぇ,I guess it will not be long enough ... hey,
h_so_27_02_088,あ、もう我慢できそうにないかも……腰が勝手に動いちゃう,"Oh, I guess they may not be able to endure any more ...... My waist moves without permission",
h_so_27_02_089,ダメ、イキそう……そのまま、突くのやめないで,"No, noisy ... ... as it is, do not stop popping",
h_so_27_02_090,あぁっ、またアンタにイカされちゃう……悔しい！,"Oh, I will be squatted again by you .... It is regrettable!",
h_so_27_02_091,必死ね……ふふ、そういうアンタ、すごく好きよ,"Desperately ... ... Huhu, that kind of you, I really like it",
h_so_27_02_092,感じてるアンタを見てると、こっちまでムズムズしてきたわ,I've been feeling myself when I was looking at you,
h_so_27_02_093,速すぎて腰が壊れちゃいそう……アンタのことよ,It seems to be too fast and the waist will be broken ...,
h_so_27_02_094,なんかすごくオスって感じ……嫌いじゃないわ,I feel something like a male .... I do not dislike it,
h_so_27_02_095,そう、もっと私のお尻を味わって,"Yes, taste my ass more",
h_so_27_02_096,強く突かれると、身体全体が痺れるの,"When strongly touched, the whole body becomes numb.",
h_so_27_02_097,この速さ、イイ……！　お尻がイッちゃう,"This speed, good ...! Your ass gonna hurt",
h_so_27_02_098,こんなのお尻じゃ……もうアソコと一緒よ！,Such a butt ... It is already with dicks!,
h_so_27_02_099,アナルがどんどん拡げられてくわ……,Anal is steadily expanding ... ...,
h_so_27_02_100,お尻の中でもわかるわ、アンタ、イキそうなのね,"Even in the butt, you look pretty",
h_so_27_02_101,しょうがないから好きにさせてあげるわ,I will let you like as I can not use it.,
h_so_27_02_102,そうそう、お尻で必死に腰振って,"Oh yeah, desperately shake your back with your butt",
h_so_27_02_103,きたきた、イッちゃう～っ！,I wanted to meet you!,
h_so_27_02_104,お願いもっと突いて、イッちゃう！,"Please push me more, Icha!",
h_so_27_02_105,一緒にイキましょ……そう、もっと突いてぇ！,"Good luck with that ... ... Yes, please do more!",
h_so_27_02_106,あぁ～っ、もうイク！　アンタもね！　一緒に！,"Oh, well, it is already! You too! together!",
h_so_27_02_107,私も……中に欲しいかも……っ,I also want ... inside ...,
h_so_27_02_108,出さないなんてありえないでしょっ,There is no way I will not release it,
h_so_27_02_109,びゅーって出す気でしょ？　ふふっ、ちょっと楽しみ,"Do you feel like pulling out? Hahahah, a little fun",
h_so_27_02_110,今回はどれだけ飛ぶかしらね～？,I wonder how much I can fly this time ~ ~?,
h_so_27_02_111,好きなところに出せばいいじゃない……,You do not have to go out where you like ... ...,
h_so_27_02_112,出したいの？　私は……どっちでもいいけど,Do you want to put it out? I am ... whichever is good,
h_so_27_02_113,すっごい激し……ゴムあるからってアンタねぇ,Very hard ...... I do not know because there is rubber,
h_so_27_02_114,そんなに激しくしたら、ゴム破けちゃったり……しないか,"If you make it so intense, the rubber will be broken ... or not",
h_so_27_02_115,ごめん、お尻で先にイッちゃうわ！,"I'm sorry, I'll get on in the butt!",
h_so_27_02_116,アンタもすぐについてきてね！,Please follow me soon!,
h_so_27_02_117,このまま一緒にイキましょっ,Let's stay together this way,
h_so_27_02_118,お互い、すっごくビクビクしてる……！,They are very excited about each other ... ...!,
h_so_27_02_119,安心して、お尻で受け止めてあげるから,I will take it with your ass with peace of mind,
h_so_27_02_120,そのまま奥までビュービュー出しちゃいなさいよ！,Leave the view as far as it is!,
h_so_27_02_121,きたぁっ……あついの、気持ちいい……,"Katta ... ... It's hot, I feel good ......",
h_so_27_02_122,まだ止まらない……すごい量がきてるわ,I can not stop still ... a great amount is coming.,
h_so_27_02_123,今、出してるんだ……ゴム越しでもわかるわ,I am out now ... I can understand it through rubber,
h_so_27_02_124,ゴムしてるし、最後まで出し切ってね,I've got rubber and finished it to the end,
h_so_27_02_125,せーし、熱いから……どこまで来てるかわかるわ,"Because it's hot, I know how far it is ...",
h_so_27_02_126,そう、そのまま……出し続けていいわよ,"Yes, you can continue ... ... keep on pulling out",
h_so_27_02_127,ダメ、イッちゃうぅぅぅぅぅぅ！,"No, it's cool!",
h_so_27_02_128,イク、イッちゃぁぁぁぁぁぁ！,"Iku, it's awesome!",
h_so_27_02_129,イク、イッちゃうのぉぉぉぉぉぉ！,"Iku, itchyou!",
h_so_27_02_130,イクッ、イックぅぅぅぅぅぅぅ！,"Ikku, Ikuuuyo!",
h_so_27_02_131,ゴムつけてても良かったぁ……,It was good even if I put rubber.,
h_so_27_02_132,もう、ゴム破けそうなほどしたでしょ……いいけど,"Already it was enough to break the rubber ... is it good, but",
h_so_27_02_133,お腹が精子でたぷたぷ……幸せ,My stomach is a sperm ........ happy,
h_so_27_02_134,この熱いの、好き……,I like this hot one ....,
h_so_27_02_135,ホントに孕んじゃうぐらい出しちゃって……もう,I got it really pregnant ......,
h_so_27_02_136,この後のこと、また相談させてね……,"Let me talk after this, also ...",
h_so_27_02_137,認めるわ……アンタ、すごく上手……,I will accept ... ... you are very good ... ....,
h_so_27_02_138,次は一緒にイキたいな……,Next Iki together want ... ...,
h_so_27_02_139,私たち……仲良しよね、ふふっ,"We ... are good friends, heh heh",
h_so_27_02_140,お尻ってイイわね……,I'm okay ...,
h_so_27_02_141,もっとお尻も強くならなきゃ……,I have to get stronger ass ......,
h_so_27_02_142,お尻が課題だわ……,Ass is a problem ......,
h_so_27_02_143,ゴムの耐久性は……大丈夫ね,The durability of the rubber ... OK.,
h_so_27_02_144,いつか破れても知らないんだから,Because I do not know it even if I can someday,
h_so_27_02_145,これ……しばらくダメかも……すごすぎ,This ... ... it will be bad for a while ... ....,
h_so_27_02_146,もう……アンタとのエッチやめらんない……,Already ... ... I do not want to etch with you ... ...,
h_so_27_02_147,出来ててもいいわ……アンタとなら,You can do it ... If it is you,
h_so_27_02_148,アンタの赤ちゃん、欲しい……かも,"You want a baby, you ...",
h_so_27_02_149,もう諦めたわ……アンタには勝てない,I gave up already ... ... You can not win,
h_so_27_02_150,先にイッちゃってごめんね……？,Sorry to keep you awake earlier ... ....?,
h_so_27_02_151,わかってる……私もアンタも、お尻のとりこ……,I know ... ... neither I nor you ... captive of ass ...,
h_so_27_02_152,ねぇ、またお尻でもするでしょ……？,"Hey, I will do it again in the ... ....?",
h_so_27_02_153,今度はお尻でアンタをイカせるから……,This time I will make you feel good with your ass ......,
h_so_27_02_154,勝手なお尻だって怒っていいわよ……,You can be mad with your selfish ass ...,
h_so_27_02_155,まだしばらくはこのままでも平気よ……,Still it's fine for a while for a while ... ...,
h_so_27_02_156,ふふっ……必死なアンタを思い出してたの,Fuh ... ... I was remembering desperate geeks,
h_so_27_02_157,イクときのアンタの顔、最高だったわよ,The face of you when Iku was the best,
h_so_27_02_158,またアンタがイクところ、見たいかも……,"Moreover, you may want to see where the cheek is ......",
h_so_27_02_159,アンタ、途中から危険日ってこと忘れてたでしょ……別にいいけど,You forgot that you were a dangerous day from the way ... ... Separately it is OK,
h_so_27_02_160,責めはしないわよ……アンタが気持ちよくイケたんだったらね,I will not blame you ...... if you do feel it is comfortable,
h_so_27_02_161,ゴムの中に出したやつ、捨てちゃうんだ……,"The guy who put it in rubber, I throw it away ... ...",
h_so_27_02_162,ゴムがなかったら、アンタの全部受け止めきれてなかったかも,"If it had not been rubber, I could have totally accepted all of you",
h_so_27_02_163,長い射精だったわね……うん、楽しめたわ,"It was long ejaculation ... Yeah, I enjoyed it.",
h_so_27_02_164,アンタが出してる間もね、私……ふふっ、この先は秘密,"As long as you are out, I ... ... Huh, this place is a secret",
h_so_27_02_165,イク瞬間はホントにもうどうでもよくなっちゃうのよね,The moment of recklessness really hurts any more,
h_so_27_02_166,危険日なんてなければいいのに……って思っちゃダメかぁ,I wish I could not have a dangerous day ...,
h_so_27_02_167,また私とエッチして！　コントロールできるように訓練したいの,Please also etch with me! I want to train to be able to control,
h_so_27_02_168,いつかアンタを私のテクで悶えさせてやるんだから～！,Someday I will make you feel wrong with my tech ~!,
h_so_27_02_169,お尻でぎゅーってしてたの、わかってくれた？,Did you know you understood it in your butt?,
h_so_27_02_170,うん、まだアンタのせーしでポカポカしてる……,"Yeah, I'm still doing my best ...",
h_so_27_02_171,お尻にまでアンタのにおい、ついちゃったわね,The smell of you tasted up to your ass,
h_so_27_02_172,あはは、飛んでる飛んでる～,"Haha, I'm flying, flying ~",
h_so_27_02_173,エッチな光景……いつ見てもいいわね,Horny sight ... You can look at it anytime,
h_so_27_02_174,エッチにテカッてる……なんかいいわね,It is extraordinary to etch ... something good,
h_so_27_02_175,むせかえるこのにおい……たまんない,I smashed this smell ... I can not go wrong,
h_so_27_02_176,どこまで飛んでくのかって思ったわ,I thought how far I would fly,
h_so_27_02_177,アンタのと私のでもうドロドロ……,I'm already outrageous for me ......,
h_so_27_02_178,ドロッと出てきてるの、アソコでも感じるわ,"Drott is coming out, I feel it also in the dick",
h_so_27_02_179,お尻に力を入れても……ダメかぁ,Even if you put your strength in your ass ...,
h_so_27_02_180,ポッカリ空いた穴から出ちゃってるぅ,Pokkari I'm getting out of the vacant hole,
h_so_27_02_181,あのさ……またしない？,Do you ... again?,
h_so_27_02_182,もっとしてもいいんだけど,You can do more.,
h_so_27_02_183,わかってるってば,I mean,
h_so_27_02_184,いいから早くっ,So fast,
h_so_27_02_185,そこはちゃんとしなきゃ,I have to do it properly,
h_so_27_02_186,ゴム忘れてるでしょ,You forgot rubber,
h_so_27_02_187,ダメだってば、危険日なの,It's a dangerous day if it's not good.,
h_so_27_02_188,危ない日だから、我慢してつけて,"Because it's a dangerous day, be patient with it",
h_so_27_02_189,はいはい、いいわよ,"Yeah yeah, that's fine.",
h_so_27_02_190,アンタ、お尻好きだもんね,You really like ass,
h_so_27_02_191,汚いからやだぁ,Because it is dirty,
h_so_27_02_192,お尻の気分じゃないかも,Maybe I do not feel like a butt,
h_so_27_02_193,あ～、これよこれ,"Oh, this one",
h_so_27_02_194,ん、イイ感じ……,"Feeling good, ... ....",
h_so_27_02_195,いきなり、きてるぅ,"Suddenly, I guess",
h_so_27_02_196,不意打ちきたぁ,It came surprisingly,
h_so_27_02_197,もうこんなにおっきい……,I can not believe it ...,
h_so_27_02_198,いいわ、どんどんきて,"No, thank you.",
h_so_27_02_199,お尻、拡がっちゃうぅ,"Butt, spread out",
h_so_27_02_200,お尻に刺さってる……！,I'm stuck in my ass ...!,
h_so_27_02_201,私のお尻！　お尻ぃ！,My butt! Thanks!,
h_so_27_02_202,入れてるだけでイッちゃいそう,Just putting it seems to be great,
h_so_27_02_203,アンタを中で感じるわ……,I feel inside you ...,
h_so_27_02_204,勝手にお尻が締まっちゃうわ,My ass is locked on my own,
h_so_27_02_205,アナルの感触味わってるの？,Do you feel the feel of anal?,
h_so_27_02_206,急にやめないでよ,Do not abruptly,
h_so_27_02_207,えっ、どうしたらいいの？,"Well, what should I do?",
h_so_27_02_208,何か悪かった？,Was something wrong?,
h_so_27_02_209,もしかして気が変わった？,Have you changed your mind?,
h_so_27_02_210,アンタってホント優しいのね,You are kind and gentle,
h_so_27_02_211,じわじわきてぇ……,Freaklessly ...,
h_so_27_02_212,焦っちゃダメ、まだまだ,"Do not be frustrated, you still have nothing",
h_so_27_02_213,速く……もっと強くぅ,Faster ...... Stronger,
h_so_27_02_214,優しくしてくれてありがと,Thank you for making me gentle,
h_so_27_02_215,お尻好きなんだ？,Do you like the ass?,
h_so_27_02_216,私もお尻好き……！,I also like butt ......!,
h_so_27_02_217,お尻の穴まで喜んでる,I'm glad even to the hole of the buttocks,
h_so_27_02_218,奥までくる……！,Come deep ... !.!,
h_so_27_02_219,子宮にキスして！,Kiss the uterus!,
h_so_27_02_220,強いアンタ、好き！,"I like strong, I like it!",
h_so_27_02_221,もっともっとかき回しなさいよ,Please stir more,
h_so_27_02_222,固いの、どんどん突き刺して！,"Stiff, pierce steadily!",
h_so_27_02_223,お尻に気なんて使わないで,Do not bother with your ass,
h_so_27_02_224,お尻でイカせてぇ,Let's make it cool in the buttocks,
h_so_27_02_225,アンタも早く気持ちよくなって,You feel comfortable as soon as possible,
h_so_27_02_226,そのまま突いてて……！,Just push it ... ...!,
h_so_27_02_227,あっ、くるくる……イキそう！,"Oh, I'm curling ...... I will!",
h_so_27_02_228,腰が止まんないっ,My waist will not stop,
h_so_27_02_229,ダメ、もうイカせてーっ,"No, no more squashing",
h_so_27_02_230,いいわ、頑張って,Right. Good luck,
h_so_27_02_231,早くイッちゃいなさいよ,Please fast,
