key,jp,en,commenth_ka_27_03_029,ねぇ、きつくしてみちゃダメ？,"Hey, do not tighten yourself?",
h_ka_27_03_030,手でも気持ちよくしてあげるわね,I'll make you feel good even with your hands,
h_ka_27_03_031,おちんちん、いただきます,I will receive a penchant for you.,
h_ka_27_03_032,それすると、唾液がすっごい出ちゃうのよね,Then you get a lot of saliva,
h_ka_27_03_033,また私のおっぱい犯されちゃうのか～,Does my boob get fucked?,
h_ka_27_03_034,結構おっぱいでも感じるから……好き,"I feel quite tits, so ... I like it.",
h_ka_27_03_035,アンタが喜んでくれて、私も嬉しいわ……,I am glad that you are pleased ... ...,
h_ka_27_03_036,もっと私を好きにして……,Love me more ......,
h_ka_27_03_037,アンタの悶える顔、早く見たい……,I want to see you soon ...,
h_ka_27_03_038,ふふ……私が責める番……,Huh ... ... I can count on ... ...,
h_ka_27_03_039,このドキドキ、いつ感じてもイイわ……,"This excitement, never feels ......",
h_ka_27_03_040,ね、早く……まだぁ？,Right early .... Huh?,
h_ka_27_03_041,覚悟は決めたわ、もうどうとでもして,"I decided my resolution, I do not care about it any more",
h_ka_27_03_042,アンタとなら……は、恥ずかしくない……わよ,If you do ... ... is not ashamed ...,
h_ka_27_03_043,ねぇ……ぎゅってしながら、して……,Hey ... ... doing it while doing it ... ...,
h_ka_27_03_044,感じてる顔、見られちゃうね……,I can not see the face I feel ... ...,
h_ka_27_03_045,なんか犯されてるって感じ……,Feeling something is being fucked ......,
h_ka_27_03_046,激しくしてみて……私なら大丈夫だから,Try it hard ... If it's okay with me,
h_ka_27_03_047,我ながらすごくエッチな格好……,"While being with me, it's a really horny look ... ...",
h_ka_27_03_048,刺激があって……悪くないわ,There is stimulation ... ... not bad.,
h_ko_27_00_007,ふんふふんふふふ～ん,Fuhufufufufen,
h_ko_27_00_008,ん……,Hmm……,
h_on_27_02_000,んぅ、ちょっとだけ……ちょっとだけだもん……,"Huh, just a bit ...... just a bit ... ...",
h_on_27_02_002,んぅ……もうちょっとだけ、なら……,"Huh ... ... a bit more, if ...",
h_on_27_02_003,んぁ、あっ……感じるわ……,"Hey, there ... ... I feel ... ...",
h_on_27_02_004,ん、私……気持ちよくなってる……んぅ……,"I, ... I'm feeling better ......",
h_on_27_02_005,んっ、あっ、あっ……ダメ……これ、よすぎる……んぅ……！,"There, there, ... ... no ... this is too good ......!",
h_on_27_02_006,んあっあっ、エッチな声、止まらない……んぁ、ぁぁん……！,"There, a horny voice, can not stop ......, ah ... ...!",
h_on_27_02_007,んぁっ、あっ……イッちゃう、オナニーで、いいの、来ちゃって……んあっ、あっ……ひゃぁぁん！,"Huh, ah ...... Cha, Masturbation, nice, come on ...... Ha, ah ... ... Hua!",
h_on_27_02_008,んあっ、あっ、気持ちよすぎて……んあっ、私、あっ、イク、イクゥ………はぁぁぁん！,"Oh no, it feels too good ......, I, ah, Iku, Iku ......... Ha!",
h_on_27_02_010,ん、はぁ……オナニー……よかったわ……,"Ha, huh ...... Masturbation ... It was good ... ...",
h_on_27_02_011,んはぁ……軽く……飛んじゃってたかも……,Haa ... ... lightly ... maybe it flew away ......,
h_on_27_02_013,いっくぅぅ！,One more time!,
h_on_27_03_000,んんっ、我慢しようって、少しも思わなかった……私はもう……手遅れみたい……んあっ……,"Well, I did not think a little to try it ...... I am already ... ... It looks like it was too late ......",
h_on_27_03_001,んはぁ、オナニー、見ないでよ～……んあっ、恥ずかしい、じゃない……あんっ……,"Ha ha, masturbation, do not look ~ ... ...., It's embarrassing, is not she ... ....",
h_on_27_03_002,ん……もっと、気持ちいいの……私の身体が、ほしがってる……,I ... more comfortable ...... My body is wanting ... ....,
h_on_27_03_003,んっはぁ、あっ……オナニー、いいのぉ……んあっ、あんっ……,"Ha ha, ah ...... Masturbation, okay ... oh, oh ......",
h_on_27_03_004,んぁっ、あっ……もっと、刺激がほしい……んあっ、あっ……,"Huh, ah ... more ... I want stimulation ... .... ... ah ......",
h_on_27_03_005,んはっ、あっあっ……激しいの、いい……私、自分を甚振って、感じちゃってるぅ……！,"Ha ha, ah ...... Fierce, nice ... ... I am trembling myself, I feel it ...!",
h_on_27_03_006,んはぁっ、んあっ、あ……痺れてきて……あっ、あぁ……たまんない……！,"Haaaaaaaa ... ... getting numb ...... Ah, oh ...... I do not want to ...!",
h_on_27_03_007,んあぁ、私の中……もうっとろとろの、とろとろで……んぁ、いつでも、イケ……んあっ、あっあっ…………はぁぁぁん！,"Oh my, inside me ...... Lot of peaceful, lazy ...... Anytime, Ike ...... Ha, ah ............ Ha ha!",
h_on_27_03_008,あんっ、んあぁ……オナニーで……快感、込み上げてき……んぁ、あっあっ…………んはぁぁぁん！,"Ann, Mi ... ... In masturbation ... ... pleasantness, getting in ... ...., ah ... ... ... ...... ..",
h_on_27_03_009,んはぁ……熱い視線、浴びながら、オナニーして、んあぁっ、イク、イク…………イックぅぅぅ！,"Ha ha ... ... Hot look, taking a masturbation while taking a bath, ... Ah, Iku, Iku ............ Ikuu!",
h_on_27_03_010,はぁ……オナニー……ほどほどにしないと……本当に止められなくなっちゃう……,Haa ...... Masturbation ...... If I do not do it in moderation ...... I really can not stop ... ...,
h_on_27_03_011,んはぁ……身体の火照り、おさまんない……はぁ、ん……,"Ha ha ...... Humoral burning, do not worry ...... Ha, ......",
h_on_27_03_012,んぁっ……恥ずかしくて……顔真っ赤になって……オナニー、感じすぎちゃったじゃない……,"Huh ... ... It's embarrassing ...... Face turned red ... ... Masturbation, I felt too much ... ...",
h_on_27_03_013,イックぅぅ！！,Ikuuuu! !,
h_so_27_00_000,いよいよ繋がっちゃうんだ、私たち……,"We are finally connected, we ......",
h_so_27_00_001,ヤバ……すっごい緊張してる……,Yaba ... ... I'm sooooo nervous ...,
h_so_27_00_002,アンタと一緒に気持ちよくなりたい……,I want to feel comfortable with you ... ...,
h_so_27_00_003,あ、うん……あはは、ちょっと怖いかも,"Oh, yeah ...... Haha, maybe a bit scary",
h_so_27_00_004,この瞬間、すっごいドキドキする……,"At this moment, it makes me so exciting ......",
h_so_27_00_005,いいよ……きて……ゆっくりね……,Okay ... come and ... slowly ......,
h_so_27_00_006,えっ、ちょっと待って、ゴム！,"Wait, wait a second, rubber!",
h_so_27_00_007,ゴム忘れてるって！　ダメじゃない,You forgot rubber! It is useless.,
h_so_27_00_008,待って、今日危険日だから！　ゴムつけて,"Wait, because it is a dangerous day today! With rubber",
h_so_27_00_009,危なっ……ゴムつけなきゃダメな日だからね,It's dangerous .... It's a bad days to have rubber,
h_so_27_00_010,えっ、そんなところ試してみるの！？,"Well, I'm going to try that kind of place! What?",
h_so_27_00_011,できるのかな……やってみなきゃわかんないけど,I wonder if I can do it ...... I do not know if I do not try it,
h_so_27_00_012,えーっ、無理無理！　無理だってば,"Well, impossible impossible! I can not do it.",
h_so_27_00_013,エッチする穴じゃないからね！？,It's not a hole to be etched! What?,
h_so_27_00_014,（処女）あぁっ……い、痛い……！,(Virginity) Ah ... ... it hurts ... ...!,
h_so_27_00_015,（処女）ひぐっ……そんな、いきなり……！,"(Virginity) Higuru ...... Such, suddenly ......!",
h_so_27_00_016,（アナル処女）う、く、苦しい……！,"(Anal virginity) Uku, painful ... ...!",
h_so_27_00_017,（アナル処女）やだ、入ってきてる……！,"(Anal virgin) Ya, it's coming in ... ...!",
h_so_27_00_018,（処女）うそ、繋がっちゃったの？,"(Virginity) Lie, have you connected?",
h_so_27_00_019,あ、あ、今、私たち、ひとつになってるんだ……,"Oh, now, we are one, ... ...",
h_so_27_00_020,私のアソコであんたの受け入れて……変な感じ……,I accepted you with my dicks ... ... strange feeling ......,
h_so_27_00_021,（処女）やだ、全部入っちゃった……,"(Virginity) Ya, I got it all in ... ...",
h_so_27_00_022,いきなりすぎるってば……もう、馬鹿ぁ,"If it suddenly goes too suddenly .... Already, idiot",
h_so_27_00_023,（アナル処女）あぁっ、初めてなのに、ちゃんと入ってる,"(Anal virginity) Oh, it's my first time, it's in",
h_so_27_00_024,アンタのためなら……我慢できるわ,If it is for you ... I can endure it,
h_so_27_00_025,（アナル処女）あぁっ、うそ、入っちゃった,"(Anal virgin) Oh, lie, I got in.",
h_so_27_00_026,うぅ……ここまできたら頑張るけどっ……,Uh ...... I'll do my best if I come here ... ...,
h_so_27_00_027,もうちょっと……慣れるまでこのままでいて,A bit more ... ... until you get used to it,
h_so_27_00_028,アンタのアレ、すごくあったかい……,"You are me, very warm ...",
h_so_27_00_029,まだ動かさないで！　痛みが……少しずつマシになってきてるから,Do not move it yet! The pain ... ... It is getting better by little by little,
h_so_27_00_030,お尻が……裂けるぅぅ……,Butt ... .... ripping ... ...,
h_so_27_00_031,大丈夫……ちょっとこのままでいて……,It's okay ...... Just a bit like this ...,
h_so_27_00_032,お尻に慣らす時間をちょうだい……,Give me time to get used to the ass ...,
h_so_27_00_033,あ……抜けた,Oh ... I got out,
h_so_27_00_034,何で抜いたの？,Why did you pull it out?,
h_so_27_00_035,今日はここまでってこと……？,Today 's going to be here ... ...?,
h_so_27_00_036,わ、出た！,I got it!,
h_so_27_00_037,今、抜けたよね？,"You just got out, right?",
h_so_27_00_038,あ……やめちゃうんだ,Oh ... stop stopping.,
h_so_27_00_039,あぅ、動いてるぅ……ゆっくりぃ……,"Oh, it's moving .... Slowly ...",
h_so_27_00_040,うん、このペースなら……いいよ……,"Well, at this pace ... OK.",
h_so_27_00_041,ゆっくり、いい……このままお願い……,"Slowly, nice ... ... Please do as it is ......",
h_so_27_00_042,う、くっ……まだちょっと痛いかも……,"Well, I guess ... ... it still hurts a bit ... ...",
h_so_27_00_043,あ、あ、もっとリラックスしなきゃ……,"Oh, ah, I need to relax more ...",
h_so_27_00_044,ちょっと、必死すぎ……もっとゆっくり,"Hey, desperate too much ...... more slowly",
h_so_27_00_045,え、まだ早いって……ちょっと！,"Wait, it's still too early ...... Hey!",
h_so_27_00_046,お尻がめくれ……ちゃいそうっ,The buttocks are swinging ...... Cha,
h_so_27_00_047,ゆっくりやってくれなきゃやだからね……！,Because I do not have to do it slowly ...!,
h_so_27_00_048,あう、ホントに裂けちゃうから……,"Aku, I really want to rip it ... ...",
h_so_27_00_049,まだちょっと……辛いかも……,It is still a little ... ... It might be painful ... ...,
h_so_27_00_050,こんなので……ホントに気持ちよくなるの？,So ... are you feeling really comfortable?,
h_so_27_00_051,あっ、それイイ……痛いのごまかされてく,"Oh, that's good ... ... it hurts me for hurting",
h_so_27_00_052,あ、なんか感じる……変なの……痛く、ない……,"Oh, I feel something .... It's strange ... It hurts, there is no ......",
h_so_27_00_053,すごい……気持ちいい……かも！,It is amazing ... ... comfortable ... maybe!,
h_so_27_00_054,頭がフワフワして……何も考えられなくなっちゃう,My head got fluffy ... ... I can not think of anything,
h_so_27_00_055,えっ、なんでそこ触るの？,Why are you touching there?,
h_so_27_00_056,気持ちよくは……まだわかんない……,It feels nice ... ... I do not know yet ...,
h_so_27_00_057,そこは微妙だからやめてぇ,Stop it because it's subtle,
h_so_27_00_058,気になって、エッチに集中できないからぁ……,I can not concentrate on the etch because I am interested ...,
h_so_27_00_059,ひゃぁ、強い……激しすぎ……っ,"Hey, strong ... ... too much fierce ...... っ",
h_so_27_00_060,なにこれ、すごい奥まできてる……！,"What is this, it's got so far ...!",
h_so_27_00_061,私で気も良くなってくれてるの？　う、嬉しいっ,"Are you feeling well with me? Well, I'm happy.",
h_so_27_00_062,なにこれ、どうなってるの……っ,"What is going on, this ...",
h_so_27_00_063,あ、アンタも必死なんだ……いいよっ、そのまま……！,"Oh, you are desperate too ... ... Good, as it is ...!",
h_so_27_00_064,激しい……でも、腰のあたりがふわふわしてきてる……！,"Fierce ... but, the waist is getting fluffy ... ...!",
h_so_27_00_065,お尻が……！　速いってば！,Butt ... ...!! I said it's fast!,
h_so_27_00_066,うぅ～っ……辛いけど、我慢するっ,"Uooh ... ... It's painful, I will endure it.",
h_so_27_00_067,ねぇ、裂けてない？　ホント？,"Hey, are not you ripping? really?",
h_so_27_00_068,じんじんする……！　お尻が熱いぃ,Shinjuku ......! Your ass is hot,
h_so_27_00_069,は、はやくイッてよ……お願い！,"Hurry up, quickly ... please!",
h_so_27_00_070,私のお尻、限界かも……！,"My ass, it may be the limit ...!",
h_so_27_00_071,もっとそれやって、痛いの飛んでっちゃうから,I will do it more and it hurts so it hurts,
h_so_27_00_072,私に気を使ってくれてるの？　う、うん、ありがとっ,"Do you care about me? Well, yeah, thanks.",
h_so_27_00_073,やだ、これ、すごく気持ちいい……！,"Ya, this is very comfortable ...!",
h_so_27_00_074,あぁもう、クセになっちゃうよ……もっとお願い,"Oh, it will be a habit now .... Please do more",
h_so_27_00_075,ダメ、そこダメ！　今はあっちに集中させて,"No, no! Let's focus now",
h_so_27_00_076,ダメだってば……そこ、苦手だから……お願い,"I do not want it ...... There, I am not good, so please ...",
h_so_27_00_077,気持ちよくなってきたところなのに……っ,I'm just starting to feel good ...,
h_so_27_00_078,そこ触りたいのはよくわかったから……でも後にして！,I understood well what I want to touch there ... ... but do it later!,
h_so_27_00_079,ん、ちゅっ……ぷは……なにこれ……んちゅ……すごくイイわ……,Tu ... Pu ...... What ... ... this ... ... ... ... ... it is very good ......,
h_so_27_00_080,んっ、んちゅぅっ……もっと……キスして……んっちゅぅぅっ,Hmm ... ... more ... ... kiss me ...... っ ち ゅ ぅ ぅ ぅ ぅ っ,
h_so_27_00_081,んっ！　ちゅ……ちゅっ……好き……ちゅぱっ……大好き！,Huh! Chu ...... Chu ... .... I like ... ... Chu ... ... I love you!,
h_so_27_00_082,んんっ、ちゅぅぅっ……止まらない……んっ、ちゅっ、もっと！　ちゅううっ,"Hmm, Chuu ... ... I will not stop ......, hey, more! Treatment",
h_so_27_00_083,んっ、ちゅっ、幸せ感増し増し……ちゅっ……すごい……ちゅっ、ちゅぱっ,"Huh, tutto, happiness increased more and more ... ... Chu ... ... amazing ... ... Chu, Chu",
h_so_27_00_084,ちゅっ、んんっ、すごい……ちゅっ、んちゅっ……全然辛くないわ……ちゅっ、ちゅぱっ,"Tyu, Mun, it is amazing ... ... a little hard, .... It's not painful at all ...... Chu, Chu",
h_so_27_00_085,んっ！　んちゅ！　これ……最高！　ちゅっ！　もっとして……んちゅうっ！,Huh! Chichu! This ... ... the best! Turn! More ... and more!,
h_so_27_00_086,んちゅっ！　ちゅぱ！　キスまで……感じる！　ちゅぱっ！　変なの！　んちゅっ！,Much! Chu on! Until the kiss ... ... I feel! Chuh! strange thing! Much!,
h_so_27_00_087,あっ、これが感じてるってこと……？　腰のあたりがゾクゾクしてきてる！,"Oh, that this is feeling ... ....? The waist is getting soaked!",
h_so_27_00_088,もうすぐイクんだ……ちょっと怖いけど、う、嬉しいっ,"I got it soon .... I am a bit scared, but I'm happy.",
h_so_27_00_089,私の声、変じゃない？　あっ、これが喘ぎ声なのね！,"My voice, is not it strange? Oh, this is a pant voice!",
h_so_27_00_090,お腹の奥がジンジンしてる……私、どうなっちゃうの？,The inside of my stomach is gingling ...... What will become of me?,
h_so_27_00_091,アンタ……そろそろ我慢の限界なの？,You are ... the limit of patience soon?,
h_so_27_00_092,いいわよ……私のことはいいから、好きな時にイッて,"Okay ... I do not care about me, when I like it",
h_so_27_00_093,すごく必死ね……だけど、いいわ……大丈夫だから,"I am desperately desperate .... But, it's alright ... Because it's okay",
h_so_27_00_094,怖くないわ……アンタが気持ちよくなってくれてるんだもん,I'm not afraid ... ... you are feeling better,
h_so_27_00_095,ふわ、お尻が変！　痛く……ないっ,"Fluffy, your butt is strange! It hurts ...",
h_so_27_00_096,なにこれ、ワケわかんない、何でぇっ,"What is this, I do not understand Wakei, what?",
h_so_27_00_097,やめて、速くされると……変になりそう！,"Stop it, if you do it fast ... ... it will be weird!",
h_so_27_00_098,お尻がお尻じゃなくなっちゃうぅ,Your ass is not a butt,
h_so_27_00_099,なんかアンタのふくらんでない！？,Something is not puffing up! What?,
h_so_27_00_100,お尻がもうキツキツ……！,The buttocks are already scary ...!,
h_so_27_00_101,お尻が火ぃ吹いちゃうからぁ～っ,The ass is blowing from fire,
h_so_27_00_102,そんなにこすって、痛くないの！？,"I rub it so much, it does not hurt! What?",
h_so_27_00_103,（初絶頂）あっ、なにこれ、何かくる！,"(First summit) Oh, what is this, something coming!",
h_so_27_00_104,ふぁ、もう、ダメ……！,"Well, no more ...!",
h_so_27_00_105,（初絶頂）あっ、くる、アンタも一緒に！,"(First summit) Oh, come, come on together!",
h_so_27_00_106,アンタと一緒にイキたい……！,I want to be with you ... ...!,
h_so_27_00_107,（初絶頂）もう何でもいいからぁ……！,(First summit) I can do anything any more ...!,
h_so_27_00_108,うんっ、いいわ……！　だって我慢できないんでしょっ,"Yeah, alright ......! Because you can not stand it",
h_so_27_00_109,うん、わかった……外に出して,"Yeah, I got it ... ... Please go outside.",
h_so_27_00_110,ありがとっ……気を使ってくれてるんでしょ,Thanks ...... You are using mind,
h_so_27_00_111,もうすぐなの？　どこに出す気……？,Soon? Where to give out ... ....?,
h_so_27_00_112,ねぇ、どこに出すの？　言ってよ……！,"Hey, where are you going out? Say it!",
h_so_27_00_113,ゴムしてるから……大丈夫じゃない？,I'm rubbering ... ... Is not it okay?,
h_so_27_00_114,気にすることないわよ……ゴムしてるんだし,I will not mind ... ... I'm rubbering,
h_so_27_00_115,やだ、やめて、お尻、気持ちいいよぉ！,"Stop it, stop it, your ass is pleasant!",
h_so_27_00_116,どうしよう、お尻になんかくる……！,What shall I do with my ass!,
h_so_27_00_117,あっアンタも！？　私ももう……！,Ah you too! What? Me too ......!,
h_so_27_00_118,このままイクしかないみたい……っ,It looks like Iku like this ...,
h_so_27_00_119,そんなのいいから、早く！,That's because it's okay soon!,
h_so_27_00_120,お尻でしょ、気にしないでっ,"Do not mind, do not you think?",
h_so_27_00_121,ふぁ……すごい……中に出てる！,Fah ... ... awesome ...... I am inside!,
h_so_27_00_122,すごくあつい……,It is very hot ...,
h_so_27_00_123,あっ、ゴムしててもわかる……！,"Oh, you understand it even with rubber ...!",
h_so_27_00_124,うわ、すごいビクビクしてる,"Wow, it's amazingly exciting",
h_so_27_00_125,あっ、お尻の奥に何か流れ込んできてる……,"Oh, something is flowing in the back of the butt ...",
h_so_27_00_126,あぅぅ、逆流してる感じが……,"Ohhh, I feel like refluxing ... ...",
h_so_27_00_127,あああぁぁぁぁっ！,Ahhhhhh!,
h_so_27_00_128,やだぁぁぁぁぁぁっ！,Yeah Yahya!,
h_so_27_00_129,はぁぁぁぁぁぁぁんっ！,Ha ha ha!,
h_so_27_00_130,イッ、あぁぁぁぁぁぁ！,"That's it, Ayaah!",
h_so_27_00_131,私、変じゃなかった？,I was not strange?,
h_so_27_00_132,もう夢中で……どうなってたの？,I am already crazy ...... What was going on?,
h_so_27_00_133,うん……ちゃんと気持ち良かったわ,Yeah ... ... It was a pleasant feeling.,
h_so_27_00_134,アンタを感じられて良かった……,I was glad that you felt yourself ......,
h_so_27_00_135,そうだ、赤ちゃん！　……今はいっか,"That's right, baby! ... now it's somewhere",
h_so_27_00_136,あぁ、もう、今は何でもいい……,"Oh, now, anything is okay ....",
h_so_27_00_137,アンタにイカされちゃった……,I have been squatted by you ...,
h_so_27_00_138,まさかここまでアンタにやられちゃうなんてね……,No way I will get attacked by you so far ...,
h_so_27_00_139,私たち、変態になっちゃったわね,We became a pervert,
h_so_27_00_140,私のお尻、気持ち良かった？,My butt was pleasant?,
h_so_27_00_141,お尻でイッちゃった……,I got caught in the butt ... ...,
h_so_27_00_142,もう……ホントわけわかんない……,Already ... ... I really do not know ... ...,
h_so_27_00_143,ゴムしてるからって、激しすぎ……,"Because it's rubbery, it's too hard ... ...",
h_so_27_00_144,そういえば、ゴムしてたっけ……もうどうでもいいや,"Speaking of which, I was rubbering ... ... I do not care",
h_so_27_00_145,あぅ、もうダメ……身体に力入んない,"Oh no, no more ...... I will not enter the body",
h_so_27_00_146,ちょっと待って……今何も考えられない,Wait a moment ... ... I can not think of anything right now,
h_so_27_00_147,赤ちゃん……あぁ……後でいいや,Baby ... ... Ah ... ... I can do it later,
h_so_27_00_148,危険日だったのに……もぉ……,It was a dangerous day ... ... well ...,
h_so_27_00_149,今はダメ……もうちょっと待って……,Not now ... ... wait a bit more ......,
h_so_27_00_150,まだフワフワしてる……,I'm still fluffy ...,
h_so_27_00_151,お尻、初めてだったのにぃ……,But it was the first time ... ...,
h_so_27_00_152,アンタ、お尻で喜びすぎ……！,You are too joyful in your ass ... ....!,
h_so_27_00_153,しばらく思い出したくなぁい……,I want to remember for a while ...,
h_so_27_00_154,あぅぅ、アンタに恥ずかしいとこ見せちゃった……,"Ah, I showed embarrassing to you ... ...",
h_so_27_00_155,ゴムの中にちゃんと出せた？,Did you make it out in rubber?,
h_so_27_00_156,ちゃんとイッてくれて良かったわ……,It was nice to have it properly ...,
h_so_27_00_157,うん……まぁ、気持ち良かったわよ,"Well ... Well, it feels good",
h_so_27_00_158,男子がイクと、こんなになるのね,"Boys, this is going to be like this",
h_so_27_00_159,赤ちゃんはまだ早いってば……,If the baby is still early ...,
h_so_27_00_160,危険日なのに、容赦ないんだから……,"Even though it is a dangerous day, I am not merciless ... ...",
h_so_27_00_161,ゴムつけてて良かった……一安心ね,I'm glad I got rubber ...... I am relieved,
h_so_27_00_162,ゴムつけてやってくれてありがとね……,Thanks for putting rubber on ... ...,
h_so_27_00_163,なんか溢れてない？　すごい量出たんだ……,Is not it overflowing? I got a great amount ......,
h_so_27_00_164,アンタが出したので、もうお腹パンパン……,"I got it, so I've already got a stomach bun ......",
h_so_27_00_165,途中で止めるの忘れちゃった……もういいけど,I forgot to stop midway ... I've had enough,
h_so_27_00_166,ダメってわかっててもやるのよね、アンタって人は,"Even if you know it is not good, you do it, you are",
h_so_27_00_167,次こそは絶対アンタを先にイカせてやるんだから！,The next time I will make a mistake for you absolutely!,
