key,jp,en,comment
h_ai_27_00_000,な、なに……？,What?,
h_ai_27_00_001,えっと……うぅ……,Er ... um ... ...,
h_ai_27_00_002,な、なにか言ってよ！,Say something!,
h_ai_27_00_005,キス、初めてだったんだからね……,"Kiss, it was my first time ...",
h_ai_27_00_006,あぅ……恥ずかしい……,Ah ... ... It's embarrassing ... ...,
h_ai_27_00_007,キス……気持ち良かった……,Kiss ... It was comfortable ... ...,
h_ai_27_00_008,またしてもいいわよ……キス,You can do it again ...... Kiss,
h_ai_27_00_015,私たちってそういう関係じゃないでしょ,We are not that kind of relationship,
h_ai_27_00_016,付き合ってもないのに、キスなんて……,"I do not have a relationship, but a kiss ...",
h_ai_27_00_017,えっ、それはちょっと……違くない？,"Well, that is a bit ... ... is not it?",
h_ai_27_00_018,もー、くすぐったい,Tattoos,
h_ai_27_00_019,あぁん、なにこれ,"Oh, what is this",
h_ai_27_00_020,悪くないわ……,It's not bad ...,
h_ai_27_00_021,いい……かも……,Is it okay?,
h_ai_27_00_022,気持ちいい、かな,Does it feel good?,
h_ai_27_00_023,ひゃ！　びっくりした,Ha! I was surprised,
h_ai_27_00_024,あぅ、ダメぇ,Oh no,
h_ai_27_00_025,そこ、弱いから,Because it is weak there,
h_ai_27_00_026,先っぽが……いい,The destination is good ...,
h_ai_27_00_027,あっ、乳首立っちゃう,"Oh, I will stand a nipple.",
h_ai_27_00_028,そこ、ダメぇ,"There, no",
h_ai_27_00_029,そこ、敏感だからぁ,"Because of that, I am sensitive",
h_ai_27_00_030,ダメ、触っちゃ……,"Do not do it, touch it ......",
h_ai_27_00_031,声が、出ちゃうっ,A voice comes out,
h_ai_27_00_032,そこ、お尻よ！？,"There, ass! What?",
h_ai_27_00_033,なんでわかったの……,How did you know……,
h_ai_27_00_034,そんな……ダメ……,No way ... ... no.,
h_ai_27_00_035,（拒否して外される）私が初めてなの、わかってるの？,"(Rejected and removed) I am the first time, do you know?",
h_ai_27_00_036,まだ激しいのはダメ……,It is still no intense ... ....,
h_ai_27_00_037,痛くなるから優しくして,"Because it hurts, please be kind",
h_ai_27_00_038,（拒否して外される）お尻なんか触っちゃダメ,(Rejected and removed) Do not touch your ass,
h_ai_27_00_039,ダメ、お尻はやだ,"No, the butt is bad",
h_ai_27_00_040,いじわるしようとしてるでしょ,You are trying to do it,
h_ai_27_00_041,（強すぎて拒否）あっ、強い強い、まだ無理！,"(Too strong and refused), strong strong, still impossible!",
h_ai_27_00_042,なんでオモチャなの！？,Why the toy! What?,
h_ai_27_00_043,やだ、それ怖い……,"Ya, it is scary ......",
h_ai_27_00_044,優しく揉んでよ……,Please mass them gently ......,
h_ai_27_00_045,アンタの手、あったかいわね……,Your hands are warm ... ...,
h_ai_27_00_046,あぁ、動きがエッチ……,"Oh, the movement is etched ....",
h_ai_27_00_051,もう、つつかないで,Do not stop there.,
h_ai_27_00_052,びっくりするからぁ,I am surprised,
h_ai_27_00_053,遊ばないでよ、もう,"Please do not play, already",
h_ai_27_00_054,わーっ、伸びる！,"Wow, it will stretch!",
h_ai_27_00_055,乳首の刺激が……,The stimulation of the nipple ...,
h_ai_27_00_056,先っぽ痺れてくるからぁ,Because I get numb.,
h_ai_27_00_057,あっ、汚いとこ……,"Oh, dirty ....",
h_ai_27_00_058,ダメ、変になっちゃう,"It will not work, it will be weird",
h_ai_27_00_059,早くやめてぇ……,Stop it early ...,
h_ai_27_00_060,ひゃぅっ！,Ha!,
h_ai_27_00_061,もう……ダメ,No good,
h_ai_27_00_062,ちょっとだけにして……,Just a little ... ....,
h_ai_27_00_063,優しくしてくれるなら……,If it makes me gentle ...,
h_ai_27_00_064,割と敏感なの……,It's fair and sensitive ...,
h_ai_27_00_065,ゆっくりしてね……,Do it slowly……,
h_ai_27_00_066,あっ、指が入って……,"Oh, my finger entered ...",
h_ai_27_00_067,これ……私のアソコの音？,Is this ... ... the sound of my dick?,
h_ai_27_00_068,指が入っちゃった,My fingers entered,
h_ai_27_00_069,お尻に指が……,Fingers in the butt ......,
h_ai_27_00_070,あっ、入っちゃった,"Oh, I got it.",
h_ai_27_00_071,やだ……抜いて,Barely ... pulled out,
h_ai_27_00_072,最初は優しくね,At first it is kind,
h_ai_27_00_073,いきなり強いのはやだからね,It is because you are suddenly strong,
h_ai_27_00_074,ゆっくりして……,Slowly ......,
h_ai_27_00_075,最初は慎重にね,At first carefully,
h_ai_27_00_076,無理やりやろうとしないで,Do not try to forcibly,
h_ai_27_00_077,徐々に、徐々にだから,"Gradually, gradually",
h_ai_27_00_078,なにこの優しいの……,What is this gentle ...?,
h_ai_27_00_079,濡れて気持ちいい……,Wet and comfortable ...,
h_ai_27_00_080,これ好き……もっと舐めて,I like this ... ... lick it more,
h_ai_27_00_081,乳首舐め……いい,Licking the nipple ...,
h_ai_27_00_082,そう、先っぽをチロチロして,"Yes, you tickled my forehead",
h_ai_27_00_083,私のアソコ、ペロペロして……,"My girlfriend, licking it ... ...",
h_ai_27_00_084,舌が這うの、ダメ……イキそう,"The tongue crawls, no good ...",
h_ai_27_00_085,そこ舐めるとこじゃないから……！,Because it is not possible to lick there ... ...!,
h_ai_27_00_086,えっ、あっ、お尻舐めちゃダメ……！,"Eh, there is no ass licking ...!",
h_ai_27_00_087,えっ、舌入れちゃうの……！,"Well, I'm going to put my tongue ...!",
h_ai_27_00_088,はぅ、濡れてるの入ってくる！,"Huu, it's coming in wet!",
h_ai_27_00_089,奥の方はダメ……！,Do not get in the back ...!,
h_ai_27_00_090,オモチャなんかで……んんっ,With toys ...,
h_ai_27_00_091,やだ、オモチャでイキたくなぁ……あん！,I want to blow yourself with your toys ...... Anan!,
h_ai_27_00_092,振動、すごすぎ……！,"Vibration, wow ...!",
h_ai_27_00_093,乳首削れちゃう……！,I will cut my nipples ...!,
h_ai_27_00_094,先っぽにすごい刺激が……！,Awesome stimulation ahead ...!,
h_ai_27_00_095,ふわわ、アソコがぁ,"Fluffy, it's dick",
h_ai_27_00_096,なにこれ、アソコがしびれる,"What is this, the dandruff numbs",
h_ai_27_00_097,なんかくる……！,What are you coming ...!,
h_ai_27_00_098,エッチしてないのに、気持ちいいの……！,It feels good though it has not been etched ...!,
h_ai_27_00_099,私、イクの…！？,"I, Ichu's ...! What?",
h_ai_27_00_100,ああ～っ！,Oh ~!,
h_ai_27_00_101,私……イッちゃったの……？,I ... ... did it ...?,
h_ai_27_00_102,エッチしてないのに……すごい,Even though I have not been etched .... wow,
h_ai_27_00_103,すごく……気持ち良かったわ,It was soooo ... ... comfortable.,
h_ai_27_00_104,するんでしょ……？,You do it ... ....?,
h_ai_27_00_105,だからそんなに見つめないでってば,So if you do not look so much,
h_ai_27_00_108,またしちゃった……エヘヘ,I did it again ... ... Eheha,
h_ai_27_00_109,何度でもできるかも……,Maybe again ......,
h_ai_27_00_110,唇でもちゃんと感じるのね,You feel good with your lips ne,
h_ai_27_00_111,私、唇も弱いかも……,"I, my lips may be weak ......",
h_ai_27_00_118,だからそういうのはナシだってば,That's why it's not pear,
h_ai_27_00_119,付き合うんだったらキスしてあげる,I will kiss you if you go out with each other,
h_ai_27_00_120,やめて、笑っちゃう,I will give up and laugh.,
h_ai_27_00_121,気持ち……いいよ？,Feelings ... good.,
h_ai_27_00_122,やっぱ変な感じ……,After all I feel strange ......,
h_ai_27_00_123,だから弱いんだってば,So it's weak,
h_ai_27_00_124,もう、ダメだってばぁ,I do not want any more,
h_ai_27_00_125,先っぽもっと固くなっちゃう,I will get harder ahead,
h_ai_27_00_126,ダメ、もっとやって,"Do not do it, do it more",
h_ai_27_00_127,声、止めらんないのぉ,"Voice, I can not stop it",
h_ai_27_00_128,敏感なところばっかり……もぉっ,Only a sensitive place ......,
h_ai_27_00_129,あっ、もう、お尻ばっかり,"Oh, already, only ass",
h_ai_27_00_130,ちょっと、責めすぎ……,"Hey, too much to blame ......",
h_ai_27_00_131,（拒否）激しいのダメだって……！,(Refusal) Because it's intense!,
h_ai_27_00_132,（拒否）痛いのヤなの！,(Refusal) It hurts so much!,
h_ai_27_00_133,（拒否）だからお尻はヤなの,(Refusal) So your ass is ya,
h_ai_27_00_134,（拒否）いじわるする人、嫌い,"(Refusal) People who intercalate, I hate",
h_ai_27_00_135,（拒否）まだ強いってば！,(Refusal) If I am still strong!,
h_ai_27_00_136,（拒否）またオモチャ使うの……？,(Refusal) In addition to using a toy ...?,
h_ai_27_00_137,さっきよりも強く……いいわ……,It is stronger than before ...,
h_ai_27_00_138,アンタの手、すごく好き……,I really like your hands ......,
h_ai_27_00_143,もう、乳首ばっかり……！,"Already, only teats ...!",
h_ai_27_00_144,あっ、だから、その刺激ダメぇ,"Oh, so that irritating dame",
h_ai_27_00_145,乳首伸びきっちゃったらどうするのぉ,What would you do if the nipple was stretched out?,
h_ai_27_00_146,そんなに強く引っ張ったら、また……！,"If you pull so hard, again ...!",
h_ai_27_00_147,汚いって言ってるのに……,Even though I told you it was dirty ......,
h_ai_27_00_148,やだもう、おかしくなっちゃう,I'm getting strange anymore,
h_ai_27_00_149,すぐ限界きちゃうから……！,From the limit soon ......!,
h_ai_27_00_150,感じやすいのよ、そこ,"It's easy to feel, there",
h_ai_27_00_151,アンタのせいでお尻がぁ……,Your ass is because of you ...,
h_ai_27_00_152,また敏感になってるぅ,I am also becoming sensitive,
h_ai_27_00_153,クチュクチュいってるぅ,Let's go cook,
h_ai_27_00_154,あ、また指……,"Oh, fingers ......",
h_ai_27_00_155,スルッと入っちゃった……,I got it in and ... ...,
h_ai_27_00_156,やだ、お尻がまた指くわえてる,"No, my butt is holding my fingers again",
h_ai_27_00_157,徐々にゆっくりかきまわすの……,Gradually slowly stirring ...,
h_ai_27_00_158,そう、その感じよ……,"Yes, that feeling ...",
h_ai_27_00_159,慣れないうちは、優しくお願い……,"Before you get used to it, please gently ......",
h_ai_27_00_160,あ、優しい……ん、ありがと……,"Oh, gentle .... Thank you ......",
h_ai_27_00_161,アンタの舌、好きぃ……,"I like your tongue, ...",
h_ai_27_00_162,唾液でベトベトになってく……,I am becoming sticky with saliva ...,
h_ai_27_00_163,そう、舌の先を使って……,"Yes, using the tip of the tongue ...",
h_ai_27_00_164,そんな先っぽばっかり……イイ,Such ahead of time ...,
h_ai_27_00_165,またそんなとこ舐められちゃ……ダメ！,I will not be licked like that ... ... no!,
h_ai_27_00_166,すぐイキそうになっちゃうの……！,I will get excited soon ... ...!,
h_ai_27_00_167,あっ、またそこ……！,"There, again there ...!",
h_ai_27_00_168,もう、ちょっとだけだからね……,Already it's only a bit ... ...,
h_ai_27_00_169,ダメって言っても聞かないんだから……,I will not ask even if I say it is wrong ......,
h_ai_27_00_170,あぁもう、舌入れちゃった,"Oh, I've already put my tongue in",
h_ai_27_00_171,エッチと同じくらい、イク……！？,"About the same as Etude, Iku ...! What?",
h_ai_27_00_172,何回もイカされちゃうっ,It will be squid many times,
h_ai_27_00_173,またイッちゃった……,I got it again ......,
h_ai_27_00_174,こんなにイケちゃうもんなのね……,Ikechi is so cool ......,
h_ai_27_01_000,う、うん……,No……,
h_ai_27_01_001,いい……よ？,OK?,
h_ai_27_01_002,するの……よね？,Doing that ...?,
h_ai_27_01_003,アンタの唇……やぁらか～ぃ（柔らかい）,Your lips ...... Yaita ~ ぃ (soft),
h_ai_27_01_004,キス……きもちいぃの……,Kiss ...... Kimoi い い い ......,
h_ai_27_01_005,またしちゃった……キス,I did it again ... Kiss,
h_ai_27_01_006,アンタもキス……好き？,You too kiss .... Do you like it?,
h_ai_27_01_007,ねぇ、もっと……したくない？,"Hey, more ... do not you want to ...?",
h_ai_27_01_008,私はもうちょっとほしいかも……,I wish I could be a bit more ......,
h_ai_27_01_035,（少し慣れた感じ）ちょっとは平気かも……,(Feeling a bit familiar) It might be fine for a moment ... ...,
h_ai_27_01_036,強いのもいいわね……,It's good to be strong ...,
h_ai_27_01_037,うん……痛くはないわね……,Yeah ... it does not hurt ...,
h_ai_27_01_038,ふぁ……お尻なのに……,Fah ... ... Although it is a butt ......,
h_ai_27_01_039,お尻で……こんなのって……,In the butt ...... like this ...,
h_ai_27_01_040,お尻なんかで、私……,"In the butt, I ...",
h_ai_27_01_041,こ、声が出ちゃうからぁ……,This is because my voice ... ...,
h_ai_27_01_042,オモチャでこんな……,This toy with a toy ...,
h_ai_27_01_043,振動が……ダメぇ,Vibration ... ... no,
h_ai_27_01_044,アンタの手、好きよ……,I like the hands of you ......,
h_ai_27_01_051,つついちゃやぁ……,It's a pleasure ....,
h_ai_27_01_054,あぅ、痛くて気持ちイイ,"Oh, it hurts and makes me feel good",
h_ai_27_01_057,お尻弱いんだってば,I am weak in the buttocks,
h_ai_27_01_060,我慢……できなくなるから,To endure ... Because I can not do it,
h_ai_27_01_063,可愛がってくれるなら……,If it will be pretty ...,
h_ai_27_01_066,濡れてきてるから……大丈夫,I'm getting wet ... ... okay,
h_ai_27_01_069,変な感じ……,Feeling strange ......,
h_ai_27_01_072,少しずつお願い……,Little by little ......,
h_ai_27_01_075,お尻、大事にしたいの,I want to take care of your ass,
h_ai_27_01_078,舌使い、すごい……,"Tongue use, wow ... ...",
h_ai_27_01_081,すごい感じるわ……,I feel awesome ...,
h_ai_27_01_083,もっと、ペロペロ舐めて,"More, licking the licking",
h_ai_27_01_085,汚いのにぃ……,It's dirty ...,
h_ai_27_01_087,お尻がぬるぬるになっちゃう,The butt becomes slimy,
h_ai_27_01_090,めちゃくちゃブルブルしてるぅ,It's messy brooch,
h_ai_27_01_093,すぐ乳首立っちゃうからぁ,I will stand a nipple immediately,
h_ai_27_01_095,このオモチャすごい……,This toy is amazing ...,
h_ai_27_01_097,気持ち良くてもうワケわかんないっ,I feel good and I do not yet understand it,
h_ai_27_01_101,アンタにイカされちゃった……,I have been squatted by you ...,
h_ai_27_01_102,アンタってすごいのね……,You are amazing ......,
h_ai_27_01_103,認めるわ……アンタにこうされるの、好き,"I will accept ... ... I like this, I like it",
h_ai_27_01_106,キス……だいしゅき（大好き）,Kiss ... ... Daizuki (I love you),
h_ai_27_01_107,ちゅっちゅ、いぃわぁ……,"Tsukuyu, Iwaa ......",
h_ai_27_01_108,愛し合ってるって感じ……,Feeling that I love each other ... ....,
h_ai_27_01_109,好きがすごく伝わってくる……,I like it very much ....,
h_ai_27_01_110,アンタ、キスも上手ね……,"You are good at kissing, too ...",
h_ai_27_01_111,この感触、忘れられないかも,This feeling may not be forgotten,
h_ai_27_01_131,大丈夫……痛くないわ,It's okay ... It does not hurt.,
h_ai_27_01_132,ちょっとぐらい激しくても……大丈夫,Even if it is slightly intense ... okay.,
h_ai_27_01_133,汚いのに……もう……,Even though it is dirty ......,
h_ai_27_01_134,お尻なんかでイクわけ……ふんっ,Exciting with ass ... ... Hm,
h_ai_27_01_135,オモチャ……嫌いじゃないけど,Toys ... .... I do not dislike it,
h_ai_27_01_136,くぅっ、またオモチャでこんな……,"Ku っ っ, Also with a toy like this ...",
h_ai_27_01_173,私の身体、どんどんイキやすくなってる……,My body is getting better and easier ... ...,
h_ai_27_01_174,アンタに弱いとこ全部知られちゃったわね……,I was totally known about weak weak ... ...,
h_ai_27_01_188,"（開始,勉強中）ん……あと少し……この調子で……","(Starting, studying) .... a little more ... ... in this condition ......",
h_ai_27_01_189,ひゃあ！　なな、なに、なに……？,"Ay! Nana, what, what ...?",
h_ai_27_01_190,んぁ、ちょっと……あんたぁ……んんぅ……,"Hey, hey ... ... you ... Ah ... ....",
h_ai_27_01_191,んぁん……感じて、ないからぁ……,I feel ... I do not have it ...,
h_ai_27_01_192,んんっ……くすぐったいってば……,Hmm ... ... Tickle ......,
h_ai_27_01_193,んはぁ、あっ……エッチな声、出ちゃうじゃない……,"Ha ha, ah ...... Horny voice, I'm outta ... ...",
h_ai_27_01_194,んぁ……ん、ん……集中、できない……,"Hey ......, I can not concentrate ... ...",
h_ai_27_01_195,（拒否して外される）しつこいって,(Refused to be removed) persistently,
h_ai_27_01_196,これ以上はダメよ,No more,
h_ai_27_01_197,んんぅ……イキそうになって……なんか……,Mr. .... I feel like to be ... ... something ...,
h_ai_27_01_198,んんぅ……勉強中に……感じるわけ……んん……,Unn ...... During study ... .... I feel ... ....,
h_ai_27_01_199,はぁ……バカ……バカ,Huh ...... Idiot ...... Idiot,
h_ai_27_01_200,んはぁ、はぁ……もう、もう～……！,"Ha ha, ha ... ... already, ... ...!",
h_ai_27_02_000,焦らすのやめて,Stop scooping up,
h_ai_27_02_001,そんな見つめられても……,Even if it seems like that ... ....,
h_ai_27_02_002,いいからさっさとやりなさいよ,Do good so quickly,
h_ai_27_02_003,いい……もっとちょうらい（もっと頂戴）,Nice ... ... more (more),
h_ai_27_02_004,らめ……やめないれ……（ダメ、やめないで）,Come ... ... Do not stop ... ... (Do not stop it),
h_ai_27_02_005,アンタの唇、好きだわ……,I like your lips ... ...,
h_ai_27_02_006,キス、クセになっちゃいそう,"Kiss, it seems to be a habit",
h_ai_27_02_007,あれ……私、キスで濡れて……？,That ... ... I got wet with a kiss ... ....?,
h_ai_27_02_008,もっと長くしてても良かったかもね,It might be good even longer,
h_ai_27_02_018,気持ちいいの……,It feels good ...,
h_ai_27_02_019,感じる……わ……,I feel ... ... Wow ...,
h_ai_27_02_020,イイの……もっと,It's more ...... more,
h_ai_27_02_021,あっ、いいわ、そこよ,"Oh, no problem, there",
h_ai_27_02_022,これ好き……,I like this……,
h_ai_27_02_023,それ、すごくイイ,That's awfully good,
h_ai_27_02_024,ダメ、感じちゃう,"I feel bad, I feel it.",
h_ai_27_02_025,我慢できないからぁ,I can not abide,
h_ai_27_02_026,乳首もっと責めて,Blame more nipples more,
h_ai_27_02_027,乳首立たせてぇ,Let your nipple stand,
h_ai_27_02_028,ダメ、やめないで,Do not give it up. Stop it.,
h_ai_27_02_029,濡れてきちゃう,I'm getting wet,
h_ai_27_02_030,クリトリスが……,The clitoris ...,
h_ai_27_02_031,声が止まんなくなるからぁ,Because the voice stops stopping,
h_ai_27_02_032,お尻責めちゃやぁ……,Hey guys fucking their ass ... ...,
h_ai_27_02_033,お尻、イイの,Big ass,
h_ai_27_02_034,そっちの穴も好きぃ,I like the hole like that too,
h_ai_27_02_044,アンタの手でならイカされても……,Even if it is something you do with your hand ... ...,
h_ai_27_02_045,いいわ……もっと触って,Right ... ... Touch me more,
h_ai_27_02_046,すごく上手ね……,You are very good at that ...,
h_ai_27_02_051,もっとツンツンしまくって,Turning off more and more,
h_ai_27_02_052,突かれた瞬間がイイ……,A moment when it got touched ... I ...,
h_ai_27_02_053,乳首が弾かれるぅ,The nipple will be played,
h_ai_27_02_054,乳首つままれるの好きぃ,I like to nip the nipple,
h_ai_27_02_055,もっと引っ張って……,Pull more ... ...,
h_ai_27_02_056,それ、いい感じ……もっと,It's a nice feeling ...... more,
h_ai_27_02_057,アナルがヒクついちゃう,An anal gets hooked,
h_ai_27_02_058,開発しようとしないで,Do not try to develop,
h_ai_27_02_059,お尻で感じちゃうのぉ,I feel it in the buttocks.,
h_ai_27_02_060,やっぱりオマンコ気持ちいい,After all it feels good pussy,
h_ai_27_02_061,あ、そこそこ、もっと,"Oh, so much, more",
h_ai_27_02_062,もっと濡らして,More wet,
h_ai_27_02_063,もう感じてきちゃった,I have already felt,
h_ai_27_02_064,お尻もっとこすって,Rubbing more ass,
h_ai_27_02_065,アンタの手、最高かも,You may be hands best,
h_ai_27_02_066,アンタの指……感じるわ,Your fingers ... I feel it.,
h_ai_27_02_067,中で動かしてみて,Try to move it in,
h_ai_27_02_068,あぁ、もっと濡れちゃう,"Oh, I get more wet",
h_ai_27_02_069,あっ、ズブズブって……,"Oh, Zubuzubu ......",
h_ai_27_02_070,穴が拡げられちゃう,The hole will be expanded,
h_ai_27_02_071,指入れられて……気持ちいい,Fingered ... It feels good,
h_ai_27_02_072,あっ、中かきまわされてる,"Oh, it's being scraped inside",
h_ai_27_02_073,もっとぐちゃぐちゃにして,More messed up,
h_ai_27_02_074,私のアソコ、くちゅくちゅいってる,"My idiot, I heard kuchukuuchuu",
h_ai_27_02_075,あっお尻の中、かきまわされてる,"In the bottom of my back, it's being scraped",
h_ai_27_02_076,だんだん激しく……そう,It gradually becomes fierce ...,
h_ai_27_02_077,私のお尻が……なんか変,My ass is ... ... something strange,
h_ai_27_02_078,アンタの舌がエロい音立ててる,Your tongue is erotic sound,
h_ai_27_02_079,尽くされてるって感じ……,Feeling that it is exhausted ......,
h_ai_27_02_080,もっと舐めて、気持ちいい,Lick it more and it feels good,
h_ai_27_02_081,舌の上で転がして……そう,Rolling over the tongue ...,
h_ai_27_02_082,乳首舐められるの最高っ,The best of licking a nipple,
h_ai_27_02_083,すごい、舌で感じちゃう,"Wow, I feel it with my tongue",
h_ai_27_02_084,激しく舐めて、それイイ,"Violently lick it, it",
h_ai_27_02_085,アナル舐められてる……,The anal is being licked ......,
h_ai_27_02_086,舌がいいの……お尻喜んじゃう,My tongue is nice ... ... I will be pleased.,
h_ai_27_02_087,お尻にまでキスしてくれてるぅ,You kiss me to the butt,
h_ai_27_02_088,アンタの舌のカタチになっちゃうからぁ,Because it will become the shape of your tongue,
h_ai_27_02_089,そんなに中までペロペロされちゃ……,You have to be so lengthened inside ...,
h_ai_27_02_090,オモチャも悪くないわね……,Toys are not bad either ...,
h_ai_27_02_091,もっとそれで遊んでみて,Try playing with it more,
h_ai_27_02_092,まだ激しくてもいいかも,It might be fierce yet,
h_ai_27_02_093,乳首だけこんなに責められてる,Just nipples are blamed so much,
h_ai_27_02_094,振動がすごく感じるのぉ,I feel a lot of vibration,
h_ai_27_02_095,マンコがオモチャで喜んでる,A pussy is pleased with a toy,
h_ai_27_02_096,この振動、たまんないわっ,"This vibration, I do not endure",
h_ai_27_02_097,あっイク、イッちゃう……！,"Oh, itchy ...!",
h_ai_27_02_098,あっもうそろそろイキそう！,"Oh, it will not be long enough!",
h_ai_27_02_099,もうダメ、気持ち良すぎて……！,"Already no good, too pleasant ... ...!",
h_ai_27_02_100,イクわ、イクぅっ！,"Heck, Ikuoo!",
h_ai_27_02_104,もぉ……いじわる,Well ...,
h_ai_27_02_105,早く触ってよ……,Please touch it soon ......,
h_ai_27_02_106,もっともっと欲しいの……,I want more ... ...,
h_ai_27_02_107,アンタの唇、最高だわぁ,"Your lips, the best",
h_ai_27_02_108,どこまで長くできるかな？　なんて……,How long can it be? Why,
h_ai_27_02_109,離れるのが嫌になっちゃう……,I will not want to leave ......,
h_ai_27_02_110,キスでイッちゃうって……アリかな？,Is it alright with a kiss ... Ali?,
h_ai_27_02_111,唇ってこんなにも敏感だったのね,The lips were so sensitive,
h_ai_27_02_120,すごくイイ……,Very good ...,
h_ai_27_02_121,だんだん痺れてくる……,It gradually becomes numb ... ....,
h_ai_27_02_122,たまんないわ、これ,"I'm sorry, this",
h_ai_27_02_123,う～、もうダメ,"Well, no longer",
h_ai_27_02_124,感じすぎちゃうからぁ,I feel too much,
h_ai_27_02_125,乳首立ってもやめないで,Do not stop even if you stand a nipple.,
h_ai_27_02_126,そこ、もっとクリクリしてぇ,"There, more crispy",
