key,jp,en,commentcom_ev_08_317,「なにする？　私なんでもするよ。そ、その……エッチなことも、ドンと来いっだよ！」,"""What do you do, I will do anything ... that ... ... horny things come with Don!""",
com_ev_08_318,「あなたが見ていてくれたらいつもより頑張れる気がする。だからちゃんと見ていてね」,"""If you are watching it makes me feel like I can try harder than usual, so please watch it properly""",
com_ev_08_319,「来てくれたんだねぇ。待ってたの。さぁ入って入ってぇ」,"""You came, you waited. Wait a moment, come in and get in.""",
com_ev_08_320,「コイカツ中なのかなぁ？　相手が居ないのなら、私とコイカツ、どうかなぁ」,"""I wonder if I'm in a carcass? If there is no other person, I wonder if I'm with a carpet with me.""",
com_ev_08_321,「お腹の音、聞えちゃった？　恥ずかしいな～」,"""Hearing the stomach sound, I heard it? It's embarrassing ~""",
com_ev_08_322,「もう放課後……最近、時間過ぎるのが速い気がするの、なんでかなぁ？」,"""After school ...... Recently, it seems that it's fast to spend too much time, why?""",
com_ev_08_323,「ひゃあ！　な、なんで脅かそうとするのかな……もう、いじわるなんだからぁ」,"""Wow, why are you trying to threaten it ... because it's already messing with that?""",
com_ev_08_324,「今度はなにを教えてくれるの？　私、まだまだいろんなことが知りたいの」,"""What will you tell me next time, I want to know more things still""",
com_ev_08_325,「家族写真かな。今も大切にアルバムにしまってるよ。あなたにも見せたいなぁ」,"""I am a family photograph, I keep it carefully in my album, I want to show you as well""",
com_ev_08_326,「今はまだないけど、これからたくさんの思い出と宝物を、あなたから貰う予定だよ」,"""I do not have a present yet, but I will have many memories and treasures from now on from you.""",
com_ev_08_327,「……恋かなぁ　恋がこんなにも幸せで、楽しいものだとは思わなかったの」,"""... ... I'm in love Koi is so happy and I did not think it was fun""",
com_ev_08_328,「特にないよ。私、今は自分のことよりも、あなたのことを優先したいの」,"""I do not have anything particular, I want to give priority to you more than I am now.""",
com_ev_08_329,「うん。普通のパジャマだよ。もしかして、なにか期待してたのかなぁ？」,"""Yeah, it's an ordinary pajamas, did you expect something?""",
com_ev_08_330,「パジャマ以外を期待していたのだったら、ご期待に添えなくて……ごめんなさい」,"""If you were expecting anything other than pajamas, I could not follow your expectations ... I'm sorry.""",
com_ev_08_331,「最近できた夢があるよ。でも、恥ずかしいから、教えてあ～げない」,"""I have a recent dream, but it's embarrassing, so I can not tell you""",
com_ev_08_332,「今はまだ見つかってないよ……あ、そうだ。一緒に将来の夢を探せないかなぁ？」,"""I have not found it yet .... Oh, yes, I wonder if I can find future dreams together?""",
com_ev_08_333,「ん～ん～……別のお話が聞きたいかなぁ」,"""Hmm ... ... I would like to hear a different story""",
com_ev_08_334,「へ～、見てみたかったな～」,"""Huh ~, I wanted to see it ~""",
com_ev_08_335,「すごい……！　私も誰かに話してみるね」,"""Wow ... .... I will talk to someone,""",
com_ev_08_336,「答えわかってるのに聞くの？　もしかして言ってほしいのかなぁ……す、すきだよ」,"""Do you hear that you know the answer? Do you want me to say something ... I love you""",
com_ev_08_337,「えっと、心配になっちゃったのかなぁ。大丈夫、ちゃんと好きだよ？」,"""Well, I wonder if I am worried. Are you OK, do you like it properly?""",
com_ev_08_338,「ずっと待ってると思うなぁ。だから遅れてもいいけど、絶対にちゃんと来てね？」,"""I think I will be waiting forever, so it may be delayed, but absolutely surely come?""",
com_ev_08_339,「あんまり遅かったら、私の方から迎えに行っちゃうよ？」,"""If it's too late, will I pick you up from my side?""",
com_ev_08_340,「う～……難しいなぁ。でもあなたを優先しちゃうかも。だって一緒にいたいんだもの」,"""Well ... it is difficult, but I may give priority to you, because I want to be with you""",
com_ev_08_341,あなたも大切だけど、お友達も同じくらいに大切なの……だから、決められない」,"You are important, but your friends are just as important ... so you can not decide. """,
com_ev_08_342,「恋人同士はみんな結婚するんじゃないの？　私はそのつもりだったんだけどなぁ」,"""Are not you all married with lovers? I was going to do that.""",
com_ev_08_343,「えへへっ、今はまだ教えないよ」,"""Well, I will not tell you now.""",
com_ev_08_344,「このお話は、ちょっと私には早いかなぁ、他のお話しようよ」,"""Is this story a little early for me, let's talk about other things""",
com_ev_08_345,「えへへっ　私も好きだよ。何度でも言うよ。好きだよ。大好きなんだよ」,"""I also like me, I like it again and again, I like it, I like it, I love it.""",
com_ev_08_346,「私はいつもあなたのことを想っているんだよ」,"""I always think of you.""",
com_ev_08_347,「私は重い方だよ。腹痛と吐き気が特につらい。つらいときはお腹さすって欲しいなぁ」,"""I am a heavy one, especially with stomachache and nausea, I want you to get your stomach stuffed when you have pain""",
com_ev_08_348,「どうしてそんなこと聞きたいの？　あ、もしかしてあなたがお話に聞く変態さん？」,"""Why do you want to ask such a thing? Ah, perhaps you are a pervert you ask?""",
com_ev_08_349,「変なこと聞かないの。でも、触られてるときの私の反応、知ってるよね？」,"""I do not hear anything strange, but you know my reaction when you are being touched, do not you?""",
com_ev_08_350,「恥ずかしいから教えない……あなたが自分で、確かめてよ？」,"""Do not tell me because it's embarrassing ... ... you make sure on your own?""",
com_ev_08_351,「うん。あなたのおちんちん美味しいし、何より気持ち良さそうな顔してくれるから……」,"""Yeah, you are tasty and it looks pleasantly more than anything ...""",
com_ev_08_352,「……あんまり考えたことなかった。でも、あなたの感じてくれる顔は好きだから、きっと好きだと思うな」,"""... I have not thought so much, but I like the face that you feel, so I definitely like it.""",
com_ev_08_353,「あなたのここで突かれたらもうなにも考えられない。だって本当に凄いんだもの」,"""You can not think of anything anymore once you get stuck here.",
com_ev_08_354,「どうかなぁ。エッチのときは、いつもいっぱいいっぱいだからなぁ」,"""I wonder, because when it's horny, it's always full.""",
com_ev_08_355,「エッチな話ばっかり……たまには他のお話もしてほしいなぁ」,"""There is only a horny story .... I want you to talk about something else""",
com_ev_08_356,「あなたと一緒にすることは初めてのことばかりだから。その全部が記念日になるよ」,"""It is the first time to do with you, all of it will be an anniversary.""",
com_ev_08_357,「じゃあ、今度試してみるね。私にも上手くできるといいなぁ」,"""Well, I will try it next time, I hope I can do it well""",
com_ev_08_358,「お友達に私が恋に奥手すぎるって言われたの。やっぱりそうなのかなぁ？」,"""My friends told me that I am too deeply in love, maybe they are right?""",
com_ev_08_359,「だったら大胆に行くね。え、えーい！　えへへっ　抱きついちゃったぁ」,"""Well, I will go boldly, ehhhh ... Eh, I hugged her""",
com_ev_08_360,「そっかぁ。コイカツ部の成果が出ているのかなぁ」,"""Okay ... I wonder if the results of the Koi cut part is coming out""",
com_ev_08_361,「家族は多い方がいいのかな？　その、赤ちゃんとか何人、ほしいかなぁ？」,"""Is it better for families, that baby, how many, do you want?""",
com_ev_08_362,「じゃあたくさんエッチしなくちゃだね　私の身体がもてばいいのだけれど」,"""Well, I have to do a lot of etches, I wish I could have my body""",
com_ev_08_363,「二人の時間が減るのが嫌なの？　その気持ち……ちょっとわかるなぁ」,"""Do not want to have time for two people diminished? That feeling ...... I understand a little""",
com_ev_08_364,「あのね、笑わないで聞いてほしいなぁ。私達って、運命の相手同士だよね？」,"""Well, do not laugh, I'd like you to listen, we are fate destinies, are not we?""",
com_ev_08_365,「笑わないでとは言ったけど、そんなに真剣な顔で頷かれたら、私……あぁもぅ」,"""I told you not to laugh, but if I nodded with such a serious face, I ... ... ah noo""",
com_ev_08_366,「ええええっ！　違うの？　でも私は運命の相手だって、信じてるもん」,"""Eh oh yeah! It is different, but I believe in destiny, I believe it.""",
com_ev_08_367,「ねぇねぇ、キスしていいかなぁ？」,"""Hey, can I kiss you?""",
com_ev_08_368,「えへへ　あなたが私をこんな風に育てたんだよ」,"""Eh, you nurture me like this""",
com_ev_08_369,「昨日、夢の中にあなたが出てきたんだよ」,"""Yesterday, you came out in my dreams""",
com_ev_08_370,「あわわっ！　なっなにもしてないよ。ほっ本当だよ。エッチな夢なんて見てないよ」,"""I'm so surprised, I have not done anything, it's true, I have not seen a horny dream""",
com_ev_08_371,「そういえばさっきお友達がね……」,"""By the way, my friends a while ago ...""",
com_ev_08_372,「うん。だからね、あなたのおかげでとても助かっちゃったの」,"""Yeah, that's why I am saved very much thanks to you.""",
com_ev_08_373,「いつもおっぱいを触りたがるのは、私のおっぱいが好きだから？」,"""Because I always like my breasts because I like my tits?""",
com_ev_08_374,「やっぱり男の人は大きいのが好きなんだぁ。大きくて良かった」,"""After all I like men 's big, they are big and good""",
com_ev_08_375,「あなたの手に収まるくらいしかないよ？　でも、それがいいんだね」,"""There are only enough to fit in your hands, but it is good""",
com_ev_08_376,「もぉ～！　好きなのはわかったから。ち、ちっぱいって呼ばないでぇ」,"""I also understood that I love you, so do not call me a chill.""",
com_ev_08_377,「彼女の背の高さって、やっぱり彼氏は気になったりするのかなぁ？」,"""Is her boyfriend really obsessed with her boyfriend?""",
com_ev_08_378,「えへへっ　そうだね。私たちの子供はおっきく育ちそうだよね」,"""It seems to be hard, our children are growing up, are not they?""",
com_ev_08_379,「フィット感が好き？　だ、抱き枕じゃないんだけど……でも、嬉しいなぁ」,"""Do you like fitness, is not it a pillow, but ... but, I'm happy""",
com_ev_08_380,「ええええっ！　なんで急になでなでするのぉ」,"""Why are you suddenly going down?""",
com_ev_08_381,「あなたの好きな女の子の体型を教えてほしいなぁ」,"""I want you to tell me the body shape of your favorite girl""",
com_ev_08_382,「どうして嬉しそうに、二の腕をぷにぷにするの？　や、やめてほしいなぁ」,"""Why are you pleased, I want you to stop my lower arms?",
com_ev_08_383,「普通が一番良いの？　本当？　特徴なにもないのになぁ……でも、ありがとぉ」,"""Is normal is the best? True? Characteristic There is nothing ... ... but thanks.""",
com_ev_08_384,「貧相な身体だけれど、愛してくれてありがとぉ。えへへっ、幸せだなぁ」,"""Though it is a poor body, thank you for loving me."" ""Well, I'm happy.""",
com_ev_08_385,「ええっ！　こんなのでも、あなたの彼女なのになぁ……ぐすん」,"""Well, even though such a thing is your girlfriend ... ....""",
com_ev_08_386,「……私が、そんな風にさせてるんだね……ごめんなさい」,"""...... I am doing that like that ... I'm sorry.""",
com_ev_08_387,「はぁ……良かったぁ。やっと仲良しに戻れた」,"""Huh ... good, I finally got back to good friends.""",
com_ev_08_388,「本当はあなたとケンカなんてしたくないんだよ。仲良くしていたいんだよ」,"""I really do not want to fight with you, I want to make friends.""",
com_ev_08_389,「……えっとね、あ、あの。なにかなぁ？　どうしてそんなに見つめるのかなぁ」,"""... ___ ___ ___ 0 ___ ___ ___ 0 ___ ___ ___ 0",
com_ev_08_390,「はっ、恥ずかしいから、そんなに見ないでほしいなぁ」,"""Wait, it's embarrassing, I want you not to see so much""",
com_ev_08_391,「うっうっ……見られるの苦手って知ってるくせにどうしていじわるするのかなぁ」,"""I know he's not good at being seen ...... Why are you tinkering about doing things?""",
com_ev_08_392,「ふふっ、おっぱいじっと見てどうしたの？」,"""Huh, you looked at your boobs and what did you do?""",
com_ev_08_393,「そんなに熱心に見られたら、私……」,"""If you look so enthusiastic, I ... ....""",
com_ev_08_394,「……見てるだけでいいの？」,"""... You only have to watch?""",
com_ev_08_395,「…………悲しいなぁ」,"""............ sad""",
com_ev_08_396,「あっ……　ちょっと寂しくなってたの。だから手を握ってくれて……落ち着いた」,"""Ah ... ... I got lonely a little, so hold my hand ... calmed down.""",
com_ev_08_397,「やっぱり手を繋ぐのは恥ずかしいよ。今は顔見ないで……！」,"""It's embarrassing to keep hands in hand, do not look at my face now ...!!""",
com_ev_08_398,「そ、その繋ぎ方はダメぇ。恥ずかしくて頭がクラクラしちゃうからダメぇ」,"""Well, that way of connecting it is unbelievable, so I'm ashamed and my head is going to be challenged.""",
com_ev_08_399,「んっ……触るなら、もっと優しくしてほしいな」,"""Wow ... ... If you touch it, I want you to be more gentle.""",
com_ev_08_400,「ひゃあ！　ちょっと触り過ぎだよ……変な気持ちになっちゃうから、もうおしまい」,"""Oh, it's overdone a bit ... ... it will make you feel strange, so it's over""",
com_ev_08_401,「触るだけって言ったよね……なんで摘まむのかなぁ？」,"""You said just to touch ... why do you pick them?""",
com_ev_08_402,「えへへっ、くすぐったいけど、ほっとしちゃう。本当に変な感じだなぁ」,"""Well, it's ticklish but I am relieved, it's a really strange feeling""",
com_ev_08_403,「……あんまり撫でるから痒くなってきちゃった……今は撫でるよりも痒いてほしいな」,"""... ... I got itchy because it pats so much ... I want you to itch over now now.""",
com_ev_08_404,「あ、あ、あぁ……　そ、そこっ、あ、もっと右、行き過ぎ、あ、左。あ、そこぉ」,"""Oh, oh, oh ...... that, there, ah, more right, going too far, oh, left ... Oh no!""",
com_ev_08_405,「またぷにぷに……本当にぷにぷにが好きなんだねぇ、好きなだけぷにぷにしていいよ」,"""Pu Pu Pu ... ... I really like Puni Poni, I like it, you can make it to my favorite dumplings""",
com_ev_08_406,「今日のぷにぷにはいつもより永いなぁ……ひゃあ！　な、なんで抓ったの？」,"""Today's Punipuni is more than usual ...... Ha! Why did you get caught?""",
com_ev_08_407,「ひゃあ！　ひっはりふぎぃ～うまくひゃへれないよ！　は、はなひへよぉ」,"""Haaa! Happy Emperor ~ I will not be able to go well! Hana Hohao""",
com_ev_08_408,「調子に乗り過ぎだよ。もう甘やかさないからね」,"""I am overknowing because I am not pampering anymore""",
com_ev_08_409,「あなたにはたくさんのものを貰ったよ。その全部が私の宝物なんだよ」,"""You got a lot of things, all of it is my treasure""",
com_ev_08_410,「あなたといるとエッチしたくなっちゃうの……二人っきりになれるところに行こ」,"""If you are with you you will want to eroticate ... go to where you can be two persons clearly""",
com_ev_08_411,「そのお話好き　もっと聞かせてほしいなぁ」,"""I would like you to tell me more about that story.""",
com_ev_08_412,「……………………えへへっ」,"""..........................",
com_ev_08_413,「……黙ってたらなにもわからないよ」,"""... ... I do not know if anything goes silent""",
com_ev_08_414,「……ご、ごめん。もう行くね。付いてこないで」,"""..., sorry, I will go, do not follow me""",
com_ev_08_415,「こんな気持ちのままでずっといるのはきついなぁ……」,"""It is tough to have this feeling as it is ... ...""",
com_ev_08_416,「今度はあなたの望んでることをしてあげるね」,"""Next time I will do what you want""",
com_ev_08_417,「私をエッチな子に育てたあなたの責任は、とても重大なんだからね」,"""Your responsibility to raise me to a horny child is so serious, is not it?""",
com_ev_08_418,「うん、また後で。待ってるから」,"""Yeah, I'll be back later. I'll be waiting.""",
com_ev_08_419,「ええっ、おしまい？　まだお話し足りないけど……我慢するね」,"""Well, I'm sorry, I have not spoken yet ... but I will endure it.""",
com_ev_08_420,「うん、また今度ね。バイバイ」,"""Yeah, again next time. Bye bye""",
com_ev_08_421,「……怒ってないよ。ただ悲しかっただけで……別れるなんて、そんなぁ」,"""...... I am not angry, just being sad ...... Separation is not so.""",
com_ev_08_422,「……もう、別れてほしいなぁ。あなたとこれ以上一緒にいるのは、つらいの」,"""... .... I want you to break up already, it's hard for you to stay with you any more""",
com_ev_08_423,「う、うん　えっと、私はなにをすればいい？　ごめんねぇ、まだわかんなくて」,"""Well, yeah, what should I do? I'm sorry, I do not know yet.""",
com_ev_08_424,「……あなたと気持ちいいこと、したいなぁ」,"""... ... I feel good, I want to do""",
com_ev_08_425,「うん　は、早くしよ。身体があついの……」,"""Yeah, do it fast, the body is hot ...""",
com_ev_08_426,「だって、エッチがしたいから……うぅ～っ、なんでじらすのかな」,"""Because I want to do sex ... ... ... why do you start blaming me?""",
com_ev_08_427,「うん　あなたのお願いは全部叶えてあげたいから……もちろん、いいよぉ」,"""Yeah I want to make all your wishes come true ... ... Of course, okay.""",
com_ev_08_428,「ねぇねぇ、変態さん。なんでわざわざ、人がいるところを選ぶのかな？」,"""Hey, Mr. Hentai, why bother choosing where people are?""",
com_ev_08_429,「うん、いいよ。誰にも見つからないようにしなきゃね」,"""Yeah, I do not want anyone to find it.""",
com_ev_08_430,「ここはダメだよ。絶対見つかっちゃうよ。ねぇ……他のところでしよ？」,"""I will not be here, I will absolutely find it ... Hey ... is it elsewhere?""",
com_ev_08_431,「うん　今日はお弁当を作ってきたの。よかったら、食べてほしいの」,"""Yeah, I made lunch box today, if you want, I want you to eat it.""",
com_ev_08_432,「お昼一緒に食べよ？　今日はお弁当を作ってきたんだよ」,"""Let's have lunch together at lunch? I made lunch box today.""",
com_ev_08_433,「えへへっ、お弁当お口に合うといいなぁ」,"""Huh, I hope I can match your lunch box""",
com_ev_08_434,「え、ええっ！　せっかくお弁当作ってきたのになぁ……ううっ」,"""Well, I guess I made lunch boxes a lot ... ... Uuu""",
com_ev_08_435,「うん、いいよ。あなたの彼女として、精一杯頑張るね！」,"""Yeah, well, as your girlfriend, I will do my best!""",
com_ev_08_436,「あなたとコイカツがしたい。どう、かなぁ？」,"""I would like to have a hard cut with you, how do I?""",
com_ev_08_437,「えへへ……やった　今日はどうしてもあなたとコイカツしたかったの」,"""Well ... I wanted to play with you today by all means today.""",
com_ev_08_438,「そっか……残念だけど、今日は引きあげるね……」,"""Oh, well ... I'm sorry, I will withdraw today ....""",
com_ev_08_439,「わ～い　私にとって、あなたと永くいられることはとても嬉しいことなんだよ」,"""For me it is very pleasing to be with you forever""",
com_ev_08_440,「一緒に帰ろ　少しでも永く、あなたと一緒にいたいんだぁ」,"""I want to stay with you for a long time, come back home together""",
com_ev_08_441,「えへへへ……　顔のにやけが収まらないよ。あっ、今こっち見ちゃダメぇ」,"""Hey ... I can not fit my face for fear. Oh, do not look at me now.""",
com_ev_08_442,「一緒に帰れないの！？　そっ、そんなぁ～～……うぅ～」,"""You can not return home together?"" So, she looks like ... ~ .... Hu ~",
com_ev_08_443,「もちろん　早速行こぉ。えっすぐじゃないの？　じゃあ何回寝たらデートの日？」,"""Well, of course you go immediately, are not you doing it, then how many times do you sleep and the date of the date?""",
com_ev_08_444,「じ～…………（デートに行きたいなぁ）」,"""じ ~ ............ (I want to go on a date)""",
com_ev_08_445,「ええっ、デートのお誘い？　行こう行こう　私たち、心が通じ合ってるね」,"""Well, go for a date, let's go Go, our hearts communicate well""",
com_ev_08_446,「……な、なんにも言ってませんよ～だ」,"""... I do not say anything.""",
com_ev_08_447,「うん　二人で勉強した方が捗るものね。今準備するから待っててぇ」,"""Yeah those who studied together will make progress, so wait until we prepare now.""",
com_ev_08_448,「じ～…………（テスト勉強手伝って）」,"""じ ~ ............ (Please help studying the test)""",
com_ev_08_449,「心が通じたぁ　救世主彼氏様ぁ、ありがとぉ」,"""My heart was through, my savior, my boyfriend, thanks.""",
com_ev_08_450,「ううっ……彼女が赤点でもいいのかなぁ」,"""Ugh ... ... I wonder if she can have a red dot""",
com_ev_08_451,「うん。ちゃんとした運動だよね？　エッチなことはしちゃダメだよ」,"""Yeah, it's a proper exercise, do not do sexual things""",
com_ev_08_452,「一緒に身体動かそうよ。たまには運動もしないとなまっちゃうもの」,"""Let's move your body together, something that will sad once you do exercise""",
com_ev_08_453,「えへへ　ありがとぉ、じゃあ、とりあえず。位置について～よ～い、ドン！」,"""Well then, thanks, for the time being. About location about ~ Don!""",
com_ev_08_454,「えっ、どこ行くのかな？　もしかして勘違いしてないかな……普通の運動だよぉ？」,"""Well, I wonder where they are going, have you misunderstood ... Is it normal exercise?""",
com_ev_08_455,「うん　じゃあ、手を繋ごうよ」,"""Well then, let's hold hands""",
com_ev_08_456,「……どこに行くのかな？」,"""... Where are you going?""",
com_ev_08_457,「うん、いいよぉ」「そっかぁ」「うん、わかったよ」「そうなんだぁ！」「うん、そうだねぇ」,"""Yeah, good yea"" ""Okay!"" ""Yeah, I got it."" ""That's right!"" ""Yeah, that's right.""",
com_ev_08_458,「ダメかなぁ」「ダメなんだよ」「嫌かな」「ダメだと思うよ」「嫌だなぁ」,"""No idea"" ""I do not want it"" ""I hate it"" ""I think it is useless"" ""I do not want it""",
com_ev_08_459,「そうだねぇ」「そうなんだぁ」「へぇ～」「それでそれで」「うん」,"""Oh yeah"" ""Yes, that's right"" ""Hey ~"" ""That's it."" ""Yeah""",
com_ev_08_460,「ええっ！」「あわわわ……」「ひゃあ！」「ひぇぇぇ」「びっくりしたよ」,"""Well!"" ""Awa-ha ... ...."" ""Haa!"" ""Hoee"" ""I was surprised""",
com_ev_08_461,「良かったぁ」「やったぁ」「えへへへ」「わ～い」「嬉しいなぁ」,"""It was good"" ""I did it"" ""Hehehehe"" ""Waka"" ""I am happy""",
com_ev_08_461_01,「やったぁ」,"""You did it""",
com_ev_08_462,「も～」「うぅ～」「……はぁ」「むむ～」「えっと……」,"""Well ~"" ""hu ~"" ""...... ha"" ""Mumu ~"" ""Er ... ....""",
