key,jp,en,commentcom_ev_08_171,「うん　幸せだなぁって言葉が口癖になるような結婚生活を送りたいかなぁ」,"""I wish I would send married life that makes words quirky if I am happy.""",
com_ev_08_172,「ケッコンがよくわからないから、理想が思いつかないよ……」,"""I do not really understand Kecon, so I can not think of an ideal ...""",
com_ev_08_173,「照れるから、違うお話にしよ……」,"""Because it is shy, I will make a different story ...""",
com_ev_08_174,「恋愛って難しいよね。男の人が相手じゃないと出来ないのかなぁ？」,"""Love is difficult, is not it impossible if a man is not your opponent?""",
com_ev_08_175,「えっとね……あなたから、いろんなお話を聞くようになってからだと思うよ」,"""Well ... I think I started listening to various stories from you,""",
com_ev_08_176,「あ、あれっ、そういえば……いつからなんだろぉ？」,"""Oh, that one, that said ... from when?",
com_ev_08_177,「そのときはよくわからなかったけど。今思えば、あれがエッチな話だったのかなぁ」,"""I did not quite understand at that time, but I wonder if that was a horny story now,""",
com_ev_08_178,「思い当たらないかなぁ……でも、もしかしたら私が気付いてないだけかも」,"""I wonder if I do not think so ... but maybe I just do not notice it.""",
com_ev_08_179,「うん。でも、ドラマで見るエッチは本当のエッチなの？　どれも辛そうに見えたよ？」,"""Yeah, but the etch you see in the drama is a real sex, none of you seemed to be spicy?""",
com_ev_08_180,「エッチな場面……？　えっと、ごめんねぇ。あんまり記憶にないかなぁ」,"""Horny scene ......? Er, sorry, I wonder if I remember it much""",
com_ev_08_181,「最近は妄想する様になったよ。でも、その妄想が正しいのかはわからないけど……」,"""Recently I became obsessive, but I do not know if the delusion is right ...""",
com_ev_08_182,「エッチのことをよくわかってないから、妄想しようにもなぁ。楽しいことなんだよね？」,"""I do not understand well about etch, so it can be a delusion, it's fun, is not it?""",
com_ev_08_183,「今、そのお話はお腹いっぱいだよ。他のお話にしようよ」,"""Now that story is full of stomachs, let's talk about other things""",
com_ev_08_184,「どうして男の人は、エッチなことに詳しいのかなぁ」,"""Why is the man so familiar with erotic things?""",
com_ev_08_185,「最近、あなたのことが分かってきた気がするのだけれど、あなたはどうかな？」,"""I feel like I've known you recently, but what about you?""",
com_ev_08_186,「えへへっ　あなたもなんだぁ。だったら以心伝心になる日もそう遠くないね！」,"""Eh, you are also yours, so it will not be long before the day when you can keep up with it!""",
com_ev_08_187,「むぅ……私の気のせい」,"""Muu ...... Because of my mind""",
com_ev_08_188,「コーヒーのブラックは飲める？」,"""Can you drink coffee black?""",
com_ev_08_189,「大人の階段を上るために頑張って挑戦してるの。でも、やっぱり苦いのは苦手かなぁ」,"""I'm trying hard to raise an adult's stairs and I am challenging, but I guess they are not good at all bitter.""",
com_ev_08_190,「だよね。お砂糖入れなきゃ、飲めないよ」,"""You know, I have to put in sugar, I can not drink it.""",
com_ev_08_191,「辛いのって平気？　お料理の話なんだけど」,"""It's okay to be painful, it's about cooking,""",
com_ev_08_192,「そうなんだぁ、私も少しなら辛いのも平気だよ。でも汗が出るくらいの辛さはダメぇ」,"""Oh yeah, I am fine if it's a bit too, but I do not feel as hot as sweating.""",
com_ev_08_193,「私もピリピリして痛いのはダメかな。ちなみに私は、プチ甘党なんだよ」,"""I also do not want to hurt and get painful. By the way I am a petit sweet tooth.""",
com_ev_08_194,「お菓子とかスイーツとか、甘いものはよく食べるの？」,"""Do you often eat snacks or sweets, sweets?""",
com_ev_08_195,「同じだね。私は勉強するとき甘いものが欲しくなっちゃうかな。えっとね、集中力が増すんだよ」,"""I am the same, I wonder if I want a sweet one when I study. Well, I will concentrate.""",
com_ev_08_196,「そうなんだ。私も食べ過ぎて虫歯になってからは、あんまり食べないようにしてるの」,"""I do not eat much after I too eat too much and become a tooth decay.""",
com_ev_08_197,「ちょっと聞きたいのだけれど、理想的な胸の大きさってあるのかなぁ？」,"""I'd like to ask you a little, but is there an ideal breast size?""",
com_ev_08_198,「大きいのが良いんだぁ？　ちょこっと恥ずかしいけど、でもやっぱり嬉しいかなぁ」,"""It's good to be big, it's embarrassing a bit, but I still am glad that you are""",
com_ev_08_199,「あんまり気にしたことなかったなぁ。でもお手頃サイズって言われたことはあるよ」,"""I never really cared, but there are things I told you to be affordable.""",
com_ev_08_200,「小さいのがいいの？　えへへっ、なんだかちょこっとだけほっとしたかなぁ」,"""Is it okay to have a small one, I wonder what it was a bit relieved somehow""",
com_ev_08_201,「ねぇねぇ、女の子の身長で好みはあるのかなぁ？」,"""Hey, is there any preference for the height of a girl?""",
com_ev_08_202,「背が高いのは嫌だったのだけれど、あなたがいいって思うなら好きになれそうかなぁ」,"""I did not like being tall, but I wonder if you like it if you think it is good""",
com_ev_08_203,「普通の基準はよくわからないけれど、あなたにとって私はお手頃サイズなんだね」,"""I do not really understand the normal standards, but for you I am affordable size""",
com_ev_08_204,「ちゃっちゃいのが良いんだぁ　えっと、中身が子供っぽいからとか関係ないよね？」,"""Chase is good, um, it does not matter whether the contents are childish or not?""",
com_ev_08_205,「女の子の体型とか気にするのかなぁ？」,"""Do you care about the shape of the girl?""",
com_ev_08_206,「そうなんだ。ならお菓子を控えるのは、もう辞めるね！　えへっ、なに食べよっかな」,"""That's right, if you refrain from sweets, I will quit now! Eh, what are you to eat?""",
com_ev_08_207,「えっ！　じゃあこれ以上成長しないように、ご飯の食べ過ぎには注意しなくちゃだ」,"""Well! Well then, we have to be careful about overeating rice so that it will not grow any further.""",
com_ev_08_208,「良かったぁ。男の人はムチムチが好きって聞いたから、ちょっと心配だったの」,"""It was a good thing, because the guy heard that he likes it, he was a bit worried.""",
com_ev_08_209,「……私と全然違うなぁ」,"""... ... It is completely different from me""",
com_ev_08_210,"「今はこのお話よりも別のことを気にした方がいいんじゃないかな」
","""Now it is better that you should care about different things than this story."" 
",
com_ev_08_211,「そんなに怒ってないよ？　でも次からは気を付けてほしいなぁ」,"""I am not angry so much, but I want you to be careful next time""",
com_ev_08_212,「怒ってはいないけど……ちょっとだけ悲しかったなぁ」,"""I am not angry, but ... I was a bit sad.""",
com_ev_08_213,「もしかして顔になにかついてる？　それならぼ～っと見てないで取ってほしいかなぁ」,"""Maybe I have something on my face? I guess I do not see it at all, I wish I should take it.""",
com_ev_08_214,「ジロジロ見られるのは、ちょっと苦手かも……」,"""It might be a bit weak to be able to watch the girojiro ... ...""",
com_ev_08_215,「ど、どうして見つめてくるの？　なにか喋ってよ。ちゃんとお話しようよ」,"""Why are you staring at me? Talk something. Let's talk properly.""",
com_ev_08_216,「男の人って、胸を見るの好きなんだね。私の胸はいいけど、他の子はダメだよ？」,"""Men like to watch breasts, my breasts are good, but other children are not good?""",
com_ev_08_217,「そんなにじっくりと見られると……さすがに嫌かなぁ」,"""When I look so carefully ...... I do not like the truth""",
com_ev_08_218,「はい！　もうおしまいだよ。胸を見るのは禁止ね」,"""Yes! It's over! It's forbidden to see your breasts.""",
com_ev_08_219,「ちゃんと私の目を見てお話してほしいな」,"""I'd like you to see my eyes properly""",
com_ev_08_220,「んっ……どうしたの、また寂しくなっちゃたのかな？」,"""Why ... what are you doing, have you got lonely again?""",
com_ev_08_221,「急に握られたらびっくりしちゃうよ。次からは許可なく手を握っちゃダメだからね」,"""I will be surprised if it is suddenly grasped, because I can not hold my hands from the next without permission""",
com_ev_08_222,「甘えん坊なのかな？　男の子だったらいつまでも甘えてちゃダメなんだよ」,"""Is not it a sweet boy? If you are a boy, you should not take it long forever.""",
com_ev_08_223,「ええっ！　胸を触るなら、ちゃんと許可を取ってほしいなぁ、はい。やり直しだよ」,"""Wow! If you touch your chest, I want you to get permission, yes, I will start over.""",
com_ev_08_224,「勝手に触ったらダメなんだよ。もう次はないんだからね？」,"""If you touch it without permission, you do not have any more next time, are you?""",
com_ev_08_225,「ええっ！　ど、どうして胸を触るのやめてくれないの。本当にもうダメだからね」,"""Well, why are not you stopping touching my chest so it's really no good""",
com_ev_08_226,「男の人に頭を撫でられると、くすぐったくて、フワッとして、なんだか変な感じ」,"""When a man strokes her head, it's tickling, it feels somewhat strange""",
com_ev_08_227,「どうして突然、頭を撫でたの？　私、褒められるようなことは、なにもしてないよ？」,"""Why did you suddenly stroked your head? I do not do anything like praise?""",
com_ev_08_228,「う～……子ども扱いはしないでって言ったのに……もう触るの禁止だよ」,"""Well ... ... I told you not to treat children ... ... it's forbidden to touch anymore""",
com_ev_08_229,「あひゃっ……もしかして、ぷにぷにしたところが好きなのかなぁ？」,"""Ah-ha ... maybe, do you like what you punched in?""",
com_ev_08_230,「あひゃっ、突然つつかれたらびっくりしちゃうから。ちゃんと許可取ってほしいなぁ」,"""Ah-ha, I suddenly get surprised if I get suddenly, I want you to accept permission properly""",
com_ev_08_231,「やめてぇ、そんなに強くつつかないで。これ以上つつかれたらぶよぶよになっちゃう」,"""Do not get so strong, do not go over it if you get more than this,""",
com_ev_08_232,「もう本当にダメなんだから、次からは気を付けてほしいなぁ」,"""Because it's really no good, I want you to be careful next time""",
com_ev_08_233,「あなたのことはとても信頼してるんだぁ。これからもよろしくね」,"""I trust you very much, please continue to do.""",
com_ev_08_234,「もっといろんなことを教えてほしいのだけど……ダメかな？」,"""I'd like you to tell me more about you ... but it does not work?""",
com_ev_08_235,「あなたのお話、とっても面白かったよ」,"""Your story was very funny.""",
com_ev_08_236,「…………今日も良い天気だなぁ」,"""... ............ It's fine weather today,""",
com_ev_08_237,「…………えっと、どうしたのかな？」,"""............ Well, what's wrong?""",
com_ev_08_238,「怒ってない。ただ哀しくなっただけだよ」,"""I am not angry, I just got sad.""",
com_ev_08_239,「もうずっと哀しいままなんだよ」,"""It has been sad for a while now""",
com_ev_08_240,「もっとも～っと、たくさんお話がしたかったなぁ」,"""Most often, I wanted to talk a lot.""",
com_ev_08_241,「エッチな話に興味があるの。次はもっとエッチな話を教えてほしいなぁ」,"""I am interested in horny stories, I want you to tell me more strange stories next time""",
com_ev_08_242,「もうこんな時間。楽しくて時間を忘れちゃった。続きはまた今度だね」,"""It's been such a long time, I had fun and forgotten my time.",
com_ev_08_243,「あ、そうだったね。引き止めちゃってごめんなさい」,"""Oh, that's it, I apologize for stopping.""",
com_ev_08_244,「またお話しようね。バイバイ」,"""Let's talk again. Bye bye""",
com_ev_08_245,「私にはまだ好きって気持ちがよくわからないよ。だからね、ごめんなさい」,"""I do not know how I feel I still like it, so I am sorry.""",
com_ev_08_246,「うん。私も好きだよ。この胸のドキドキが、好きっていう気持ちだったんだね」,"""Yeah, I like it too, I felt like I liked this chest pounding,""",
com_ev_08_247,「ごめんなさい。まだ好きって気持ちが分からなくて…」,"""I'm sorry, I do not know how I feel I still love you ...""",
com_ev_08_248,「あなたのことが気になるの。この気持ちを確かめるために、私と付き合ってほしいの」,"""I am worried about you, I want you to go out with me to confirm this feeling""",
com_ev_08_249,「あ、あぁ……　か、身体がふわふわする。とってもとっても、ふわふわするの！」,"""Oh, oh ......, your body will be fluffy, it will be very fluffy, very fluent!""",
com_ev_08_250,「この気持ち……あなたには届かないんだね。はぁ……思ってたよりもつらいなぁ」,"""This feeling ...... You do not reach it ... huh ... ... It's harder than I thought""",
com_ev_08_251,「この気持ちが消えてくれないの。あのね。もう一度だけ聞くね……私じゃダメかな？」,"""This feeling will not disappear ... Ano, I will only hear it once more ... Is it not me?""",
com_ev_08_252,「あっあっ……あぁ。どうして……嬉しいのに、嬉しいのに、涙が止まらないの！」,"""Ah ... ... Oh ... why ... I'm glad, but I'm glad, but my tears will not stop!""",
com_ev_08_253,「……えへへっ、ダメだったかぁ……大丈夫だよ。このくらいで、へ、へこたれないよ」,"""... ... Huh, it was useless ... okay, this is around, you can not beat it.""",
com_ev_08_254,「エッチって、好きな人同士でするものなんだよね？　私たち好き同士なのかなぁ」,"""Ecchi is what you like with each other, do not you like us?""",
com_ev_08_255,「エッチのこと、ちゃんと教えてくれるなら……いいよぉ？」,"""If you tell me about etch, do not you tell me ...?",
com_ev_08_256,「エッチは興味あるのだけど……恋人同士じゃないから、あなたとするのはダメ」,"""I am interested in etch, but ... It is not a boyfriend, so it's not good to be with you""",
com_ev_08_257,「ここで……いいよぉ。人がいる場所でのエッチの仕方、教えてくれるんだね」,"""Here ... .... No, you tell me how to etch in a place where there are people""",
com_ev_08_258,「ええっ！　ここだと見られるから……嫌かなぁ」,"""Well, because it can be seen here ... ... I hate it""",
com_ev_08_259,「えっ……ここでするの？　ちゃんとできるか心配だよ。まずはなにをすればいい？」,"""Oh ... ... what are you doing here? I am worried if I can do it properly, what should I do first?""",
com_ev_08_260,「こんなところでエッチしたら、絶対に人が来ちゃうよ……ここは嫌だなぁ」,"""If you sex with such a place, people will definitely come ... ... I do not want it here""",
com_ev_08_261,「えっとね。エッチなこともっと知りたいんだぁ。だから教えてほしいの」,"""Well, I want to know more about horny things, so please let me know.""",
com_ev_08_262,「エッチのことが頭から離れないの。早く気持ちいことしようよ　私なんでもするよ」,"""I do not leave my heads off my head. Let's feel easy soon I will do anything.""",
com_ev_08_263,「えっ、ええ～！　そ、そんなぁ……エッチしたかったのになぁ」,"""Well, yeah ... Sorry about that ... ... I wanted to do it""",
com_ev_08_264,「いいのぉ？　じゃあ一緒に食べよう」,"""Okay, okay? Let's eat together""",
com_ev_08_265,「今日のお昼は、お友達と食べる約束をしてるんだぁ。だからまた今度誘ってね」,"""I have an appointment to eat with my friends this afternoon, so please invite me next time.""",
com_ev_08_266,「今日のお昼ご飯は誰かと食べる？　なにも予定がないなら、一緒にどうかなぁ？」,"""Will you eat lunch today with someone? If there are not any plans, how about together?""",
com_ev_08_267,「いいのぉ！　やったぁ　じゃあ早速行こうよ。もうお腹がぺこぺこなんだぁ」,"""Okay! I did it, then let's go at once, huh I'm already hungry""",
com_ev_08_268,「う～……残念だなぁ。じゃあまた今度誘うね」,"""Well ... I'm sorry, then I will ask you again next time""",
com_ev_08_269,「うん、いいよぉ。どんなことをするのかなぁ？」,"""Yeah, well, what kind of things will you do?""",
com_ev_08_270,「今日は予定が入ってるの。また今度誘ってくれないかなぁ」,"""I have an appointment today, I wonder if I will invite him next time""",
com_ev_08_271,「コイカツをしてみたいなあ……どうかな？」,"""I'd like to try a cookie ... How is it?""",
com_ev_08_272,「えへへっ、やったぁ　じゃあ、最初はなにからする？」,"""Huh, I did it, then what will we do from the beginning?""",
com_ev_08_273,「ええっ！　他の人とコイカツするの？　せっかく勇気振り絞ったのになぁ」,"""Wow! Would you care for others with someone?",
com_ev_08_274,「ええっ！　誘ってくれてありがとぉ。嬉しいなぁ」,"""Thank you for inviting me! I am happy""",
com_ev_08_275,「ごめんねぇ。今日は急いで帰らないといけないの」,"""I'm sorry, I have to hurry to go home today""",
com_ev_08_276,「ねぇねぇ、ひとりかな？　ひとりだったら一緒に帰ろうよ」,"""Hey, is it alone? Let's go home together if I am alone""",
com_ev_08_277,「えへへっ。じゃあ、帰ろっかぁ」,"""Well then, return home""",
com_ev_08_278,「うっう～残念だなぁ……」,"""Wow - that's too bad ... ....""",
com_ev_08_279,「デートは私にはまだ早いよ。だってなにしたらいいのかよくわかんないもの」,"""Dating is still early for me, because what I do not know exactly what to do""",
com_ev_08_280,「いいよぉ　えへへっ。デートってワクワクするよね」,"""Well, I'm excited about dating, are not you?""",
com_ev_08_281,「最近はちょっと忙しくて……ごめんなさい」,"""I am somewhat busy recently ...""",
com_ev_08_282,「じ～…………で、デート……しよ？」,"""Huh ... ............, go on a date ...?",
com_ev_08_283,「えへへっ、断られたらどうしようかなぁってドキドキだったんだよぉ」,"""Well, it was exciting to wonder what to do if refused.""",
com_ev_08_284,「そっかぁ……残念だなぁ。じゃあまた今度誘ってみるね」,"""Oh that's ... I'm sorry, then I'll invite him next time""",
com_ev_08_285,「本当ぉ！？　今回のテスト範囲、広くてひとりじゃカバー出来なかったんだぁ」,"""The real test! Range of this time, I could not cover it widely alone""",
com_ev_08_286,「ん～……やっぱり集中したいから、今回はひとりで頑張ってみるね」,"""... ... I want to concentrate after all, so I will try hard on my own this time""",
com_ev_08_287,「わからないところがたくさんあるの！　テスト勉強、手伝ってくれないかなぁ」,"""There are lots of things I do not know! Studying and studying, I wonder if you can help me""",
com_ev_08_288,「ありがとぉ。今回は成績落とすわけにはいかなくて。えっ前回の成績？　えっと……」,"""Thank you, this time it is not possible to get rid of the grades ... Episode of the previous round? Er ... ....""",
com_ev_08_289,「ええええっ！　どうしよう……私、とってもピンチなんだよ」,"""Well! What shall I do ...... I am very pinch.""",
com_ev_08_290,「うん。いいよぉ！　駆けっこする？」,"""Yeah ... OK, are you going to rush?""",
com_ev_08_291,「ごめんねぇ。これからお友達と運動するんだよ」,"""I'm sorry, I'm going to exercise with my friends from now on,""",
com_ev_08_292,「駆けっこで勝負しようよ」,"""Let's fight with each other""",
com_ev_08_293,「男の人が相手でも負けないよ！」,"""A man is not defeated even by the opponent!""",
com_ev_08_294,「ええっ！　動きたくないの？　そんなんじゃあ、身体がなまっちゃうよ」,"""Well! I do not want to move, I guess that's going to get rid of my body""",
com_ev_08_295,「ん～……ちょっとだけ、考えてさせてもらってもいいかなぁ」,"""... ... for a moment, I wonder if you think about it""",
com_ev_08_296,「ねぇねぇ、コイカツ部に興味があるのだけど、私、入っちゃダメかな？」,"""Hey, I'm interested in the Koikatsu Department, I do not want to enter, is it?""",
com_ev_08_297,「うん。どうしたのかなぁ？」,"""Yeah, what's wrong?""",
com_ev_08_298,「えっと、今はちょっと忙しくてダメなんだぁ」,"""Well, I am a little busy right now, so it's useless,""",
com_ev_08_299,「ええっ！　入ってきちゃたの……もしかして、おしっこ我慢してたのかなぁ？」,"""Eh! I came in ... ... Maybe I was holding pee?""",
com_ev_08_300,「あわわわっ。私ひとりだったらよかったのだけど……今は、ダメだと思うの」,"'Well, I wish I could be alone ... ... I think I'm no good now.'",
com_ev_08_301,「いらっしゃ～い。今日はどういった御用なのかなぁ？」,"""Welcome, what kind of clothing do you need today?""",
com_ev_08_302,「えっとね……みんな居るから、今はダメなんだよ。だから出ていってね」,"""Well ... ... because we are all out there now is no good, so please go out.""",
com_ev_08_303,「…忙しいの、後にして」,"""... You are busy, come back later""",
com_ev_08_304,「……今はなにも話したくないの」,"""... ... I do not want to talk to anything now""",
com_ev_08_305,「うぅ……ごめんね。私も話していたいけど、急いでいるの」,"""Uh ... I'm sorry ... I want to talk but I am in a hurry.""",
com_ev_08_306,「下着に興味があるのかなぁ？　見てもいいけど……恥ずかしいからちょこっとだけ」,"""I wonder if you are interested in underwear? You can see it ... but it's embarrassing so just a bit.""",
com_ev_08_307,「私のはいくらでも見ていいけど……他の子は見ないでほしいなぁ」,"""I do not mind seeing anything ... but I do not want other children to see it.""",
com_ev_08_308,「どんなポーズをしたらいいかなぁ？　なんでも言ってね」,"""What kind of pose should I do? Please say anything""",
com_ev_08_309,「他の子の水着をジロジロみたらダメなんだよ。あっち向いてね」,"""You can not look at other swimsuits of a girl, you look good.""",
com_ev_08_310,「ぽかぽかして気持ちいいね。そうだ。一緒に日向ぼっこしょっかぁ」,"""It feels warm and comfortable. That's right, sunny place together""",
com_ev_08_311,「静かなところでまったり過ごすのっていいよね　なにか読む？　取ってくるよ？」,"""It's okay to spend your time in a quiet place, do you read something?""",
com_ev_08_312,「いい匂いにつられちゃった～えへへ」,"""I got a good smell ~ Eh,""",
com_ev_08_313,「ちゃんと付いてきてるよ？　心配性だなぁ」,"""I'm following you properly, I'm worried""",
com_ev_08_314,「ここに入りたいの？　でもあなたはここに入っちゃダメなんだよ」,"""I want to get in here, but you can not get in here.""",
com_ev_08_315,「嬉しいなぁ、幸せだなぁ、早くデートに行きたいなぁ」,"""I am happy, I am happy, I want to go on a date soon""",
com_ev_08_316,「恋すると幸せになるんだね。私、あなたの彼女になれてよかったなぁ」,"""When you fall in love you will be happy, I am glad I got used to your girls""",
