key,jp,en,comment
com_ev_08_000,「ええっ！　女子トイレになにか用なのかなぁ？」,"""Wow! Is it for something in the girls' restroom?""",
com_ev_08_001,「えっと……ロッカー室になにか用なのかなぁ？」,"""Er ... ... Is it for something in the locker room?""",
com_ev_08_002,「ちょっと急いでるの。ごめんねぇ」,"""I'm in a hurry. I'm sorry,""",
com_ev_08_003,「……なにかなぁ？」,"""... What do you mean?""",
com_ev_08_004,「ごめんねぇ。今急いでるんだぁ」,"""Sorry, I am in a hurry now""",
com_ev_08_005,「……すーすー………んん～……すーすー……」,"""... .... ー ー ー ー ー .............. ー ー ー ー ー ー ー ......""",
com_ev_08_006,「あの～……ちょっとだけ恥ずかしいかな」,"""Um ... that ... a bit embarrassed,""",
com_ev_08_007,「じっと見てどうしたの？」,"""What have you done by staring?""",
com_ev_08_008,「あなたはどこに居てもすぐにわかっちゃうね」,"""You will soon find out where you are,""",
com_ev_08_009,「ここで会うとは思わなかったなぁ、本が好きなの？」,"""I did not expect to see you here, do you like books?""",
com_ev_08_010,「こんなところで奇遇だねぇ。もしかして運命の糸で……えへっ」,"""It's odd in such a place, maybe by the fate of destiny ......""",
com_ev_08_011,「勉強出来る場所を探してるのかな？」,"""Are you looking for a place to study?""",
com_ev_08_012,「ここで勉強は出来ないよ？　勉強するなら図書室がいいと思うよ」,"""I can not study here, I think the library is good if I study.""",
com_ev_08_013,「ねぇねぇ、私ね。少しだけあなたに興味が沸いてきたみたいなの」,"""Hey, I'm a little bit interested in you""",
com_ev_08_014,「男の人ってやっぱり、女の子に興味津々なのかなぁ？」,"""Are men really interested in girls, are not they?""",
com_ev_08_015,「あ、見つけたぁ。こっちだよ！」,"""Oh, I found out, here it is!""",
com_ev_08_016,「コイカツ部、発見！　今日はここなんだね」,"""Koikatsu Department, Discovery! Today is here, is not it?""",
com_ev_08_017,「コイカツ部、頑張ってるね。偉い、偉い」,"""I'm doing my best at the Koi cut part, great, great""",
com_ev_08_018,「やっとご飯だよ。嬉しいなぁ」,"""I finally got rice, I am happy""",
com_ev_08_019,「放課後だね。今日もお疲れさま」,"""After school. Thank you for today.""",
com_ev_08_020,「ひゃあ！　もう、びっくりしたよ。脅かさないでほしいなぁ」,"""Oh, I was surprised, I do not want you to threaten me""",
com_ev_08_021,「えっ、なにかな？」,"""What, something?""",
com_ev_08_022,「えっとね、興味が沸いた人はいつの間にか仲良くになってるかなぁ」,"""Well, I wonder if people who are interested get along well with each other""",
com_ev_08_023,「そんなことはないと思うけど……気のせいじゃないかなぁ」,"""I do not think there is such a thing ... ... I wonder if it is due to mind""",
com_ev_08_024,「うん、あるよぉ。すっごく美味しくてお気に入りなんだぁ」,"""Yeah, there are. I am very good and it's my favorite.""",
com_ev_08_025,「へぇ、初めて聞いた。今度食べてみようかなぁ」,"""Well, I heard it for the first time. I wonder if I should eat it next time""",
com_ev_08_026,「不本意だけど、子供っぽいっていわれたことがあるよ。全然違うんだけどなぁ」,"""I am reluctant but I have been told that I am childish, they are completely different,""",
com_ev_08_027,「一言？　騙されやすそうって言われたことがあるの。そんな風に見えるかな？」,"""I have something told you that it is likely to be deceived, does it look like that?""",
com_ev_08_028,「…違うお話がいいかなぁ」,"""... I wonder a different story""",
com_ev_08_029,「うん。雲が気持ちよさそうだね」,"""Yeah, the clouds seem to feel good""",
com_ev_08_030,「それ見たよ！　凄かったなぁ」,"""I saw that! It was awesome""",
com_ev_08_031,「知らなかった。教えてくれてありがとぉ！」,"""I did not know, thanks for telling me!""",
com_ev_08_032,「ないかな。男の人とこんなに会話したの、あなたが初めてだもの」,"""I do not have a conversation with a guy like this, you are the first time.""",
com_ev_08_033,「うん。今まではあんまり興味がなかったものだから」,"""Yeah, I have not had much interest so far.""",
com_ev_08_034,「言葉の意味は知ってるのだけれど、気持ちはわからない。だから気になってるの」,"""I know the meaning of the word, but I do not know how I feel, so I am curious.""",
com_ev_08_035,「恋はしたことないから、誰か教えてほしいなぁ」,"""Because I have never been in love, I want someone to tell me""",
com_ev_08_036,「うーん、物静かな人、かなぁ。大人っぽくて見えて素敵だと思う」,"""Well, quiet person, I wonder ... I think it's nice to look like an adult.""",
com_ev_08_037,「うーん……色々教えてくれる人？　ごめんね、よく分からないかも……」,"""Well ... who are you telling me? Sorry, I do not know well ...""",
com_ev_08_038,「その、ちょっと恥ずかしいかな」,"""That is a bit embarrassing,""",
com_ev_08_039,「いろいろだよ。でも今は、あなたのお話で持ちきりかなぁ」,"""A lot of things, but now I wonder if you can take it with your story""",
com_ev_08_040,「大丈夫だよ。あなたが頑張ってるところ見てたよ」,"""I'm fine, I saw you trying hard.""",
com_ev_08_041,「ええっ、教えてもらえるなら知りたいなぁ。興味あるんだぁ」,"""Well, I want to know if you can tell me, I'm curious.""",
com_ev_08_042,「率先していろいろと動いてくれそうだし、私はいいと思うなぁ」,"""I take the initiative and will move around in various ways, I think that I am good""",
com_ev_08_043,「えっと……あんまり、いい想像はできないかも」,"""Er ... ... well, I can not imagine a good idea.""",
com_ev_08_044,「慎重な人って真面目そうだから、私は素敵だと思うなぁ」,"""Careful people seem to be serious, so I think that I am nice.""",
com_ev_08_045,「なんだか真面目過ぎて、退屈しそうだなぁ……」,"""It's kind of serious, it looks like I'm getting bored ...""",
com_ev_08_046,「なんでも知ってそうだよね。あんなことや、こんなこと……いろいろ聞いてみたいな」,"""It seems that you know everything. I like to ask such things, such things ... ....""",
com_ev_08_047,「私、難しいのは苦手なので、その人に付いて行けるのか心配だなぁ」,"""I am not good at difficult, so I worry about being able to follow that person""",
com_ev_08_048,「空を自由に泳ぐ雲みたいな人だったら、すっごく素敵だと思うの」,"""If it's a person like a cloud that freely swims in the sky, I think it's pretty nice.""",
com_ev_08_049,「私、きっと……置いてけぼりにされそう」,"""I, surely ... I'm going to leave it open""",
com_ev_08_050,「優しくされると幸せな気持ちになるよ。幸せな気持ちは大歓迎だよ」,"""I feel happy when I am kind and happy feelings are greatly appreciated.""",
com_ev_08_051,「優しいだけじゃなくて、たまに怒ってくれる人がいいなぁ」,"""Not only is it not only gentle, but people who get angry sometimes are good""",
com_ev_08_052,「かっこいいと思うよ。私もクールな女性を目指してるの！」,"""I think it's cool, I am also aiming for a cool woman!""",
com_ev_08_053,「一緒に笑ってくれるかな……そうじゃなかったら、ちょっと寂しいなぁ」,"""I wonder if they will smile together ... If it is not so, I feel somewhat lonely""",
com_ev_08_054,「……うん。興味あるよ。へ、変かなぁ」,"""... Yeah, I'm curious, is it weird?""",
com_ev_08_055,「エッチなこといろいろ知りたいって思っちゃうの、可笑しいかな？」,"""I think I want to know a lot of horny things, is it funny?""",
com_ev_08_056,「全然知らないから、教えてもらえると嬉しいなぁ」,"""I do not know at all, so I'm happy if you tell me""",
com_ev_08_057,「わかんない。でもきっと楽しいことなんでしょ」,"""I do not know, but it is certainly fun,""",
com_ev_08_058,「ないと思うよ。私の両親もエッチしてるのかなぁ、してたらいいなぁ」,"""I do not think that my parents are also etched, I wish I could do it""",
com_ev_08_059,「ないと思う。見てみたいなぁ両親のエッチ」,"""I do not think I want to see it. Parents' etiquette""",
com_ev_08_060,「そんなのわかんない……私、他の話が聞きたいなぁ」,"""I do not know such ... ... I want to hear other stories""",
com_ev_08_061,「その顔、なにか新しいこと教えてくれるのかなぁ」,"""Does that face tell me something new?""",
com_ev_08_062,「うんっ知りたい！　とても気になるもの。だって楽しそうだし」,"""I want to know it, it is very interesting, because it seems to be fun""",
com_ev_08_063,「へぇ～それってエッチな話？」,"""Well ... is that strange story?""",
com_ev_08_064,「……私って、やっぱり子供っぽいのかなぁ？」,"""... Well, I guess they are childish, are not they?""",
com_ev_08_065,「安心した。あなたにそんな風に思われていたらショックだったもの」,"""I felt relieved, what I was shocked when I thought of you like that""",
com_ev_08_066,「そっかぁ……ちゃんと答えてくれて、ありがとう」,"""Oh ... ok thank you for answering properly""",
com_ev_08_067,「……なんで黙るの？　なんで黙るのぉ？」,"""... Why are you silent? Why are you silent?""",
com_ev_08_068,「男の人も動物好きなのかなぁ？」,"""Do men like animals too?""",
com_ev_08_069,「私も好きだよ　小動物みたいって、よく言われるから親近感が沸くんだぁ」,"""I like it too, because it is often said that it seems like a small animal, my affinity is boiling.""",
com_ev_08_070,「私も苦手なの。毛が多いと、くしゃみが止まらなくなっちゃうから」,"""I am not good either, as I have a lot of hair, I will stop sneezing.""",
com_ev_08_071,「男の人ってたくさんご飯を食べるのが好きなの？」,"""Do men like to eat a lot of rice?""",
com_ev_08_072,「私もたくさん食べるよ。今度どっちがたくさん食べられるか勝負だね」,"""I also eat a lot, it's a game whether you can eat more of either next time,""",
com_ev_08_073,「ええっ！　他の人はもっとたくさん食べるんだね。男の人って凄いなぁ」,"""Well! Everyone else eats more, men are amazing.""",
com_ev_08_074,「ひとり暮らしって聞いたよ？　お料理も自分で作るのかなぁ？」,"""I heard you are living alone, I wonder if you cook yourself, too?""",
com_ev_08_075,「そうなんだぁ！　じゃあ今度、お弁当の交換っこだね」,"""That's right! Well then, next time you have a bento exchange""",
com_ev_08_076,「そうなんだ。私もお料理は……修行中なの」,"""Yeah, I am also cooking ...... I am training.""",
com_ev_08_077,「男の子ってやっぱり体育の授業が好きなのかな？」,"""Do boys like gym classes after all?""",
com_ev_08_078,「やっぱりそうなんだぁ。私も、駆けっこには自信があるの」,"""I guess that's the way I am, I have confidence in running.""",
com_ev_08_079,「そうなの？　ちょっと意外だけど、私と一緒で嬉しいかも」,"""Is that so? It's a bit surprising, but I'm glad it might be with me.""",
com_ev_08_080,「勉強は毎日する方？」,"""Are you studying hard every day?""",
com_ev_08_081,「テスト前にだけちょこっと……今度一緒に勉強の教えっこしようよ」,"""Before testing just a little ... ... Next time let's teach studying together""",
com_ev_08_082,「毎日は大変だよね。私もそんなにやらないかなぁ」,"""Every day is hard work, I wonder if I do that much""",
com_ev_08_083,「男の人の私服姿がちょっと気になるのだけれど。おしゃれってするのかな？」,"""I am a little worried about the appearance of a man's clothing, but I wonder if it will be fashionable?""",
com_ev_08_084,「えへへっ、やっぱり男の人もおしゃれするんだ　見る機会があればいいのになぁ」,"""Well, I wish I had a chance to see men fashionable after all""",
com_ev_08_085,「一緒だよ。私も動きやすい洋服、選んじゃう」,"""Together, I will choose a handy clothes,""",
com_ev_08_086,「そっかぁ。私とは違うんだね」,"""Oh that, it is different from myself""",
com_ev_08_087,「……お話する前に、言ってほしいことがあるな」,"""... Before talking, there is something I want you to say""",
com_ev_08_088,「ごめんなさい。仲直り、してほしいなぁ」,"""I'm sorry, I want you to reconcile,""",
com_ev_08_089,「まだ心の整理がついてないから……」,"""Because my heart is not yet organized ...""",
com_ev_08_090,「えっと、そんなに見つめてどうしたの？」,"""Well, what have you gazed at so much?""",
com_ev_08_091,「ええっ！　いくらなんでも見過ぎじゃないかなぁ」,"""Well! I wonder how much everything is over looking""",
com_ev_08_092,「そ、そんなに睨まないでよ……」,"""Oh, do not look at that much ... ....""",
com_ev_08_093,「あれ、どうして俯いてるのかな？」,"""Why are you falling asleep?""",
com_ev_08_094,「ねぇ、ちゃんと顔を見てお話しようよ」,"""Hey, let's talk face to face""",
com_ev_08_095,「俯いてたらちゃんとお話が出来ない。顔を上げてよ」,"""I can not talk properly when I'm down, please lift my face""",
com_ev_08_096,「……お話してるのに、下ばかり見ないで欲しいなぁ」,"""... I'm talking, but I do not want you to look down on the bottom""",
com_ev_08_097,「どうしたの……寂しくなっちゃったの？」,"""What's wrong ... did you get lonely?""",
com_ev_08_098,「えっと……手を握るのは、もうちょっと仲良くなってからね」,"""Er ... ... It's because I got a hand a little better.""",
com_ev_08_099,「ええっ！　手を握るのはまだダメだってば」,"""Wow! It's not good to hold a hand yet""",
com_ev_08_100,「えっ！　どうして今、胸を触ったの？」,"""Why have you touched your chest now?""",
com_ev_08_101,「え、ええっ……びっくりするから、やめてほしいなぁ」,"""Well, yeah ... ... I will be surprised, so I want you to stop it""",
com_ev_08_102,「ど、どうして何度も胸を触ろうと……するの？」,"""Why are you going to touch your chest many times ...?""",
com_ev_08_103,「どうして、頭を触ったの？」,"""How did you touch your head?""",
com_ev_08_104,「私……もう子供じゃないんだよ？」,"""I ... ... is not it a child anymore?""",
com_ev_08_105,「子供扱いはしないでほしいな……」,"""I do not want children to handle them ...""",
com_ev_08_106,「んっ……頬っぺたが気になるのかなぁ？」,"""Why ... ... are you concerned with cheeks?""",
com_ev_08_107,「も、もう……いっぱい触ったでしょう？」,"""Well, you have already touched a lot ...?""",
com_ev_08_108,「う、上手く喋れなくなるから、手を放してほしいな」,"""Well, I will not be able to speak well, so I'd like you to let go of me""",
com_ev_08_109,「どうしてそんなことばかりするのかなぁ……」,"""Why are you going to do such a thing only ...?""",
com_ev_08_110,「男の子の兄弟がいたら、こんな感じなのかなぁ」,"""I wonder if the boys' brothers are like this""",
com_ev_08_111,「次はどんなことを教えてくれるの？」,"""What will you tell me next?""",
com_ev_08_112,「えっと、なにか教えてくれるの？」,"""Well, will you tell me anything?""",
com_ev_08_113,「なにもないなら、もう行くね」,"""If there is nothing, I will go.""",
com_ev_08_114,「ん～……そのお話は聞きたくなかったかなぁ」,"""... ... I wonder if I did not want to hear that story""",
com_ev_08_115,「今は聞きたいことが特にないかな」,"""There is nothing I would like to hear now""",
com_ev_08_116,「あ、もう行かなくちゃ。またお話聞かせてね」,"""Ah, I have to go now. Please tell me again.""",
com_ev_08_117,「この間の続きを聞かせてほしいのだけれど、今は時間がないの」,"""I'd like to hear the continuation of this period, but I do not have time now.""",
com_ev_08_118,「もう行かなくちゃ。またねぇ」,"""I have to go now.""",
com_ev_08_119,「うん。また今度教えてね」,"""Yeah, please tell me this time""",
com_ev_08_120,「うん。またねぇ」,"""Yeah well again""",
com_ev_08_121,「うん。今日は特に用事もないから、いいよぉ」,"""Yeah, I have no special business today, so I'm OK.""",
com_ev_08_122,「今日は用事があるの。だから、また今度ね」,"""I have something to do today, so please come again next time.""",
com_ev_08_123,「えへへ、ちょうどわからないところがあったの。だから教えっこしよ」,"""Well, there was a place I just did not understand, so tell me""",
com_ev_08_124,「集中して勉強したいから、また今度ね」,"""I want to concentrate and study, so next time""",
com_ev_08_125,「うん！　じゃあ、動きやすい服装に着替えてくるね」,"""Well, then, I will change into easy-to-move clothes,""",
com_ev_08_126,「ごめんねぇ。あんまり汗かきたくないかなぁ」,"""I'm sorry, I do not want to sweat too much""",
com_ev_08_127,「うん。いいよぉ」,"""Yeah yeah good""",
com_ev_08_128,「えっと、今はお友達を待たせているので……今度じゃダメ？」,"""Well, now I am letting my friends wait .... Would not it be this time?""",
com_ev_08_129,「ええっ！　なんで入ってきちゃたの？」,"""Why did you come in?""",
com_ev_08_130,「え、ええっ！　あなたはここに入ってきちゃダメなんだと思うよ」,"""Oh, well, I do not think you can get in here.""",
com_ev_08_131,「誰か居たらきっとびっくりされるよ。人が来る前に早く出ていってね」,"""I'll be surprised when someone is in. Please get out early before people come.""",
com_ev_08_132,「だ、ダメだよ。早く出ていって！」,"""Well, you can not go out, leave early!""",
com_ev_08_133,「今、時間ないの」,"""I do not have time now.""",
com_ev_08_134,「……なにかな？」,"""……Whats's that?""",
com_ev_08_135,「えっと、ごめんねぇ。今ちょっと時間がないんだぁ」,"""Well, sorry, I do not have much time now.""",
com_ev_08_136,「……えっと、女の子の身体に興味があるの？」,"""... ... Well, are you interested in the body of a girl?""",
com_ev_08_137,「女の子に興味があってもダメだよ」,"""Even if you are interested in girls, you can not do it.""",
com_ev_08_138,「そんなに見つめないで……ちょっとだけ恥ずかしくなってきたから」,"""Do not stare like that ... ... I'm getting embarrassed for a moment""",
com_ev_08_139,「真剣に見過ぎだよ。もう見ちゃダメ。あっちむいてほいっだよ」,"""I look too seriously, do not look it any more.",
com_ev_08_140,「今日も良い天気だね。あ、ほら見て。雲が気持ちよさそうに泳いでるの」,"""It's nice weather today, oh, look, you see, the clouds are comfortably swimming.""",
com_ev_08_141,「今ね、授業の復習してたんだよ。あなたも一緒にどうかなぁ？」,"""Right now, I was reviewing the lesson, how are you with me?""",
com_ev_08_142,「えへへっ、お腹がすいちゃって……育ち盛りだからかなぁ」,"""Huh, I am hungry ... I wonder if it is growing up""",
com_ev_08_143,「うん。ちゃんとついてきてるよ？」,"""Yeah, you are following me properly?""",
com_ev_08_144,「道、間違っちゃった？　ここは入れないよ」,"""The road, I made a mistake, I can not enter here""",
com_ev_08_145,「えへへっ、デート楽しみで、ワクワクが止まらないよ」,"""Well, I'm excited about dating, I'm excited.""",
com_ev_08_146,「ねぇねぇ、今暇してるんだぁ。お話しようよ」,"""Hey, I am free now. Let's talk.""",
com_ev_08_147,「今度はなにを教えてくれるのかな？　私、あなたのするお話に興味津々」,"""What will you tell me this time, I am curious about the story you are doing""",
com_ev_08_148,「はぁ、はぁ、はぁ……あっ、タオルありがとぉ　見に来てくれたんだね」,"""Huh, huh, huh ...... Ah, thanks for coming to see the towels.""",
com_ev_08_149,「もしかして部活見学かな？　入って入って～部活見学は大歓迎なんだよ」,"""Maybe you are in a club activity, entering and entering ~ Campaign tour is greatly appreciated""",
com_ev_08_150,「コイカツ部、どうかなぁ、頑張ってるかな？」,"""Koikatsu Department, I wonder, are you doing your best?""",
com_ev_08_151,「お腹すいたよ。今ならあなたの分のお昼ご飯も食べれちゃうかも」,"""I am hungry, I guess I'll eat lunch for you as well now.""",
com_ev_08_152,「今日も一日が終わるんだなぁって思ったら、放課後はなんだか寂しくなるの」,"""If you think today is the end of the day, it makes me somewhat lonely after school.""",
com_ev_08_153,「ひゃあっ！　お、脅かさないでほしいなぁ……心臓が止まるかと思ったよ」,"""Ha ha, I do not want to threaten ... I thought my heart would stop""",
com_ev_08_154,「私に用だったのかなぁ？」,"""Did you use it for me?""",
com_ev_08_155,「私の周りはあなたも含めて、そんな悪いことをする人はいないよ？」,"""There is no one surrounding me, including you, who does such a bad thing?""",
com_ev_08_156,「そんなことないよ。嘘なんてすぐに見抜いちゃうもの！　多分……」,"""No such thing, something that will soon see a lie! Perhaps ...""",
com_ev_08_157,「うん、聞くよ。有名な曲は大体歌えるんだよ　私の歌聞きたい？」,"""Yeah, I hear, famous songs can sing in general, do you want to hear my song?""",
com_ev_08_158,「あまり聞かないよ。でも、話題になった曲とかだったら知ってるかなぁ」,"""I do not ask much, but I wonder if you know something that was a topic""",
com_ev_08_159,「小さい頃は音楽教室に通ってピアノを習っていたよ。今も弾けるかなぁ……」,"""When I was a child I went to the music classroom and I learned the piano, I wonder if I can still play now ...""",
com_ev_08_160,「今はなにもしてないよ。やっぱり女の子だから、なにか習ってた方がいいのかなぁ」,"""I am not doing anything now, since I am a girl after all, I wonder if I should have learned something""",
com_ev_08_161,「うん　グリム童話が好きだから、図書室でよく借りて読んでるよ」,"""Because I like Yeah Grimm fairy tales, I often borrow it in a library and read it.""",
com_ev_08_162,「難しい本は読まない……童話が好きで、本自体はよく借りるんだけどね」,"""I do not read difficult books .... I like fairy tales, I borrow books themselves well,""",
com_ev_08_163,「えっとね……別のお話がいいかな」,"""Well ... ... Do you want a different story?""",
com_ev_08_164,「そうだったんだね。また少しだけ賢くなれたよ」,"""That was it, I got a bit smarter again.""",
com_ev_08_165,「キス……キス……ひぇ～……えっとね。うん。あります！」,"""Kiss ... ... Kiss ... Wow ... .... Well ... yeah!""",
com_ev_08_166,「キスに憧れはないし、してみたいって気持ちも、特にないかなぁ」,"""I do not long for kiss and I do not care whether I want to try it or not""",
com_ev_08_167,「童話とかに出てくる王子様には憧れるよ　だって素敵でしょ？」,"""You must admire the prince who appears in fairy tales, is not it nice?""",
com_ev_08_168,「白馬の王子様が目の前に現れたら、まず私、憧れよりも先にびっくりしちゃうよ」,"""If the Prince of Hakuba appears in front of you, first of all I will be surprised ahead of your admiration""",
com_ev_08_169,「大好きって思った人が現れたら、すぐにでもその人と結婚式を上げたいなぁ」,"""I want to raise a wedding ceremony with that person as soon as the person who thought that I love it appears.""",
com_ev_08_170,「ん～……私には難しいかなぁ。どうしてケッコンするのかもよくわかんないんだもの」,"""Well ... it is difficult for me, I do not quite understand why he is going to be kicked""",
