key,jp,en,comment
com_ev_16_000,「なっ！　アナタ！　何を考えているの！　早く出てって！」,"""What! What are you thinking! Go out early!""",
com_ev_16_001,「呆れるわね。男は低俗と聞いていたけれど、ここまで見境がないなんて」,"""I am amazed. I heard that men are vulgar, but I have nothing to do with this.""",
com_ev_16_002,「今アナタと話す時間はないわ。さよなら」,"""I do not have time to talk to you at this moment. Goodbye""",
com_ev_16_003,「何かしら？　時間は有限、用があるなら早くして」,"""What is it? Time is finite, if you have something, hurry up""",
com_ev_16_004,「ごめんなさい。この後予定があるの」,"""I'm sorry, I have plans after this""",
com_ev_16_005,「んっ……すっ……人は……何故……過ちを……すぅ……」,"""Who ... .... Who ... ... Why ... ... a mistake ... ....""",
com_ev_16_006,「きゃっ！　ぇっ……なっ……見ないでっ！」,"""Yeah ... hey ... ... you do not look!""",
com_ev_16_007,「水着といっても肌の露出は下着と同等、普段は見れない希少価値に興奮するという事？」,"""Is it said that exposure of the skin is equal to underwear and you are excited about the rare value that you can not usually see?""",
com_ev_16_008,「あら、珍しい所で会ったわね。ここは一人で考え事をするには良い場所よ」,"""Oh, I met you in a rare place, it's a good place to think alone here.""",
com_ev_16_009,「私は人間観察が趣味なの。アナタは特に挙動が読めないから面白いわ」,"""I am a hobby of human observation.It is interesting because you can not read behavior in particular.""",
com_ev_16_010,「本から先人の知恵を得るのは全てにおいて基本よ。アナタは何を読みに来たの？」,"""Getting wisdom from a book from books is basic in everything. What did you come to read?""",
com_ev_16_011,「んっ、話すのは目的地についてからではダメなの？」,"""Why is it not good to talk about from the destination?""",
com_ev_16_012,「信頼を築くのは大変よ、でもそれを壊すのは簡単。覚えておく事ね」,"""It is hard to build trust, but it is easy to break it, remember it.""",
com_ev_16_013,「アナタを見てると、時々自分を見失う。これはどういう事なのかしらね……」,"""When I see you, I lose sight of myself from time to time, I wonder what this is ....""",
com_ev_16_014,「男性の方が性について貪欲と聞いたわ、それは本当？」,"""I heard that men are greedy about sex, is it true?""",
com_ev_16_015,「ふぅ、何をするにしても体が基本よ。アナタ、ちゃんと鍛えてる？」,"""Whatever you do, your body will be basic. Are you training yourself properly?""",
com_ev_16_016,「あら？　見学かしら？　良い心がけね」,"""Oh? Would you like to visit?""",
com_ev_16_017,「部活以外にもやるべき事は沢山ある筈よ、アナタは何をしているの？」,"""There are lots of things to do other than club activities, what are you doing?""",
com_ev_16_018,「お昼の時間ね、今日のランチメニューは何かしら」,"""Time for lunch, what is today's lunch menu?""",
com_ev_16_019,「さて、放課後の予定は……ん？　何か用？　手短にね」,"""Well, the schedule after school ...? For something? Please briefly""",
com_ev_16_020,「ひゃっ！　何？　私を驚かせて何が楽しいのかしら……」,"""What? It is amusing me and what is fun ......""",
com_ev_16_021,「私に何か用？」,"""Is there something for me?""",
com_ev_16_022,「何かをやろうと思ってやらない事よ、自然にスッと始めるの。わかる？」,"""Do not think about doing something, you start to start naturally, do you understand?""",
com_ev_16_023,「特に考えた事はなかったわね。少し時間を頂戴」,"""I never thought about it, so I received a little time.""",
com_ev_16_024,「はぁ、愚問ね。答えは簡単、自分のためよ」,"""Hey, that's a stupid question, the answer is easy, because of myself.""",
com_ev_16_025,「理由は人それぞれよ。ただ、後悔だけはしたくないわね」,"""The reason is for each person, but I do not want to regret it.""",
com_ev_16_026,「私だって多少オンオフはあるわ。他人にはあまり見せないだけ」,"""I have somewhat on and off, I just do not show it to others.""",
com_ev_16_027,「私のそういう姿に興味があるの？　それは何故？」,"""Are you interested in such a figure? Why?""",
com_ev_16_028,「つまらない話に付き合わせないで」,"""Do not get involved in a boring story""",
com_ev_16_029,「その聞き方には語弊があるわ、訂正して」,"""There is a word on how to listen, correct it""",
com_ev_16_030,「ならしないで。いえ、やっぱりしなさい。何故つまらないと思ったの？」,"""Do not do, no, after all. Why did you think that it was boring?""",
com_ev_16_031,「ありがちな質問ね。その手の本でも読んだのかしら？」,"""A frequently asked question, have you read the handbook of that hand?""",
com_ev_16_032,「もちろんあるわ。でも、まだまだ理解できているとは言えないわね」,"""Of course there are, but I can not say that I do not understand it yet.""",
com_ev_16_033,「ないと言ったらアナタは私に興味を無くすのかしら？　そこに興味があるわ」,"""If you say nothing, would you lose interest in me? I am interested in it.""",
com_ev_16_034,「正直わからないわ。わからないという事は、まだしていないのだと思う」,"""I do not understand honestly, I think I have not done that I do not know""",
com_ev_16_035,「憧れのようなものはあるかもしれない。アナタはどうなの？」,"""There may be things like adoration, how about you?""",
com_ev_16_036,「カッコイイ生き方をしている人かしら。お互いに高め合える関係が理想よ」,"""People who are cool and how to live. Ideal relationships that can be enhanced with each other""",
com_ev_16_037,「タイプ……ごめんなさい。考えた事がなかったわ」,"""Type ... I'm sorry, I never thought about it.""",
com_ev_16_038,「ごめんなさい、感情論は苦手なの」,"""I am sorry, I am not good at emotion theory.""",
com_ev_16_039,「そうね、皆年頃だもの。他に話題はないのかってくらいね」,"""Well, everyone's around, there is no other topic,""",
com_ev_16_040,「どう思うって……もう少し要点を言ってくれないと答えようがないわ」,"""What do you think ... I will not say I will not touched a bit more""",
com_ev_16_041,「いるわよ。元女子校だもの。アナタ、そういう趣味なの？」,"""There are lots of girls, you are a former girls school, you are such a hobby?""",
com_ev_16_042,「何事にも意欲的に取り組めるというのは好ましいわ。生きる力そのものだもの」,"""It is preferable to be able to work on anything ambitiously, it's the power to live""",
com_ev_16_043,「自分の中で完結できるのならいいけど、大概そういう輩は他人を巻き込む迷惑な奴よ」,"""I wish it would be possible to complete within myself, but most of them are annoying fellows who involve others.""",
com_ev_16_044,「物事を深く考察するのは当然の事よ。でも、当然をできる人というのは貴重ね」,"""It is natural to consider things deeply, but it is valuable to be a person who can take it for granted.""",
com_ev_16_045,「下手な考え休むに同じ……フッ、私が言うなという顔ね？　私は下手じゃない」,"""Same idea to take a good idea ... Hu Hu, I do not say that? I am not good at it.""",
com_ev_16_046,「真面目というのはそれだけで希少価値よ。私は好き」,"""Seriousness is rarity value by itself, I like it.""",
com_ev_16_047,「真面目も過ぎると面倒ね。何事も適量が大事なのよ」,"""It is troublesome if too serious, the appropriate amount is important in everything.""",
com_ev_16_048,「自分だけの世界を持ってる人は魅力的ね。一緒にその世界を覗いてみたくなる」,"""People who have their own world are attractive, you will want to look into the world together""",
com_ev_16_049,「空気が読めないというのは社会に適合できないと同じ。論外ね」,"""The fact that you can not read the air is the same as not being able to fit society.",
com_ev_16_050,「愛に一番近いのは優しさじゃないかしら。つまり、男女の関係には不可欠ね」,"""The closest thing to love is kindness, I mean, it's indispensable for a relationship between men and women.""",
com_ev_16_051,「優しさだけでは何もできない。飽きる程言われている事ね」,"""I can not do anything with gentleness, that is to say I get bored,""",
com_ev_16_052,「クールと言っても色々あるけど、パートナーには常にカッコよくあって欲しいものね」,"""There are various things even if it is cool, but I always want partners to be cool.""",
com_ev_16_053,「ナルシストに用は無いわ。付き合っても何も生まれないもの」,"""There is no use for narcissists, nothing will be born even if we go out""",
com_ev_16_054,「よ、読むわよ。知っておかなければ恥をかく知識の一つだもの」,"""Oh yeah, it's one of the shameful knowledge if you do not know""",
com_ev_16_055,「ち、知識に偏りがあってはいけないもの……それが性に関してのものでもよ……」,"""Those things that should not have biases in knowledge ... that is about sex ... ....""",
com_ev_16_056,「なっ！　そ、それは……こ、答える義務はないわ！」,"""Well, that is ... that ... there is no obligation to answer!""",
com_ev_16_057,「わ、私だって人間ですもの、それくらいあるわ。な、なにをニヤニヤしているのよ！」,"""Well, I am a human being, there are so many things, what are you grinning!""",
com_ev_16_058,「お、オナッ！　っうぅ……そ、そういう聞き方は卑怯よぉ……」,"""Oh, oooh ... ... that, that way of asking is cowardly ... ...""",
com_ev_16_059,「あ、あくまで一般的な解答よ？　す、するわ……うん、みんなしてると思う……」,"""Oh, it's a generic answer to the end, wrinkle ... Well, I guess everyone is doing ...""",
com_ev_16_060,「男は下半身でものを考えるというのは本当なのね。呆れるわ」,"""It is true that men think things in the lower half of a body, so be amazed.""",
com_ev_16_061,「はぁ、そのだらしない顔から読み取るに、ろくな事を考えていないわね？」,"""Huh, you read from that extraordinary face, you have not thought of rushing things?""",
com_ev_16_062,「なっ……ぇ、エッチエッチエッチ……っぅ、これ、なんの実験なの？」,"""Well ...... Well, etch etch ... ... ... what kind of experiment is this?""",
com_ev_16_063,「そ、それは……い、一般には生殖の適齢期というのがあって……」,"""Well, that is ... ... and generally there is age of reproductive age ... ...""",
com_ev_16_064,「正直に答えて、男にとって私のような女は面倒なのかしら？」,"""Would a woman like me for a man be troublesome, honestly?""",
com_ev_16_065,「そ、そう……貴重な意見をありがとう。参考にさせて貰うわ」,"""そ, そ う ... ... Thank you for valuable opinion, I will make it a reference.""",
com_ev_16_066,「へぇ、そういう見方もあるのね。アナタの事、少し見直したわ」,"""Well, there is that way of thinking, I've reviewed a bit about you.""",
com_ev_16_067,「私は正直に答えてと言った筈よ、変な気を使わないで」,"""I told you to answer honestly, do not strange feelings.""",
com_ev_16_068,「動物は好き？　犬や猫の話よ」,"""I like animals, they talk about dogs and cats""",
com_ev_16_069,「そう、私も好きよ。動物は可愛いものね」,"""Yes, I like it, animals are cute things.""",
com_ev_16_070,「わかるわ。私はよく懐かれる方なのだけど、対応に困るの」,"""I understand, I am a nostalgic person, but I am in trouble.""",
com_ev_16_071,「よく食べる方かしら？　食事の事よ」,"""Are you eating well? I'd like to eat.""",
com_ev_16_072,「いい事ね。何でもよく食べられるというのはそれだけで幸福よ」,"""It's a nice thing - it's happiness alone that you can eat well anything.""",
com_ev_16_073,「あら、男性にしては珍しいタイプかしら？　私も小食よ」,"""Oh, is it a type unusual for men? I am a snack.""",
com_ev_16_074,「料理は作れるの？　少し興味があるわ」,"""Can you cook? I am a little interested.""",
com_ev_16_075,「そう、私と同じね。アナタの手料理、興味深いわ。今度ご馳走してくれる？」,"""Yeah, it's the same as mine, it's interesting to you, you will be delighted next time?""",
com_ev_16_076,「それでいいのよ。適材適所、料理人の仕事を奪ってはいけないもの」,"""That's fine. A good place for the right people, things you should not deprive a chef's job""",
com_ev_16_077,「運動は得意？　体を動かすのが好き、というだけでもいいわよ」,"""I am good at exercise, I just like to move my body,""",
com_ev_16_078,「いい答えね。体は全ての資本よ。今度一緒にジョギングでもどう？」,"""A good answer, your body is all the capital, how about going together this time?""",
com_ev_16_079,「そうなのね。いずれ体は不要となる。そんな時代も近いと私は考えているわ」,"""Well, you do not need anybody, I think I'm close to that era.""",
com_ev_16_080,「勉強はしている？　学生の基本よ？」,"""Are you studying? Student's basics?""",
com_ev_16_081,「へぇ、見直したわ。アナタ、わかっているようね」,"""Well, I reviewed it, you know, you know.""",
com_ev_16_082,「時間というリソースを何に割くかは人それぞれよね。お互い後悔だけはしないようにしましょ」,"""It depends on each person how to spend time resources, so do not only regret each other""",
com_ev_16_083,「ファッションには気を使っているのかしら？」,"""Do you care about fashion?""",
com_ev_16_084,「えぇ、いい傾向だと思うわ。見た目じゃないというのは言い訳にしかならないから」,"""Well, I think it's a good trend, because it's only an excuse for not being visible.""",
com_ev_16_085,「大丈夫、理解できるわ。それより優先すべき事が沢山あるもの」,"""I understand, I can understand, there are lots of things to give priority over that""",
com_ev_16_086,「そう……ダイバーシティーね。多様性を認めるのは大事」,"""Yes ... ... diversity, it's important to recognize diversity""",
com_ev_16_087,「他人の感情を推し量る事ができないというのは、それだけで罪よ」,"""It is only a sin that you can not infer the feelings of others.""",
com_ev_16_088,「終わった事を引き摺るつもりはないわ。でも、次はない」,"""I do not mean to drag the things that have ended, but no next time.""",
com_ev_16_089,「一度の謝罪で全てが片付く。そんな世界なら確かに楽でしょうね」,"""Everything clears up with a single apology, it would certainly be easier for such a world""",
com_ev_16_090,「なに？　人間観察はこんな間近でやるものではないわよ」,"""What ?, human observation is not done at such an imminent place""",
com_ev_16_091,「見ているだけで全て察してもらえる。そんな考えは捨てなさい」,"""Just by watching it all you can appreciate. Please discard such thought.""",
com_ev_16_092,「この時間に意味はあるのかしら。少し疑問になってきたわ」,"""I wonder if there is meaning at this time. I got a little doubt.""",
com_ev_16_093,「統計通りね。男性はまず胸を見る……」,"""According to the statistics, men first look at their breasts ...""",
com_ev_16_094,「アナタ、耳は機能している？　下半身でしか生きていないのかしら」,"""A you, your ears are working, are you living only in the lower body?""",
com_ev_16_095,「やめなさい、見ているだけでも立派な痴漢行為よ」,"""Stop it, even just watching it is a wicked act of molestation""",
com_ev_16_096,「はっきり言ってあげる。視線を感じるだけで不愉快よ」,"""I say it clearly, it's unpleasant just to feel my eyes.""",
com_ev_16_097,「なっ……手を……こ、これは……どういうつもり？」,"""Well ... ... Hands ...... Here, is this ... ... what are you planning on?""",
com_ev_16_098,「はぁ……アナタ、本当に何も学ばないのね……」,"""Huh ...... you, you really do not learn anything ...""",
com_ev_16_099,「ひゃっ！　もう！　何度も許される行為だと思ったら大間違いよ！」,"""Huh! Already mistaken if you think that it is permissible acts many times!""",
com_ev_16_100,「あっ、ぇっ……こ、これはどういう事なの？　説明を求めるわ」,"""Ah, ぇ っ ... ... Here, what does this mean, ask for explanation?""",
com_ev_16_101,「次やったら警察を呼ぶから。本気よ」,"""Because I will call the police when I do the next.",
com_ev_16_102,「んぁっ！　アナタ！　どういう神経をしているの！」,"""Huh! Anata! What kind of nerve do you have!""",
com_ev_16_103,「なんのつもり？　その……くすぐったいから……」,"""What are you going on? ... ... From ticklish ... ....""",
com_ev_16_104,「いい？　仏の顔は三度まで。これは私にも当てはまるの」,"""No, the face of the Buddha is up to three times, this is true for me""",
com_ev_16_105,「最初は見逃したわ。だからといって次を許したわけではない」,"""I missed it at the beginning, but that did not allow me to do next.""",
com_ev_16_106,「ふにゃっ！　な、なに？　なんなのっ！」,"""Fu! What, what is it !?""",
com_ev_16_107,「指を折られたくなかったら、もうやめなさい」,"""If you do not want your fingers to break, stop it now""",
com_ev_16_108,「っぅぅ……この行為に何の意味があるの？　教えなさい」,"""Whoo ... ... what does this action mean? Please tell me.""",
com_ev_16_109,「アナタ、どうかしてるわ。気持ち悪い」,"""You are crazy, I feel bad""",
com_ev_16_110,「アナタといる時間は有意義ね。他意はあるわ。推察してみなさい？」,"""The time with you is meaningful, there is any other thing, try to guess?""",
com_ev_16_111,「さて、次は何か考えているの？」,"""Well, are you thinking about something next?""",
com_ev_16_112,「先に言っておくわね。私は暇が嫌いなの」,"""I will tell you earlier, I do not like my time.""",
com_ev_16_113,「時間を無駄にしたくないのだけど」,"""I do not want to waste time.""",
com_ev_16_114,「不愉快ね。さよなら」,"""Unpleasant, goodbye, goodbye""",
com_ev_16_115,「アナタといる事に価値を見出せない、私は忙しいの」,"""I can not find a value in being with you, I am busy.""",
com_ev_16_116,「もっと一緒にいたかったわ。でもごめんなさい、次はもっと時間が取れるようにするから」,"""I wanted to be together more, but sorry, I will make more time available the next time.""",
com_ev_16_117,「女性の体に興味はない？　もし興味があるようなら……ね？」,"""I am not interested in the body of a woman? If you are interested, are not you?""",
com_ev_16_118,「時間ね。ごめんなさい、もういかないと」,"""Time. I'm sorry, I have to leave.""",
com_ev_16_119,「そう、色々興味深かったわ。またいつでも話しかけて」,"""Yes, I was interested in various things. Talk to me anytime again.""",
com_ev_16_120,「えぇ、さよなら」,"""Yeah, goodbye""",
com_ev_16_121,「えぇ、構わないわ。一緒に帰りましょう」,"""Well, I do not mind, let's go home together""",
com_ev_16_122,「ごめんなさい、帰りに一人で寄りたいところがあるの」,"""I am sorry, there is a place I want to leave alone on my way home.""",
com_ev_16_123,「わかったわ。丁度気になっていたところがあったの」,"""I got it, I was just worried about that""",
com_ev_16_124,「うーん、一人でじっくり調べたい事があって……ごめんなさいね」,"""Well, there is something I want to look up all by myself ... I am sorry.""",
com_ev_16_125,「いいわよ。着替えてくるから待っていて」,"""Sure, I will change clothes and wait.""",
com_ev_16_126,「ちょっと今は……運動という気分ではないかしら……」,"""Hey now ... I feel like exercise ... I wonder ...""",
com_ev_16_127,「いいわよ。変な所じゃなければね」,"""Sure, if it is not strange""",
com_ev_16_128,「今は難しいわ。私にも予定があるのよ」,"""It is difficult now, I have plans as well""",
com_ev_16_129,「なっ！　もう……他の人に見つかる前に出て行きなさい。あとでお説教だからね」,"""Let's go ... Please leave before you find out by others, because it's a sermon later""",
com_ev_16_130,「えっ！　ちょっと！　ここは女性用！　アナタね……その節穴、潰してあげましょうか？」,"""Wow! Here! This is for ladies! You are you ... ... Do you want me to crush that knot?""",
com_ev_16_131,「ちょっと！　ふぅ……本当に呆れた。私の他に誰かいたらどうするつもりだったの？」,"""Hey! Fuu ... I was really amazed. What were you planning to do if someone else besides me?""",
com_ev_16_132,「はぁ、まったく……ここにいる全員が被害者であり証人よ。覚悟なさい」,"""Haa, exactly ... All of you here are victims and witnesses, so be prepared.""",
com_ev_16_133,「今アナタに構っている暇は無いわ。さよなら」,"""I do not have time to set for you now, goodbye""",
com_ev_16_134,「私、見ての通り機嫌が悪いの。言動には気を付けなさい」,"""I am in a bad mood, as you can see.",
com_ev_16_135,「タイミングが悪いわね……またあとで来てちょうだい」,"""The timing is bad, do not you ... ... please come back later""",
com_ev_16_136,「きゃっ！　なななな……あ、あっち向いてなさい！」,"""Kana! Nannana ... Oh, face it!""",
com_ev_16_137,「ひゃっ！　ふ、ふーん……アナタにはキツーイおしおきが必要なようね」,"""Huh !, hmm ... ... You should have a kitsui punishment for you""",
com_ev_16_138,「下、みっともない事になってるわよ。他の子に見つかるまえに鎮めなさい」,"""Below, it's supposed to be unbelievable, so please calm down before other children find it.""",
com_ev_16_139,「胸、尻、腰、あとは……アソコも……アナタが無粋な視線を向けた先の話よ」,"""Chest, buttocks, waist, afterwards ...... Assoko ...... You talked ahead no matter where you looked""",
com_ev_16_140,「ふぅ、丁度のんびりし始めたところよ……なによ？　アナタものんびりなさい」,"""Fu, I just started to relax ... What, what do you do, leisurely too""",
com_ev_16_141,「アナタがウロウロしてるのはもうそういう生物だと思う事にしたわ」,"""I decided I thought that you are already crawling out that thing.""",
com_ev_16_142,「あら奇遇ね。ってわけでもないのかしら？　フフッ」,"""Oh no, it's not a serious thing, is not it?""",
com_ev_16_143,「落ち着かない人ね。舌を噛んでも知らないわよ？」,"""People are restless, do not you know even if you chew your tongue?""",
com_ev_16_144,「常識を考えなさい。まったく、注意してあげるだけ感謝して欲しいものね……」,"""Think of common sense, I just want you to appreciate it only for being careful ... ...""",
com_ev_16_145,「ねぇ、しつこいようだけど、今度のデートの時間と場所、もう一度確認しておきましょ」,"""Hey, he seems to be persistent, but please check the time and place of the next date again,""",
com_ev_16_146,「何でも聞いて？　私に答えられる事なら全部教えるから」,"""Listen to anything and teach everything if you can answer me""",
com_ev_16_147,「女だからと遠慮しなくていいのよ？　エッチな話でも引いたりしないから」,"""You do not have to hold back because you are a woman, I will not draw even horny stories.""",
com_ev_16_148,「はぁっ、喉がカラカラよ。とりあえず水分を取らせて」,"""Ha ha, throat is spotless. Let me take moisture for the time being""",
com_ev_16_149,「フフッ、興味があるみたいね？　ほら、もっと近くにきなさい」,"""Fuh, you seem interested? See, come closer.""",
