key,jp,en,commentcom_ev_16_150,「コイカツ部は順調なの？　やるからにはきちんとした方がいいわよ」,"""Do you want your department to go smooth? You should do it properly.""",
com_ev_16_151,「もうお昼の時間なのね。ふぅ、しっかり休まなきゃ」,"""It's already time for lunch. Fuu, I must rest well.""",
com_ev_16_152,「放課後になったからって気を抜いてはダメよ？　ここからの行動が重要なのだから」,"""Do not get stuck out because you became after school? Because the action from here is important""",
com_ev_16_153,「ひゃんっ！　もう！　おどかすのやめてっ！」,"""Homme! Already! Do not be afraid!""",
com_ev_16_154,「何か用事？　遠慮せず言ってみなさい」,"""Do something, do not hesitate to tell me""",
com_ev_16_155,「そう評価してくれるのは嬉しいけど、何か裏がありそうね」,"""I am delighted to evaluate so, but there seems to be something behind it.""",
com_ev_16_156,「普通よ。アナタが少しどんくさいの、フフッ」,"""Normally, you do not have much of yours, Fuhu""",
com_ev_16_157,「少しの事でも考える癖を付ける事ね。結果には必ず原因と過程があるのだから」,"""Be sure to add a habit of thinking a little, as there is always a cause and a process in the result""",
com_ev_16_158,「習慣というのは自分で意識して変えていくもの。教わっただけじゃ長続きしないわよ？」,"""Customs are things that you change with consciousness yourself, you will not last long just because you are taught?""",
com_ev_16_159,「きのこね。チョコがしっかり味わえるもの」,"""Mushrooms, things you can taste good chocolate""",
com_ev_16_160,「たけのこね。チョコとクッキーのバランスが絶妙だもの」,"""Bamboo shoots, the balance between chocolate and cookies is exquisite""",
com_ev_16_161,「えぇ、信じるわ。この世界に何かしらの法則性は絶対ある筈だもの」,"""Well, I believe, there must be absolutely certain laws in this world""",
com_ev_16_162,「信じないわ。あれは曖昧なものをそれっぽく言っているだけ。話術の類ね」,"""I do not believe, that is just saying ambiguous things like that.",
com_ev_16_163,「もうちょっと違う話題はないの？」,"""Is there no other topic a bit different?""",
com_ev_16_164,「そう言うから疲れるのよ。もっと自分をコントロールなさい」,"""Because I say so, I am tired, please control me more.""",
com_ev_16_165,「特別ね。一生その人の顔は覚えてる事になると思うし」,"""Special, I think that I will remember the face of that person for the rest of my life.""",
com_ev_16_166,「そうでもないわ。順番だけで言えば親が最初という人も多いでしょうし」,"""Not really, there are many people whose parents are first at the turn,""",
com_ev_16_167,「そうね。好きになった人なんだもの。何でもしてあげたいって思うわ」,"""Well, I guess it's a person I liked, I think I want to do anything""",
com_ev_16_168,「お互い対等な関係が理想ね。支え合うからこその恋人というものでしょう？」,"""The mutual equal relationship is ideal, is not it a lover that is the only lover to support?""",
com_ev_16_169,「聞き方が悪いわね。何事にも練習は必要よ。それを遊びっていうのは間違ってる」,"""How to listen is bad, you need practice for everything. It's wrong to play with it.""",
com_ev_16_170,「先に何があるのか、恋愛の場合は結婚ね。それを考えないのは単なる時間の浪費よ」,"""If you marry in the case of love, what is there in the end, it is just a waste of time not thinking about it""",
com_ev_16_171,「あり得る話よ。最初から可能性を否定しては何も生まれないわ」,"""A possible talk. Nothing is born from denying the possibility from the beginning""",
com_ev_16_172,「難しいでしょうね。異性に対する欲求は本能的なものだから」,"""It will be difficult, because the desire for opposite sex is instinctive.""",
com_ev_16_173,「少し質問が図々しいかしら。なんでもコイカツでは許されないわよ？」,"""I wonder if the question is wonderful a bit, I can not forgive them at all.""",
com_ev_16_174,「それは私も疑問よ。一緒に考えましょう」,"""That's my doubt, let's think together.""",
com_ev_16_175,「あ、あるわ……そういう年頃ですもの。でも、誰でもいいってわけじゃない……」,"""Ah, there is ... that kind of age, but no one is okay ...""",
com_ev_16_176,「興味はあるけど、どうしてもって程のものじゃない。先にやるべき事が多すぎるもの」,"""I am interested but it is nothing like it, there are too many things to do before.""",
com_ev_16_177,「なんだか目が怖いわよ……っぅ、し、知っておいて損はないと思うわ……」,"""Somehow my eyes are scary ... ...., well, then I know that I do not see any loss ...""",
com_ev_16_178,「そういうのは論外ね。快楽に溺れた先が怖いもの」,"""That's unbelievable, something scary of people who drowned in pleasure""",
com_ev_16_179,「なっ……あ、相手がいる事ですもの。ノーコメントよ……」,"""Okay ... .... Oh, what the other is ... No comment ......""",
com_ev_16_180,「しないわよ。少なくとも私はしてない。他はまぁ……女子校だったから……」,"""I do not do at least, I have not done, others are okay ... because it was a girls school ...""",
com_ev_16_181,「えぇ、一通りは知っているつもりよ。な、なによ……必要な事でしょ？」,"""Well, we're going to know the streets, what are you ... what do you need?""",
com_ev_16_182,「自信と言われると難しいわね。相手がいなければ経験は積めないし……」,"""It is difficult if you say confidence, you can not have experience without ...""",
com_ev_16_183,「はぁ、アナタ、いつかセクハラで訴えられるタイプね」,"""Haa, you are the type that can be sued someday by sexual harassment""",
com_ev_16_184,「なっ！　盗み聞きしたの？　まったく最低ね……」,"""Did you eavesdrop on me? It was all cheap ... ....""",
com_ev_16_185,「アナタに興味が沸いてきたわ。個人的な事を聞いても？」,"""I've become interested in you, even if you hear personal things?""",
com_ev_16_186,「ありがとう。じゃあ、少しずつ質問させてもらうわね」,"""Thank you, then I will ask you a question little by little""",
com_ev_16_187,「そう、仕方ないわね。ごめんなさい、変な事を言って」,"""Yes, I can not help it. Sorry, say strange things.""",
com_ev_16_188,「アナタ、コーヒーはブラック派？　ちょっと気になったの」,"""You, coffee is a black school? I was a little curious.""",
com_ev_16_189,「わかってるじゃない。豆本来の味を楽しむのがコーヒーってものよね」,"""I do not understand, it's about coffee to enjoy the original taste of beans.""",
com_ev_16_190,「フフッ、私も同じよ。無理して苦いものを飲んでも美味しくないものね」,"""Fuh, it's the same with me, it is impossible to drink bitter things by force.""",
com_ev_16_191,「辛いのは平気な方？　最近、激辛商品とか増えてるじゃない」,"""People who are spicy are the ones who have not done it recently, but they are increasing like spicy products""",
com_ev_16_192,「へぇ、そうなのね。ならいいものを知ってるわ。今度一緒に食べましょ」,"""Well, I guess if I do, I know good ones. Let's eat it together next time.""",
com_ev_16_193,「そうよね。舌がヒリヒリするだけで、食べる事自体が辛かったりするもの」,"""That's right, just tickling tickles, it's hard to eat themselves.""",
com_ev_16_194,「甘いものは好き？　チョコとか生クリームとか」,"""Do you like sweets? Chocolate or fresh cream?""",
com_ev_16_195,「フフッ、スイーツ男子ってやつね。私も甘いものは好きだし、悪くないと思うわよ」,"""Fuhu, sweets boys, I also like sweet things, I think it's not bad,""",
com_ev_16_196,「あら、意外と硬派なのね。私も甘過ぎるのは苦手よ」,"""Oh, it is surprisingly tough and it is not good for me to be too sweet""",
com_ev_16_197,「やっぱり胸は大きい方がいいの？　アナタ個人の意見を聞きたいわ」,"""Would it be nice to have a big breast? I would like to hear your opinions.""",
com_ev_16_198,「そ、そう……大きくてよかっ……うっ、な、なんでもないわっ！」,"""Well, that's ... it's big and it's okay ... oh, no, not at all!""",
com_ev_16_199,「何事も程々が一番よね。うん、アナタわかってるわ」,"""Everything is the best, yeah, yes, you know it.""",
com_ev_16_200,「えっ、小さくてもいいのね？　……そぅ、少し安心したわ」,"""Well, you can be small, are not you? ... That was a little relieved.""",
com_ev_16_201,「女性の身長の好みはある？　よければ聞かせて」,"""Do you have preference for women's height?",
com_ev_16_202,「ふぅん。あまり高いと嫌がられるのかと思っていたから。少し嬉しいわ」,"""Well, I thought I was disliked if it was too expensive. I am a little happy.""",
com_ev_16_203,「過不足なくという奴ね。まぁよかったわ」,"""Hey, that's neither too much nor fun.",
com_ev_16_204,「小さい方が可愛い……か。フフッ、そっか」,"""The smaller one is cute ...... Fufu, I see.""",
com_ev_16_205,「男の子ですもの、女性の体型にこだわりはあるわよね？」,"""What is a boy, are you particular about the female body shape?""",
com_ev_16_206,「あら、だらしないと言われるかと内心焦っていたのだけれど。そういう好みもあるのね」,"""Oh, I was impatient about being told that I was sluggish, but I also have that kind of preference.""",
com_ev_16_207,「普通って、私くらいという事でいいのよね？　なら良かったわ」,"""I'm fine if I do not mind that it's normal for me to be normal.""",
com_ev_16_208,「へぇ、そうなのね。守ってあげたくなるってやつかしら？」,"""Well, that's right, are you going to want to protect?""",
com_ev_16_209,「貴重な意見をありがとう。参考になったわ」,"""Thank you for valuable opinion, it was helpful""",
com_ev_16_210,「今はアナタといるだけで苦痛なの。わかってくれるかしら？」,"""Now it's painful just to be with you, will you understand?""",
com_ev_16_211,「そう、それでいいの。きちんと謝ってくれれば、私も後に引いたりしないわ」,"""Yes, that's fine, if you apologize properly, I will not even draw back.""",
com_ev_16_212,「反省の色が見えないわ。言葉だけじゃダメ、もっと態度で示して」,"""I can not see the color of reflections, just not words, show more with attitude""",
com_ev_16_213,「なに？　何か変なところがあったら言ってね」,"""What? Please say something strange""",
com_ev_16_214,「な、なんなのよ……流石に……照れるわ……」,"""Why, what is it ...... I am shining ... ... I can shine ...""",
com_ev_16_215,「お化粧は……崩れてないわよね……一体なんなの？」,"""Make-up ... ... It's not crumbling ... is not it?""",
com_ev_16_216,「はぁ、ないものねだりというやつなのかしら。そんなに胸が好き？」,"""Haa, are you saying that it is a nonsense, are you so fond of breasts?""",
com_ev_16_217,「もう何を言っても無駄ね。なら、感想を頂戴。私の胸はどうなの？」,"""No matter what you say, please do not hesitate to contact us, what about my breasts?""",
com_ev_16_218,「何故アナタがそこまで胸に興味を示すのか、そこに興味が沸いてきたわ」,"""I'm interested in why you are interested in breasts so much.""",
com_ev_16_219,「はぁっ、かける言葉も見つからないって、こういう事を言うのね」,"""Ha ha, I can not find any words to say, you say something like this""",
com_ev_16_220,「こ、この行為に説明を求めるわ……」,"""Here, I will ask for an explanation for this action ...""",
com_ev_16_221,「やめて、しつこい男は嫌われるわよ」,"""Stop it, you will dislike a persistent man""",
com_ev_16_222,「手を握られると……動悸が激しくなるの……だから……その……」,"""When you hold your hand ... palpitations become intense ... so ... ... that ...""",
com_ev_16_223,「えっ……どこ触って……待って、私おかしくないわよね？」,"""Er ...... Where are you touching ... wait, is not it strange?""",
com_ev_16_224,「わざと触らせてあげたの、でも残念。これでアナタとはもうさよならかも」,"""I let you touch it on purpose, but it is too bad, I guess that's already good with you.""",
com_ev_16_225,「はぁ、少し気を許したらすぐこれなんだから……最悪ね」,"""Haa, as soon as I am a little disturbed, this is it ... it's the worst.""",
com_ev_16_226,「ねぇ、一般的に、異性の頭を撫でていいのはもっと近しい関係になってからよ？」,"""Hey, generally it's better to crouch on the head of the opposite sex because it's a close relationship?""",
com_ev_16_227,「やめなさい。髪が崩れてきたでしょ」,"""Stop it, my hair has collapsed.""",
com_ev_16_228,「二回はだめ、そう何回もすると価値が下がるわよ」,"""No, twice, it will be worth it if you do so many times.""",
com_ev_16_229,「んもぅ、それ……ドキッてするから……」,"""Mommy, that ... ... I will do it ... ....""",
com_ev_16_230,「過ぎたるは及ばざるが如しよ。よく考えてから行動なさい」,"""Do not overrun anything, act well after thinking carefully.""",
com_ev_16_231,「一回許されたからって、そう何度も許されると思わない事。わかった？」,"""Did you think that you will not be tolerated so many times because you were once allowed?""",
com_ev_16_232,「大声を出されたくなかったら、やめておくことね」,"""If you do not want to be loud, stop it.""",
com_ev_16_233,「アナタをもっと知りたくなってきたわ。ねぇ、いいでしょう？」,"""I've become wanting to know more about you.",
com_ev_16_234,「最近体が妙に火照るの……原因は大体わかっているのだけれど……」,"""Recently the body is strangely burning ... ... the cause is largely known, but ...""",
com_ev_16_235,「まだ話し足りないわ。付き合ってくれるわよね？」,"""I'm not quite talking, can you go out with me?""",
com_ev_16_236,「なぁに？　私、暇は好かないと言ったわよね？」,"""Well, I told you I do not like spare time, right?""",
com_ev_16_237,「アナタ、他人の貴重な時間を無駄にしてるのよ？　もう少し自覚を持ちなさい」,"""You are wasting precious time of others, do not you have a little more consciousness?""",
com_ev_16_238,「不愉快ね。えぇ不愉快。さようなら」,"""Unpleasant yeah yeah unpleasant. Good-bye""",
com_ev_16_239,「もういいかしら？　これ以上はお互い不利益しかないわ」,"""Is it alright, are there any other disadvantages beyond this?""",
com_ev_16_240,「今度はもっと時間を取って話したいから、空いてる時があったら早めに教えてね」,"""Next time I want to take more time and talk, so if there is a time to be free, tell me as soon as possible""",
com_ev_16_241,「話だけじゃなくて、もっとアナタの事知りたいわ……アナタはどう？」,"""Not just stories, I want to know more about you ... how about you?""",
com_ev_16_242,「そろそろ時間ね。有意義な時間だったわ、また今度」,"""It's about time so it was a meaningful time, this time again.""",
com_ev_16_243,「そう、それじゃまた。いつでも話しかけて」,"""Yes, that's it again. Talk to me anytime.""",
com_ev_16_244,「えぇ、またお話しましょ」,"""Well, let's talk again""",
com_ev_16_245,「ごめんなさい、私が臆病なだけなの。本当にごめんなさい……」,"""I am sorry, I'm just a coward I'm really sorry ...""",
com_ev_16_246,「ほ、本当にいいのね？　私……結構面倒な女だって……自覚あるわよ？」,"""Well, really, is not it? I ... ... It's a very troublesome woman ... do you have a conscience?""",
com_ev_16_247,「あのね……アナタが嫌いなわけじゃないの。でもまだ自分に自信がもてなくて……」,"""Hey ... I do not dislike you, but I am not sure of myself yet ...""",
com_ev_16_248,「突然でごめんなさい……アナタが好きよ。付き合って欲しいの。絶対損はさせないわ」,"""I am sorry suddenly .... I like you, I want you to go out and I will not make absolute losses.""",
com_ev_16_249,「えっ、ぁっ……ありがとう。嬉しい……ぁっ、待って……ちょっと……泣きそうよ……」,"""Oh .... Thank you. I'm happy ... Wait, wait ... ... a bit ... ... I will cry ...""",
com_ev_16_250,「そうよね。あは……私何言ってるんだろ……今のは忘れて」,"""Oh yeah ... ah ... what are you talking about ... ... forget about now?""",
com_ev_16_251,「しつこいって思われてもいいわ。どうしてもアナタが好きなの。アナタじゃなきゃダメなの……」,"""You may think that you are persistent, you really like anata, you must not be anata ...""",
com_ev_16_252,「ぁっ……ほ、本当に？　うぅっ、もうっ、泣いちゃったじゃないっ！」,"""Huh ... really, huh, hey, I cried a little!""",
com_ev_16_253,「そう……答えてくれて……ありがとう……重い女で……ごめんなさい……」,"""Yeah ... ... answer ... ... Thank you .... It's a heavy woman ... I'm sorry ...""",
com_ev_16_254,「その前のめりな姿勢には関心するわ。でもね、それと答えは別」,"""I'm interested in that premature attitude, but the answer is different.""",
com_ev_16_255,「だ、ダメではないけど……いつもいきなり過ぎるわ。少しはこちらの事も考えて」,""""" It's not bad, but ... it's all too sudden, too, think a little about this thing """,
com_ev_16_256,「ダメよ。当たり前でしょ。何をどう考えたら成功すると思ったか教えて欲しいくらいね」,"""No, it's natural, you want me to tell you what you thought and what you thought would be successful""",
com_ev_16_257,「フフッ、変態ね。いいでしょう、でも周りに迷惑かけちゃダメよ？」,"""Fuh, you're a pervert, maybe, but do not bother around us?""",
com_ev_16_258,「他人を巻き込むのは感心しないわね。私だけなら大概は許してあげたのに……」,"""I do not admire getting involved in other people, if I were alone, mostly I forgave you ...""",
com_ev_16_259,「はぁ、節操がなさすぎよ。どうせ断ったらもっと面倒になるのでしょう？　ほら、早くなさい」,"""Haa, I'm too overconfined, I guess it will be more troublesome if I refuse anything?",
com_ev_16_260,「アナタ、サカリのついたサルか何か？　もっと頭で考えて」,"""Anata, a monkey with sakari or something? Think more with your head""",
com_ev_16_261,「ねぇ、抱いて欲しいの。体が疼いて仕方ないのよ。アナタも悪い気はしないでしょ？」,"""Hey, I want you to hold me, I can not help it, I can not help it, you do not feel bad, do you?""",
com_ev_16_262,「フフッ、嬉しい。いっぱい気持ちよくなりましょ」,"""I'm happy, I feel comfortable a lot""",
com_ev_16_263,「そうよね。ごめんなさい。ちょっと頭を冷やしてくるわ」,"""I'm sorry, I will cool my head a bit.""",
com_ev_16_264,「フフッ、そういう単刀直入なのいいわね。わかったわ、付き合ってあげる」,"""Huh, you can do that kind of straightforward, okay, okay, I will go out with you""",
com_ev_16_265,「ごめんなさい、先約があるの。また今度誘ってくれると嬉しいわ」,"""I'm sorry, there is a previous appointment, and I'm glad if you invite me next time.""",
com_ev_16_266,「お昼はまだよね？　よければ一緒にどう？」,"""You still have lunch, right? Would you like to join us?""",
com_ev_16_267,「えぇ、じゃあどこで何を食べましょうか？　アナタが決めていいわよ」,"""Well, then where shall we eat? You can decide it.""",
com_ev_16_268,「そう、残念ね……。また誘ってもいいかしら？」,"""Yeah, sorry ... Would you mind inviting me again?""",
com_ev_16_269,「コイカツか……うん、何事も経験よね。具体的には何をするの？」,"""Whether it's a cuttlefish ... Yeah, everything is experienced. What exactly do you do?""",
com_ev_16_270,「ごめんなさい。この後、他の部活に顔を出す予定なの」,"""I'm sorry, after this I plan to face other club activities.""",
com_ev_16_271,「コイカツだっけ？　あれ、やってみたいのだけれど」,"""Is it a rice cookie? Why would you like to do it?""",
com_ev_16_272,「流石部長さんね。活動的なのは見習うべきところがあるわ」,"""There is a place to follow where you are an active person.""",
com_ev_16_273,「アナタ、それでも部長なの？　そんなんでは廃部も近いわね」,"""Aata, is he still the director? That way the abolition is close, too,""",
com_ev_16_274,「いいわよ。支度をするから、少し待ってね」,"""Sure, I will prepare you, please wait a little.""",
com_ev_16_275,「今日は忙しいの。また誘って」,"""I am busy today. Invite me again.""",
com_ev_16_276,「一緒に帰りましょ？　何か予定はある？」,"""Let's go home together, do you have any plans?""",
com_ev_16_277,「良かった。それじゃ、アナタの支度ができたら帰りましょう」,"""Good, then let's get ready for you,""",
com_ev_16_278,「あら、仕方ないわね。今度空いている日があったら逆に誘って」,"""Oh, it can not be helped. Invite me to go back when there is a vacant day next time.""",
com_ev_16_279,「そういうお誘いはもう少し勝算が出来てからする事ね」,"""Such an invitation will be done after we can win more.""",
com_ev_16_280,「もぅ、アナタはいつも唐突ね。いいわ、特別に予定を空けてあげる」,"""Mou, you are always sudden, no, I will give you a special plan""",
com_ev_16_281,「もう少し早く言ってくれれば考えたけど、いくらなんでも突然過ぎるわ」,"""I thought if I told you somewhat earlier, but everything suddenly passes""",
com_ev_16_282,「デートがしたいわ。ねぇ、デートがしてみたいの。どうかしら？」,"""I want to date, hey, I'd like to go out with a date.",
com_ev_16_283,「ふぅ、良かった。少し強引かなと思ったのだけれど、結果オーライね」,"""Wow, that's good, I thought it was a bit forced, but it's pretty a result.""",
com_ev_16_284,「そうよね。ちょっと考えが浅すぎたわ。反省する」,"""That's right, I was a bit too thoughtful, I will reflect on you.""",
com_ev_16_285,「えぇ、いいわよ。そういうお誘いを待ってたの」,"""Well, OK, I was waiting for such an invitation""",
com_ev_16_286,「ごめんなさい。この後予定が詰まっているのよ。本当にごめんなさいね」,"""I'm sorry, after all my schedule is over, I'm really sorry.""",
com_ev_16_287,「一緒に勉強しない？　きっと効率が上がると思うの」,"""Do not you study together? I think that efficiency will surely increase.""",
com_ev_16_288,「うん、ありがと。一緒に勉強して良かったって、絶対言わせてみせるわ」,"""Yeah, thanks. I will say absolutely that you are good to study together.""",
com_ev_16_289,「そっ、効率だけが勉強ではないものね」,"""Well, efficiency alone is not study,""",
com_ev_16_290,「そうね。今のうちから体力をつけておかないと」,"""Well, I have to put on my strength from now.""",
com_ev_16_291,「遠慮しておくわ。少し体調が悪くて……」,"""I'm sorry I have a bit of a bad physical condition ...""",
com_ev_16_292,「健康な身体作りのために、一緒に運動しない？」,"""Are you going to work out together for a healthy body?""",
com_ev_16_293,「フフッ、ありがとう。それじゃ早速身体を動かしましょう」,"""Thank you, Fuh, let's move the body at once.""",
com_ev_16_294,「まあ、体育の授業はあるけれど……乗り気じゃない人を誘っても仕方ないわね」,"""Well, there are physical education lessons ...... It is no use helping people who are not passionate about it""",
com_ev_16_295,「興味はあるけど、まだ入りたいという程ではないわね」,"""I am interested but it's not that I want to enter yet.""",
