key,jp,en,commentcom_ev_16_296,「コイカツ部って定員とかあるのかしら？　私も入れる？　興味があるの」,"""Is there a quota of the Koikatsu department? I am also interested and I am interested.""",
com_ev_16_297,「えぇ、いいわよ。どうかしたの？」,"""Well, OK, have you come?""",
com_ev_16_298,「だから、普通目的地を先に言うものよ。異性にその誘い方は下手過ぎるわ」,"""That's why I usually tell the destination first, that way of inviting me to the opposite sex is too bad.""",
com_ev_16_299,「はぁもぅ……本当にアナタって人は……救いようがないわね」,"""Ha ha ... ... really people are ... you can not save it""",
com_ev_16_300,「なっ！　もう！　皆の迷惑になるでしょ！　恥をかかせないで」,"""It will be annoying to everyone! Do not shame me.""",
com_ev_16_301,「見たいと言えば見せてあげるのに……はぁ、わかってるわ。それじゃ興奮しないんでしょ？」,"""I will show you if I say I want to see ... ... Ha, I know, I do not get excited about that, are not you?""",
com_ev_16_302,「もー！　常識をわきまえなさい！　私の監督不行き届きにもなるのよ！」,"""Well! Be aware of common sense! It will also be my director's failure!""",
com_ev_16_303,「私は怒っています。何故かは自分で考えて、きちんと対応すること」,"""I am angry, thinking for me why and responding properly""",
com_ev_16_304,「アナタ、意識が低いのよ。パートナーとしてもう少ししっかりして欲しいわ」,"""You are low conscious, I want you to be a partner as a partner""",
com_ev_16_305,「本当にごめんなさい。急用があるの。絶対埋め合わせはするから」,"""I'm really sorry, I have urgent business, I will absolutely make up for it""",
com_ev_16_306,「あら覗き？　結局男って、より強い刺激を求める生き物なのね……はぁ……」,"""Peeping, after all man is a creature looking for a stronger stimulus ... ... haha ​​...""",
com_ev_16_307,「うっ！　なんでアナタはもうそうやって……は、恥を知りなさい！」,"""Why! Anata already doing that ... ... please be ashamed!""",
com_ev_16_308,「色々考えてみたけど結果は同じ。アナタは肌の露出という希少価値に欲情してるのね」,"""I have thought of various things, but the result is the same. You are lustful with the rare value of exposing your skin.""",
com_ev_16_309,「これだけ肌色が並んでいると目移りする？　ふーん、今から首、動かすの禁止」,"""Do you notice that as so many skin colors are lined up? Hmmm, forbidden to move your neck from now on,""",
com_ev_16_310,「あら、来たのね。アナタとここで見る空は特別よ……」,"""Oh, you came, you and the sky you see here are special ... ....""",
com_ev_16_311,「あまり人前でベタベタするものではないわ。控えてね」,"""It's not something sticky in public, so do not forget it.""",
com_ev_16_312,「恋愛マニュアルでも読みに来たの？　フフッ、もうそんなのいらないでしょう？」,"""Have you come to read it even with a romance manual? Huh, you do not need that anymore?""",
com_ev_16_313,「別に話したいのはいいけど、早く行かなくていいの？」,"""I would like to talk to you separately, but do not you have to go early?""",
com_ev_16_314,「連帯責任って知ってる？　もうアナタ一人の恥では済まないのよ？」,"""Do you know solidarity responsibility? It is not a shame for any one anymore?""",
com_ev_16_315,「予定に変更はない？　都合が悪くなったら、早めに言ってね」,"""There is no change in the schedule? If it is not convenient, please say it early.""",
com_ev_16_316,「あら、憧れの彼氏さん、いつ話かけてくれるのかと待ってたわよ」,"""Oh, my longing boyfriend, I was waiting for you to talk to me.""",
com_ev_16_317,「ねぇ……耳貸して……私ね……今、体疼いちゃってるの……だから……ね？」,"""Hey ... ... lend me your ears ...... I ... ... I'm feeling painful now ... So ...?",
com_ev_16_318,「見学だけじゃつまらないんじゃない？　一緒にやりましょ？」,"""It is not boring not only for tourism but for me to do it together?""",
com_ev_16_319,「アナタもやってみない？　絶対楽しいわよ」,"""Would you like to try it too? It is absolutely fun""",
com_ev_16_320,「今日はコイカツしないの？　私、空いてるわよ？」,"""Are not you going to cut it today? Am I free?""",
com_ev_16_321,「さて、お昼ね。今日はどうする？」,"""Well, lunch time. What do you do today?""",
com_ev_16_322,「おつかれさま。放課後の予定はどうなってるの？」,"""Okay, what's the schedule for after school?""",
com_ev_16_323,「んもぅ！　だからおどかすのやめてって言ってるのにっ……」,"""Mommy! So I told you not to be afraid ... ....""",
com_ev_16_324,「この後の予定はどうなっているの？　私が付き合える事なら何でも言って」,"""What's the schedule after this? Please say anything if I can go out with you.""",
com_ev_16_325,「もちろんよ、私が選んだのだもの。間違いないわ、自信を持ちなさい」,"""Of course, what I chose, there is no mistake, be confident.""",
com_ev_16_326,「いきなりどうしたの？　何か言われたりした？　聞いてあげるから、全部吐き出しなさい」,"""What happened suddenly? Did you say something? Because I will hear you, please spit it all out.""",
com_ev_16_327,「えっ、入ってる……わよ？　まさか匂う？　結構気を使っているのだけれど。ねぇどうなの？」,"""Eh, it's okay ... It smells sweet? It uses quite a lot of energy, but how about you?""",
com_ev_16_328,「うっ……ごめんなさい……昨日はちょっと……忙しくて……今日はあまり近寄らないで」,"""Wow ...... I'm sorry ... Yesterday a bit ... ... I'm too busy ... do not get too close today.""",
com_ev_16_329,「つけてるわよ。ナイトブラっていうのがあるの。フフッ、見たい？」,"""I'm turning on, there's a night-bra, do you want to see it, huh?""",
com_ev_16_330,「つけてないわね。なんだか息苦しくって」,"""I do not have it, something stuffy""",
com_ev_16_331,「もちろんあるわ。最近一つ追加されたの。アナタにも関係ある事よ、ふふっ」,"""Of course there is one, recently added one thing, it also relates to you, hehe""",
com_ev_16_332,「ない……のよね。漠然としていて、これだというものが見つからないの……」,"""Not ... ... it's vague and I can not find what this is ... ...""",
com_ev_16_333,「アナタ……たまに空気が読めないのよね。気を付けなさい」,"""You ... you can not read the air occasionally, please be careful.""",
com_ev_16_334,「へぇ、そんなに懐くのね。ちょっと見てみたいわ」,"""Well, I'm pretty familiar. I'd like to see it for a while.""",
com_ev_16_335,「不毛ね……普通、面白い話でするものでしょそれ。まぁ、いいけど」,"""It's fruity ... normal, it's a funny story, is not it. Well, it's okay,""",
com_ev_16_336,「それはもう沢山あるわ。でも焦らず、一つずつやっていきましょ」,"""There are lots of it already, but I will not rush, I will do it one by one.""",
com_ev_16_337,「特にないわよ。自然体でも十分。だからといって、怠けていいというわけではないからね？」,"""There is nothing in particular, even a natural body is sufficient, but is not it that I can not be lazy?""",
com_ev_16_338,「当たり前でしょ。助け合うからこそパートナーなのだから。何か困っているの？」,"""Naturally you are a partner because you help each other, are you in trouble?""",
com_ev_16_339,「場合によっては敢えて傍観するという選択肢もあるわ。その方がより成長を見込める場合ね」,"""In some cases you have the option of daringly watching the sidelines, which is where you can expect more growth""",
com_ev_16_340,「うっ……少し浮かれ気味な自覚はあるわ。でも、周りに遠慮していたら恋なんてできないもの」,"""Wow ...... There is a conscious awareness that it is a little overwhelming, but what you can not fall in love with is nothing to do with you""",
com_ev_16_341,「そんな事ないと思うけど。なに？　もっとスキンシップが欲しいの？」,"""I do not think so, but what do you want more skinning?""",
com_ev_16_342,「えぇ、当然よ。将来設計はきちんとしないと。そうね、今度きちんと話し合いましょうか」,"""Well, of course, I have to design properly in the future ... Well, shall I talk properly this time?""",
com_ev_16_343,「えっ、あの……ごめんなさい。まだ時期尚早だと思うの……もう少し待ってくれる？」,"""Er, that ... ... I'm sorry, I think it's still premature ... will you wait a little longer?""",
com_ev_16_344,「もうちょっと話題を考えて欲しいものね。彼女だからと油断しない事」,"""I want you to think about a topic a bit more, because things are her, do not get caught""",
com_ev_16_345,「えぇ、私もよ。フフッ、どうしたの？　何かして欲しいのかしら？」,"""Yeah, well, I'm sorry, what do you want, something you want?""",
com_ev_16_346,「ふーん、奇遇ね。私もよ。でもお互い、きちんとやるべき事はやらないとね」,"""Oh no, it's a strange idea, neither ... But each other, we must do what we need to do.""",
com_ev_16_347,「うーん、あるわね……。そういう時はきちんと言うから、協力してね」,"""Well, that's right ... ... because that's exactly the case, cooperate.""",
com_ev_16_348,「あまりないかしら……というか、それを聞いてどうするつもりなの？」,"""I wonder if they are not so much ... what do you mean by listening to it?""",
com_ev_16_349,「そ、そうね……やっぱり、一番敏感なところだから……」,"""Well, yeah ... after all, it is the most sensitive place ...""",
com_ev_16_350,「全体を優しく揉まれる方が好きよ。愛されてるって感じがするの」,"""I prefer to gently rub the whole thing, I feel like being loved.""",
com_ev_16_351,「す、好きよ。いやらしくアナタの舌が絡み付いてきて……やだ、私何言ってるのかしらね。あは……」,"""I like it, a taste of yours is getting entangled, obviously ... .... I wonder what he is saying ....""",
com_ev_16_352,「もちろん、好きだけど……普通のキスの方が好きかしら」,"""Of course, I like it ... ... Do you prefer normal kisses?""",
com_ev_16_353,「そ、そうよ……そういう所ですもの。変な事なんて何もないわ。普通なのよ……普通」,"""Well, that's right ...... That's the place ... There's nothing weird about. It's normal ... normal.""",
com_ev_16_354,「その日にもよりけりよ。ちゃんと私が弄って欲しいところ……わかってね？」,"""Also on that day, where I want my finger to finger properly ... Do you understand?""",
com_ev_16_355,「ほんと、男は下半身で生きてるって実感させられるわ……はぁ……」,"""Indeed, it makes me realize that the man is living in the lower body ... ... Ha ...""",
com_ev_16_356,「どうだったって……気持ち良かったわよ……一緒になるってこういう事なんだって思ったわ」,"""How was it ... it was comfortable ... I thought it was such a thing to be together""",
com_ev_16_357,「それが見れるかはアナタ次第でしょ？　フフッ、努力してみなさい」,"""It depends on you whether you can see it, do not you try hard?""",
com_ev_16_358,「私、アナタの事になると情緒不安定になりやすいの。嫌いになったりしてない？」,"""I, being a thing of you, it is easy to become emotional instability.Did not you hate it?""",
com_ev_16_359,「そう、よかった。すぐ慣れると思うから、少しの間だけ我慢してね」,"""Yes, it's good, I think I will get used soon, so be patient for a while.""",
com_ev_16_360,「やっぱり……直すわ、すぐ直す。だから、ほんの少しでいいから時間を頂戴？」,"""After all ... I fix it, I fix it soon. So, why do not you give me some time because I need only a little?""",
com_ev_16_361,「疲れてるんじゃない？　甘えたい時はいつでも言ってくれていいんだからね」,"""Do not you feel tired? Because you can always tell me when you want to take some time.""",
com_ev_16_362,「あら大変。休憩も大事よ。膝枕……してあげましょうか？」,"""Oh dear, break is also important, Should we do a knee pillow ...?""",
com_ev_16_363,「ならよかった。余裕があるなら、私が甘えちゃおうかしら？　ふふふっ」,"""I wish it would be nice if I could afford, I wonder if I can relax""",
com_ev_16_364,「将来設計の話だけど、あと５年、長くとも１０年の間には結婚を見据える形でいいかしら？」,"""Although it is a story of future design, may we be looking at marriage for another five years, at least ten years?""",
com_ev_16_365,「うん、よろしくね。頼りにしているんだから。ふふっ、未来の旦那様っ」,"""Yeah, I'm counting on you because I'm counting on you, Husband, my husband of the future""",
com_ev_16_366,「もう、ちゃんと考えてくれないと困るわ。二人の事なのよ？　もっと真剣になって」,"""I'm in trouble if I do not think about it properly, it's about the two of us, get more serious.""",
com_ev_16_367,「新しい技を覚えたの、今度のエッチで試していい？」,"""I learned a new technique, can I try it with my next etch?""",
com_ev_16_368,「んふっ、絶対気持ちよくしてみせるから。期待してて」,"""Huh, I will make it absolutely pleasant, expect it.""",
com_ev_16_369,「アナタって、オナニーはエッチな本でするの？　それともエッチなビデオ？」,"""Are you doing masturbation with a horny book or a horny video?""",
com_ev_16_370,「えっ……そ、そうなのね。あ、えと……じゃあ……今日は……」,"""Well ... that's right, oh, oh ... ... then ... today ... ....""",
com_ev_16_371,「私達っていい感じだと思わない？　自惚れ過ぎかしら？」,"""Do not you think that we are a good feeling, are you too self-conceited?""",
com_ev_16_372,「フフッ、そういうノリ好きよ。やっぱりアナタを選んで良かった……」,"""Fuh, I like that kind of thing, it was good to pick you up ...""",
com_ev_16_373,「えっと……私の胸ってどうなのかしら？　好き？」,"""Er ... ... How is my breast like?""",
com_ev_16_374,「そ、そう……やっぱり大きいのが好きなのね。垂れないように頑張るわ」,"""Well, that's ... I like being big after all, I will try my best not to sag.""",
com_ev_16_375,「私の胸は美乳って言うの？　そ、そう……色々あるのね……」,"""My breasts are saying beautiful breasts, that ... ... there are various things ...""",
com_ev_16_376,「小さいなりの魅力か……うん、そういう考え方もあるわよね。ふふ、嬉しい」,"""Is it a little appeal ... Well, there are such ways of thinking.",
com_ev_16_377,「私の身長って、アナタ的にはどうなのかしら？」,"""How about my height, how about you?""",
com_ev_16_378,「高くてもいいのね。ちょっと意外だけど……うん、嬉しい……」,"""It's okay if it's high, but it's a bit surprising .... Yeah, I'm happy ...""",
com_ev_16_379,「私が普通の基準なの？　ふふ、嬉しい事言ってくれるわね」,"""I am an ordinary standard, Hehuu, you will be happy to say things""",
com_ev_16_380,「ありがと。小さい方が色々便利だものね。あの時とか……ふふっ」,"""Thanks. The smaller one is variously convenient, at that time ... ... Huhu""",
com_ev_16_381,「体型の好みを聞いてもいいかしら？　できるだけ合わせるから」,"""May I ask the preference of my figure? Because I will fit it as much as possible""",
com_ev_16_382,「えっ、このままでいいの？　自分で言うのもアレだけど……ぷにぷによ？」,"""Well, I do not care as long as I can say it myself ... but what about punipuni?""",
com_ev_16_383,「現状維持ね。実は一番大変なのだけれど……ふふっ、頑張るわ」,"""Maintaining the status quo, actually it's the hardest thing ... but ... I'll do my best, I'll do my best.""",
com_ev_16_384,「んふっ、かよわい私を守って頂戴ね。ア、ナ、タ」,"""Huh, be protecting me for good-looking, Auna, Ta.""",
com_ev_16_385,「うぅーん、変えられる所は努力するけど……少しは譲歩してね」,"""Wow, I will make efforts to change, but ... make a concession a little.""",
com_ev_16_386,「恋人同士になったからこそ、しっかりして欲しいところもあるの……わかってよ……」,"""Because I became lovers, there are also places I want solidly ...... I understand ...""",
com_ev_16_387,「うん。もういいから。私も色々言ってごめんなさい」,"""Yeah ... It's already okay, I am sorry to say various things.""",
com_ev_16_388,「真面目さが感じられないわ。意識が低いと言ってるの」,"""I do not feel serious, I say that consciousness is low""",
com_ev_16_389,「なに？　見惚れてるのかしら？」,"""What, are you looking at me?""",
com_ev_16_390,「目だけで通じ合えるような仲になりたいわね。ちなみに、私は今しつこいって思ってるわ」,"""I'd like to be friends with eyes alone, by the way, I think I'm persistent now""",
com_ev_16_391,「な、なによ……あんまり見つめられると……恥ずかしいから……」,"""Why, what are you ... when you look so much ... it's embarrassing ... ....""",
com_ev_16_392,「好きなだけ見ていいけど、流石に人目は気にしてね？」,"""You can see as much as you like, but care about the eye for rocks?""",
com_ev_16_393,「はぁ……顔も下半身もだらしない事になってる。そろそろやめないと怒るわよ」,"""Haa ...... It's supposed to be sloppy for both face and lower body. I will get angry if I do not stop it.""",
com_ev_16_394,「もう、見過ぎよ。好きなだけって言ったけど、限度というものがあるわ」,"""I've already seen it, I told you I liked it, but there is a limit.""",
com_ev_16_395,「私にも感情はあるの。そこを踏まえて行動して欲しいものね」,"""I have emotions, I want you to behave accordingly.""",
com_ev_16_396,「あっ、恋人繋ぎね。これ……少し憧れだったのよ」,"""Ah, my lover is tied up ... this was a longing for me""",
com_ev_16_397,「あのねぇ……同じ事で注意され続けて恥ずかしくないの？」,"""Hey ... ... Is it not embarrassing to keep being careful with the same thing?""",
com_ev_16_398,「こら、しつこいのは悪い癖よ。直しなさい」,"""What, you are persistent is a bad habit. Please fix it.""",
com_ev_16_399,「んっ……もぅ、オイタはだめよ」,"""Wha ... ... well, Oita is useless""",
com_ev_16_400,「ひゃっ……少しお説教が必要なようね。覚悟なさい」,"""Huh ... it seems necessary to preach somewhat. Please be prepared.""",
com_ev_16_401,「こーら、時と場所を考えなさい。周りに見られたらどうするの」,"""Think about time and place, what are you going to do if you look around?""",
com_ev_16_402,「フフッ。私、なにか褒められるような事した？」,"""Huh ... I, did you do something like that?""",
com_ev_16_403,「ちょっともう、いつまでするつもり？　うぅ、頭フラフラしてきたわ……」,"""How long are you going to be?"" Huh, I caught my head ...",
com_ev_16_404,「もうわかったから。恥ずかしくなっちゃうでしょ」,"""Because I understood it, I will be ashamed.""",
com_ev_16_405,「ふにゅっ……んもう、子供みたいな事しないのっ」,"""Fu-kyu ... I do not do things like children anymore""",
com_ev_16_406,「こーらぁー、ほっぺた熱くなってきちゃったでしょ」,"""Hey, hey, it's getting hotter, is not it?""",
com_ev_16_407,「なぁに？　やーめーなーさいっ」,"""What is it?""",
com_ev_16_408,「あのねぇ、怒ってるのわからない？　まず言うべき事、あるわよね？」,"""Hey, are you mad, do not you have a thing to say first?""",
com_ev_16_409,「はぁ、私緊張し過ぎね。アナタの前だと調子狂っちゃうわ」,"""Hey, I'm too nervous, I'm going crazy when you're in front of you.""",
com_ev_16_410,「お話だけでいいの？　私はいつでも待ってるから、遠慮しないでね？」,"""Is it ok to just talk? I will be waiting anytime, so do not hold back.""",
com_ev_16_411,「本当に有意義な時間ね。アナタと一緒というだけで満足よ」,"""It's a really meaningful time, I'm satisfied with just having with you.""",
com_ev_16_412,「待っててあげるから、ゆっくり考えなさい」,"""I will wait, think slowly""",
com_ev_16_413,「早くして、時間がもったいないわ」,"""Take it quick, time is wasteful""",
com_ev_16_414,「私、アナタには大分甘いつもりよ。それを怒らせたのだから、大したものね」,"""I, I'm going to be too sweet for you, I made it angry, so it's a big deal.""",
com_ev_16_415,「私が悪いの？　違うわよね？」,"""Is it wrong with me, is not it?""",
com_ev_16_416,「できればもっと一緒にいたいのだけど……またすぐ誘ってね」,"""I would like to be together more if possible, but ... invite me again soon.""",
com_ev_16_417,「ねぇ、私もう限界よ。抱いてくれないの？」,"""Hey, I am already the limit, can not you embrace me?""",
com_ev_16_418,「ふぅ、満足したわ。アナタはどう？　私、何か与えられてるかしら？」,"""Well, I'm satisfied, how about you, am I giving something?""",
com_ev_16_419,「もう行っちゃうの？　う、うぅん、なんでもない……またね」,"""I will go already, no, no, not at all ...""",
com_ev_16_420,「えぇ、それじゃまた。今度は私から話しかけるわね」,"""Well then, I will speak to you again next time.""",
com_ev_16_421,「私が怒ってるから、面倒だって思ったの？　それは無責任過ぎるんじゃない？」,"""Because I am angry, did you think that I was troubled? Is not it too irresponsible?""",
com_ev_16_422,「色々頑張ってみたけど、私達合ってないと思う……もう別れましょう？」,"""I tried hard but I think we are not fitting ... Would you like to break up already?""",
com_ev_16_423,「あっ、う、うん……いいわよ。恋人なら……当然の事だものね」,"""Ah, yes, yes ... OK, if it's a lover ... that's natural.""",
com_ev_16_424,「お願い、体が変なのよ。もう我慢できないから……抱いて欲しいの」,"""Please, your body is strange, I can not hold it anymore ... so I want you to hold me.""",
com_ev_16_425,「ぁっ……嬉しい。もう私の事、好きにしていいからね」,"""Well ... I'm happy, because I can already like me.""",
com_ev_16_426,「そんなっ、じゃあ私はどうすれば……うぅ、ねぇ、ホントにだめ？」,"""Well, then how do I ... Wow, hey, really is not it?""",
com_ev_16_427,「えっ、ここ？　だって皆いるし……そ、そう……そういう事。フフッ、面白そうね」,"""Eh, everyone here is there ... everyone ... that ... that ... that kind of thing ... Fuh, it looks interesting, is not it?""",
com_ev_16_428,「ありえないわ。私はそんな変態じゃない。気持ちよくなれれば良いってものじゃないの」,"""It is impossible, I am not such a pervert, it is not good to be comfortable.""",
com_ev_16_429,「なっ、ぇっ……ホントに変態なんだから。まぁ私も……人の事は言えないけど」,"""Well, well ... well, it is really a metaphor ... Well I am also ... ... I can not tell people.""",
com_ev_16_430,「そういうアブノーマルな経験はいらないわ。普通にしましょ」,"""I do not need such an abnormal experience. Let's do it normally.""",
com_ev_16_431,「えぇ、一緒に食べましょ。ふふ、実は楽しみにしてたの」,"""Well, we should eat it together, hehehe, I was really looking forward to it""",
com_ev_16_432,「えっと、私から誘うわね。お昼、一緒に食べましょう？」,"""Well, I'll invite from myself. Would you like to have lunch together?""",
com_ev_16_433,「そう、よかった……その、アナタが中々誘ってくれないから……」,"""Yeah, that was good ... that, because you do not invite me around inside ...""",
